platform,prospect_name,company,audience_type,audience_metric,intent_score,contactability_score,freshness_score,total_score,website,email,contact_url,evidence_url,evidence_quote,created_date,source_title,source_excerpt,author_handle
youtube,KISSS Career Coaching,,yt_subscribers,20400,1,0,2,6,,,,https://www.youtube.com/channel/UCT5vLoyyKmhRbCHZBRM-lpQ,coaching,2025-10-06,Channel: KISSS Career Coaching (avg_views:76172),"Resume Tips
Job Interview Tips
Job Search Tips
Career Tips

KISSS = Keep It Short, Simple & Specific

My name is Bart Zych and I am your career coach. I help students and clients write their best resumes, gain confidence and skills to answer job interview questions effectively, and get the jobs they",KISSS Career Coaching
youtube,Joan Thuo (The Career Coach),,yt_subscribers,11700,1,0,2,6,,,,https://www.youtube.com/channel/UCjL4k9QeDTVeHlhs1uXQX-A,coaching,2025-10-06,Channel: Joan Thuo (The Career Coach) (avg_views:826),"My name is Joan The Career Coach. I am a result-driven HR Professional and Career Coach. As a Career Coach, I aim to bridge the global unemployment gap through assisting my clients in strategic job research and finding the right career paths.

My excellent understanding of Psychology combined with p",Joan Thuo (The Career Coach)
youtube,Career Success by Jenn Tardy,,yt_subscribers,12100,1,0,2,6,,,,https://www.youtube.com/channel/UClDnozQwswtZDuVO9dR04ng,coaching,2025-10-06,Channel: Career Success by Jenn Tardy (avg_views:7000),"Ready to work with me? Join Inner Circle? www.JenniferTardy.com/inner-circle 

We are not your average virtual career coaching program. In fact, there’s nothing typical about our style and approach—from the topics we discuss to the way we teach you to acknowledge and go after your goals and desires.",Career Success by Jenn Tardy
youtube,FocusRx | Customized Career Coaching,,yt_subscribers,20000,1,0,2,6,,,,https://www.youtube.com/channel/UC0ZpTXIPeVdQqKPIVUrTjiQ,coaching,2025-10-06,Channel: FocusRx | Customized Career Coaching (avg_views:3524),"🔅 ‘FocusRx’ on YouTube, LinkedIn, Instagram, and TikTok

Resume Templates, personalized resume reviews, 1-on-1 coaching, and courses ⇩
www.focusrxpharma.com/
",FocusRx | Customized Career Coaching
youtube,Copy That!,,yt_subscribers,71100,1,0,2,6,,,,https://www.youtube.com/channel/UCPrVjDohW98GDxq99E8eHUQ,copywriting,2025-10-06,Channel: Copy That! (avg_views:2050),"Helping folks launch or grow their copywriting careers for free. 

Copy That! is hosted by four copywriters and marketers named Alex, Rod, Lindsey, and Sean with about 40 years of combined experience across different niches and styles. No other copywriting YouTube channel offers such a quantity or v",Copy That!
youtube,Hustlepost Academy: Freelancing & Side Hustles!,,yt_subscribers,18200,1,0,2,6,,,,https://www.youtube.com/channel/UCIXix4du0yclaKHQzuqYA-Q,academy,2025-10-06,Channel: Hustlepost Academy: Freelancing & Side Hustles! (avg_views:2167),,Hustlepost Academy: Freelancing & Side Hustles!
youtube,Benoit et Joseph - Les Copywriters,,yt_subscribers,28800,1,0,2,6,,,,https://www.youtube.com/channel/UCBkjr1BaDQ4leJsMbxRFxfg,copywriting,2025-10-06,Channel: Benoit et Joseph - Les Copywriters  (avg_views:1492),"Hello ici Benoit et Joseph :) #lescopywriters

Nous sommes 2 copywriters professionnels depuis 8 ans cumulés.

Après avoir générés des millions d'euros pour des dizaines de clients, on a décidé d'enseigner le copywriting en ligne pour les personnes ambitieuses comme toi.

À ce jour nous avons formés",Benoit et Joseph - Les Copywriters 
youtube,Mari Smith,,yt_subscribers,17000,1,0,2,6,,,,https://www.youtube.com/channel/UCqHUdxUEtnX6LqUrwVC1Gnw,system,2025-10-06,Channel: Mari Smith (avg_views:225),"Often referred to as “the Queen of Facebook,” since 2007 Mari (""like Ferrari!"") Smith is widely known as the Premier FACEBOOK MARKETING Expert and a top SOCIAL MEDIA Thought Leader. IBM named Mari as ""one of seven women that are shaping digital marketing."" She is an in-demand keynote speaker, dynami",Mari Smith
youtube,Maïder Tomasena Copywriting,,yt_subscribers,92600,1,0,2,6,,,,https://www.youtube.com/channel/UCjeluGIwXm0srOpc5toFb3g,copywriting,2025-10-06,Channel: Maïder Tomasena Copywriting (avg_views:1478),"🔔 Te doy la bienvenida a tu terapia de comunicación profesional.

Después de 13 años viendo cómo los profesionales nos dividimos para comunicar, he creado este canal para algo urgente:

💬 Enseñarte comunicación fluorescente: fusionar tu parte adulta y tu parte infantil.

Porque tu email perfecto no ",Maïder Tomasena Copywriting
youtube,Copy Squad,,yt_subscribers,30200,1,0,2,6,,,,https://www.youtube.com/channel/UCyJMmLY2e-AsmYJUJXsJEpA,copywriting,2025-10-06,Channel: Copy Squad (avg_views:1897),"What's up Copy Squad! I'm Kyle The Writer - or Copywriter. 

My channel offers copywriting tips and tricks for beginners and veterans alike. 

In 2018 I helped gross over $7.1 million while working with some incredible best-selling authors!

In 2020, while Copy Chief of around one dozen copywriters,",Copy Squad
youtube,Max Längsfeld | Copywriting & KI-Automation,,yt_subscribers,11300,1,0,2,6,,,,https://www.youtube.com/channel/UCGADna4SMJ-UDixKStnEJLA,marketing,2025-10-06,Channel: Max Längsfeld | Copywriting & KI-Automation (avg_views:370),"Hey, Max hier ✌🏻. Seit 9+ Jahren lebe ich davon, online mit Copywriting und (KI-)Automationen Firmen zu helfen & bringe das nun auch anderen bei, und hier gebe Einblick in meine Praxis und Erkenntnisse.

Auf diesem Kanal findest du Guides zu Copywriting, Marketing, KI-Automation und Kundengewinnung ",Max Längsfeld | Copywriting & KI-Automation
youtube,Armash Kamal,,yt_subscribers,59100,1,0,2,6,,,,https://www.youtube.com/channel/UCLxDMNCX8nhJh5R1s5FodHw,copywriting,2025-10-06,Channel: Armash Kamal (avg_views:1185),"Get the information, strategies, tools, and resources to master the high-income skill of copywriting fast. I'm on a mission to empower 1 million people to get rid of the conventional 9 to 5 path and make a handsome income from the comfort of their homes with copywriting. Are you one of them?!
",Armash Kamal
youtube,Business Blueprint,,yt_subscribers,46800,1,0,2,6,,,,https://www.youtube.com/channel/UCo4qnwtUi_5e-iB1W3ChixQ,blueprint,2025-10-06,Channel: Business Blueprint (avg_views:25263),"Welcome to our channel dedicated to business, entrepreneurship and professional growth. We are here to provide you with valuable information, effective strategies and inspiration to help you achieve success in the world of business.

📈 In our channel we will explore:

✅ Tips for starting a new busin",Business Blueprint
youtube,Oz Konar - Business Lending Blueprint,,yt_subscribers,48900,1,0,2,6,,,,https://www.youtube.com/channel/UCz7miT0ZlET8dHI6SAvZ7lQ,blueprint,2025-10-06,Channel: Oz Konar - Business Lending Blueprint (avg_views:802),"Oz Konar is the President and the Founder of Business Lending Blueprint. 
His training program has been helping thousands of driven people start their own business and become business loan brokers
. 
Business Lending Blueprint is the most comprehensive training program teaching entrepreneurial minde",Oz Konar - Business Lending Blueprint
youtube,MIT Bootcamps,,yt_subscribers,17800,1,0,2,6,,,,https://www.youtube.com/channel/UCPonD0FH2WNnEXyTsYiLWMw,bootcamp,2025-10-06,Channel: MIT Bootcamps (avg_views:832),"We are a scrappy team of entrepreneurs, artists, and innovators working with MIT's Office of Open Learning.  

To date, we have created 3 Entrepreneurship MOOCs alongside MIT Professors: Entrepreneurship 101, 102, with Professor Bill Aulet, and User Innovation, with Professor Eric von Hippel.

You c",MIT Bootcamps
youtube,Guest Focus - Tour Business Coaching,,yt_subscribers,20800,1,0,2,6,,,,https://www.youtube.com/channel/UCjmTLrFX73_g9m1VIuJx76A,coaching,2025-10-06,Channel: Guest Focus - Tour Business Coaching (avg_views:181),"We feel for hard working tour business entrepreneurs who feel alone, overwhelmed, and frustrated that they're not getting enough bookings.

That's why we created a tour business coaching program and a simple, step-by-step process to create, market and sell unforgettable experiences.

Since 2015, we'",Guest Focus - Tour Business Coaching
youtube,David Moerman I Home Service Business Coach,,yt_subscribers,16100,1,0,2,6,,,,https://www.youtube.com/channel/UCLSogjwDrMJ2JK8K4AnnznA,coach,2025-10-06,Channel: David Moerman I Home Service Business Coach (avg_views:458),"I help home service business owners scale their company for more income & freedom. 360+ companies scaled up, Dad & golf enthusiast. 
",David Moerman I Home Service Business Coach
youtube,The KAJ Masterclass LIVE,,yt_subscribers,20300,1,0,2,6,,,,https://www.youtube.com/channel/UCR08l3RBj7zAdD4MnuPuicw,masterclass,2025-10-06,Channel: The KAJ Masterclass LIVE (avg_views:63),"Learn business, entrepreneurship, career growth, money, mindset & AI from global leaders — daily expert interviews with Khudania Ajay.

🎓 KAJ Masterclass LIVE – Learn. Grow. Transform.

Your hub for expert-led learning in business growth, entrepreneurship strategies, career development, financial li",The KAJ Masterclass LIVE
youtube,Greg Dickerson,,yt_subscribers,70700,1,0,2,6,,,,https://www.youtube.com/channel/UCFrYIWkwYECFeV3ppNwcvag,school,2025-10-06,Channel: Greg Dickerson (avg_views:609),"Greg is a serial entrepreneur, real estate developer and mentor to high level investors and entrepreneurs. He has bought, developed and sold over $250 million in real estate, built and renovated hundreds of custom homes and commercial buildings, developed residential and mixed use subdivisions and s",Greg Dickerson
youtube,1001 ENTREPRENEURS,,yt_subscribers,10500,1,0,2,6,,,,https://www.youtube.com/channel/UC8UppjH9nb27Tmp5_3ST6vQ,challenge,2025-10-06,Channel: 1001 ENTREPRENEURS (avg_views:10326),"1001 Entrepreneurs is a YouTube channel dedicated to providing helpful tips and ideas on entrepreneurship development. Our channel is designed to help aspiring entrepreneurs take their first steps towards success. Whether you're just starting out or you're a seasoned entrepreneur, you'll find valuab",1001 ENTREPRENEURS
youtube,smarttricker101,,yt_subscribers,21200,1,0,2,6,,,,https://www.youtube.com/channel/UCcdMCGiLuNG1UltgtXSGKxQ,entrepreneurship,2025-10-06,Channel: smarttricker101 (avg_views:742),"Tutorials, entrepreneurship, technology, tips and tricks, magic, and more! Subscribe for more videos!",smarttricker101
youtube,Business Credit Workshop,,yt_subscribers,17700,1,0,2,6,,,,https://www.youtube.com/channel/UCqLsHaZ3Zq4Me_KJbwCvkRw,workshop,2025-10-06,Channel: Business Credit Workshop (avg_views:6717),"Your Guide to Wealth and Success

Welcome to a world where financial freedom is not just a dream, but an achievable goal. Led by Joe Lawrence, an expert in business credit and a best-selling author, who's passionate about empowering entrepreneurs.

🚀 What We Offer:

Insightful strategies for busines",Business Credit Workshop
youtube,Axiom Fitness Academy - Personal Trainer Education,,yt_subscribers,31000,1,0,2,6,,,,https://www.youtube.com/channel/UCrcVbWs9v5ju0N7NAprvyxg,mentorship,2025-10-06,Channel: Axiom Fitness Academy - Personal Trainer Education (avg_views:949),"The Axiom Fitness Academy helps new and aspiring fitness professionals achieve long-lasting and lucrative careers through hands-on training and expert guidance.

Located in sunny South Florida, Axiom has partnered with the National Academy of Sports Medicine to provide the best hands-on and virtual ",Axiom Fitness Academy - Personal Trainer Education
youtube,Newbie Fitness Academy,,yt_subscribers,82500,1,0,2,6,,,,https://www.youtube.com/channel/UCx_6csb499G05FvpnkbDJdQ,coach,2025-10-06,Channel: Newbie Fitness Academy (avg_views:1325),"Newbie Fitness Academy is where busy professionals turn to get actionable and easy to implement fat loss advice

My channel is about giving you a fighting chance at losing all the unwanted and stubborn fat that's been living rent free in your body all this time, without going on a crazy diet or spen",Newbie Fitness Academy
youtube,The Fitness Journals LLC,,yt_subscribers,47400,1,0,2,6,,,,https://www.youtube.com/channel/UCEYSulis3EtCRK8GiqfzVzg,fitness,2025-10-06,Channel: The Fitness Journals LLC (avg_views:1205),"On this channel, I am dedicated to providing each viewer with in-depth yet easy to understand information about improving their fitness (calisthenics). The Fitness Journals LLC is an online health and fitness company dedicated to eliminating myths about becoming the best version of yourself through ",The Fitness Journals LLC
youtube,Burn Boot Camp,,yt_subscribers,99100,1,0,2,6,,,,https://www.youtube.com/channel/UCHUhA3C3vgTnyXHtAfsivgw,bootcamp,2025-10-06,Channel: Burn Boot Camp (avg_views:68938),"Founded in 2012 by husband-wife duo Devan and Morgan Kline, Burn Boot Camp is a national fitness concept that helps women and their families create healthy lifestyles by building strength and confidence. 

With unlimited 45-minute circuit-style Camps, complimentary Childwatch, and a unique Floating ",Burn Boot Camp
youtube,ACEfitness,,yt_subscribers,87600,1,0,2,6,,,,https://www.youtube.com/channel/UCTfXYIfOhduKD7Mo9O_oKDA,coach,2025-10-06,Channel: ACEfitness (avg_views:486),"At the American Council on Exercise (ACE), our mission is to get people moving, improving lives of people everywhere through physical activity. Since 1985, we have been the leading non-profit education and certification provider for health coaches and exercise professionals worldwide. With over 90,0",ACEfitness
youtube,Frayzo Fitness,,yt_subscribers,10200,1,0,2,6,,,,https://www.youtube.com/channel/UCL_tncHMEc_KAnljSL5eGNg,framework,2025-10-06,Channel: Frayzo Fitness  (avg_views:7391),"Welcome to the Frayzo Fitness Framework and welcome to my channel! I’m here to help you level up your fitness journey with expert tips, nutrition advice, and motivational content. Whether you’re looking for quick fitness hacks and/or nutritional advice in my shorts or in-depth strategies in my long-",Frayzo Fitness 
youtube,Jumping Fitness (Official Page),,yt_subscribers,18000,1,0,2,6,,,,https://www.youtube.com/channel/UCYxUVjgGLjMdeFiXi8ybI2A,program,2025-10-06,Channel: Jumping Fitness (Official Page) (avg_views:4872),"Jumping® Fitness is a comprehensive program on specially developed mini-trampolines.The basis is a combination of high and low intensity exercises, fast sprints with balance elements for perfect ""core training"" and exercises to develop explosive strength.

Follow our YouTube channel to see whereabou",Jumping Fitness (Official Page)
youtube,MartinaCoach,,yt_subscribers,41200,1,0,2,6,,,,https://www.youtube.com/channel/UCkIBRkNRm2_CQf61uN_d9zA,coach,2025-10-06,Channel: MartinaCoach (avg_views:5167),"Ahoj! Jsem Martina Marková, certifikovaná trenérka a koučka. Hledáš vědecky ověřenou cestu k trvalým výsledkům ve fitness a zdraví? Jsi tu správně!

Pomohla jsem přes 1700 ženám osobně a 12 000+ účastnicím kurzů objevit život s energií a spokojeností. Teď chci pomoct i tobě!

Už tě nebaví začínat od",MartinaCoach
youtube,DINAZ FITNESS,,yt_subscribers,73700,1,0,2,6,,,,https://www.youtube.com/channel/UC9v8wQR38ISOOmITvkhqxrQ,coach,2025-10-06,Channel: DINAZ FITNESS (avg_views:402),"Hi, My name is Dinaz. I am an entrepreneur and a pioneer in the field of Fitness for 25 years. I am a Guinness World Record holder for the world’s Longest Aerobics Marathon – 26 hours non-stop and also a Guinness World Record holder for the world’s Largest Zumba and Bollywood class. I have been a co",DINAZ FITNESS
youtube,Reliant Fitness,,yt_subscribers,12500,1,0,2,6,,,,https://www.youtube.com/channel/UC6zdYALBOFAYQNgSWQ16-Iw,program,2025-10-06,Channel: Reliant Fitness (avg_views:4466),"I help soft dads cut fat and get jacked. 
1000+ lives transformed on my programs. 
IG- @reliant.fitness
Web- reliant fitness.net
",Reliant Fitness
youtube,UpFace - fitness facial,,yt_subscribers,56100,1,0,2,6,,,,https://www.youtube.com/channel/UC687V26AVDsWN1yc9M9mRJg,fitness,2025-10-06,Channel: UpFace - fitness facial (avg_views:16392),"El método revolucionario de rejuvenecer sin bótox, sin rellenos, sin cirugías estéticas. Es el deporte! Pero para el rostro. Estamos conscientes de que para mantener el cuerpo en buena forma hay que entrenar los músculos. Pero nos olvidamos que la cara tiene 57 músculos faciales que también deben se",UpFace - fitness facial
youtube,OPEX Fitness,,yt_subscribers,35100,1,0,2,6,,,,https://www.youtube.com/channel/UCCgDGih2kSp0A6W_0cVYuaQ,coaching,2025-10-06,Channel: OPEX Fitness (avg_views:71),"Welcome to the OPEX Fitness & CoachRx YouTube Channel, where your journey to becoming a successful fitness coach begins. Our channel is dedicated to empowering coaches with the knowledge, skills, and inspiration needed to transform your passion for fitness into the career of your dreams. We aim to p",OPEX Fitness
youtube,The DB Method,,yt_subscribers,58800,1,0,2,6,,,,https://www.youtube.com/channel/UC-dVGsJPRC4Bd-CL7CsTcjA,method,2025-10-06,Channel: The DB Method (avg_views:3019),"The DB Method is the only bio-mechanically correct device that easily sets the body in the correct form to do the perfect modified squat.  Its patented design is revolutionary as it shifts the body’s center of gravity, isolating the glutes to tone, tighten and lift the butt, while reducing stress on",The DB Method
youtube,Tennis Fitness Training,,yt_subscribers,12000,1,0,2,6,,,,https://www.youtube.com/channel/UCnXUV8sBwgai-XR4ZTs84GA,method,2025-10-06,Channel: Tennis Fitness Training (avg_views:1478),"Our Tennis Fitness Videos are tennis specifc training programs and exercises for tennis. These videos can help tennis players of all levels, reach their maximal potential, by improving their physical performance, maintaining injury prevention and nutritional guidance, whilst providing continual educ",Tennis Fitness Training
youtube,Fitness Culture,,yt_subscribers,91300,1,0,2,6,,,,https://www.youtube.com/channel/UC7HQ61sWvpoxA7eK-1P9icg,program,2025-10-06,Channel: Fitness Culture (avg_views:3717),"Fitness Culture is here to provide world-class Training, Nutrition, and Mobility Programs from industry professionals Steve Cook and Jacob Hutton.",Fitness Culture
youtube,AP & New Principals Academy,,yt_subscribers,24500,1,0,2,6,,,,https://www.youtube.com/channel/UCOA-28Dz-yI11npckyTWTkw,academy,2025-10-06,Channel: AP & New Principals Academy (avg_views:889),Official YouTube Channel for Principal Kafele's AP & New Principals Academy. One of YouTube's top channels for new principal & assistant principal leadership.,AP & New Principals Academy
youtube,African Leadership Academy,,yt_subscribers,12200,1,0,2,6,,,,https://www.youtube.com/channel/UCeAFFRm_fEQUxnpPdwfNVOw,academy,2025-10-06,Channel: African Leadership Academy (avg_views:1670),"African Leadership Academy seeks to transform Africa by developing a powerful network of leaders who will work together to address Africa’s greatest challenges, achieve extraordinary social impact, and accelerate the continent’s growth trajectory.

Learn more at www.africanleadershipacademy.org
",African Leadership Academy
youtube,Leadership with Mike,,yt_subscribers,63100,1,0,2,6,,,,https://www.youtube.com/channel/UCX_oT8liQty9EL7ZJVpz3RA,playbook,2025-10-06,Channel: Leadership with Mike (avg_views:565),"I help new leaders achieve the Aurelius Effect™️, unlocking their team's full potential and inspiring 101% discretionary effort. Exceed your targets and grow — without the constant firefighting, handholding, or conflicts — even when you're off the clock.

Featured on Dr. Phil, Forbes, and SUCCESS Ma",Leadership with Mike
youtube,Leadershipahoy!,,yt_subscribers,10600,1,0,2,6,,,,https://www.youtube.com/channel/UCmDH3D-44ZZl4QiRc86osIw,leadership,2025-10-06,Channel: Leadershipahoy! (avg_views:37414),"I’m Carl Lindberg, and I’m here to help you to learn more about leadership! I have led organizations of more than 1000 people and 200-500 M$ in revenue during my leadership career. I have led employees in twenty different countries, and I have lived on three continents. I create explainer videos on ",Leadershipahoy!
youtube,Chris The Life Coach - Only For The Chosen Ones 👑,,yt_subscribers,71900,1,0,2,6,,,,https://www.youtube.com/channel/UCoiS173mrr2dVmXg6ptcKBg,coach,2025-10-06,Channel: Chris The Life Coach - Only For The Chosen Ones 👑 (avg_views:8761),"Hello Chosen Family! 👑 Welcome to my channel! I am Chris The Life Coach. On this channel, I will inspire you to live with purpose and chase your dreams! Please subscribe for weekly videos. If you would like to be a blessing to my channel...  My cash app is ( $ChrisTheLifeCoachLWP ) 🙏 Check the about",Chris The Life Coach - Only For The Chosen Ones 👑
youtube,Life Coach Randeep singh,,yt_subscribers,38900,1,0,2,6,,,,https://www.youtube.com/channel/UCvyEZmmX6Tie77B7n1bI-Iw,coach,2025-10-06,Channel: Life Coach Randeep singh (avg_views:5115),,Life Coach Randeep singh
reddit,Academic_Way_293,,reddit_upvotes,57,1,0,1,5,,,,https://www.reddit.com/r/Entrepreneur/comments/1nupi4c/how_my_girlfriend_made_reviewing_academic_papers/,,2025-09-30,How my girlfriend made reviewing academic papers into a small business,"She has reached about $4000 /mo, of course it fluctuates based on demand and scaling it to a bigger business is kind of up in the air right now since it'd mean hiring more people and turning it into more     What she's doing is essentially formatting research papers for uni researchers or people in ",u/Academic_Way_293
reddit,CodeFlux88,,reddit_upvotes,81,1,0,1,5,,,,https://www.reddit.com/r/smallbusiness/comments/1nvbyg9/spent_a_whole_day_training_someone_yesterday/,,2025-10-01,Spent a whole day training someone yesterday. Today they asked me the exact same questions.,I don't even know what to do anymore.   We went from a small team of 3 to 8 since april and I thought hiring would solve problems but really it just created new ones. Like now instead of being stressed about delivering I'm stressed about training people to do the work. We had this new guy just joini,u/CodeFlux88
reddit,WillingnessHappy5740,nowfluence: Influencer Campaign Management,reddit_upvotes,1,1,2,1,5,https://www.nowfluence.co/,your_email@domain.com,https://www.nowfluence.co/contact,https://www.reddit.com/r/ContentCreators/comments/1nvbnpc/i_left_my_agency_and_started_managing_myself_its/,,2025-10-01,I left my agency and started managing myself. It’s been the best decision financially and creatively,About a year ago I decided to leave the agency that had been managing my brand deals and content partnerships. I was nervous at first but honestly it’s been the best decision I’ve made for both my income and my sanity  I used to feel locked into certain deals that didn’t really match my style or aud,u/WillingnessHappy5740
reddit,Key_Recognition4437,,reddit_upvotes,1,2,0,1,5,,,,https://www.reddit.com/r/onlinecourses/comments/1nuayvp/need_suggestions_best_online_course_platform_with/,,2025-09-30,Need suggestions: Best Online Course Platform with Migration Support,"I’ve got 20+ courses hosted on a popular platform, but they just bumped up their pricing almost 3X. That’s way too much for me to handle, so I’m planning to switch.  Thing is, I don’t really want to go through the hassle of moving all my courses, videos, and student data manually. Do you know any co",u/Key_Recognition4437
youtube,Ai  dream world,,yt_subscribers,4800,1,0,2,5,,,,https://www.youtube.com/watch?v=CsikN1l1VYY,,2025-10-06,Twin Babies Fight for One Toy 😂 | Cutest Toddler Challenge Ever#cute #funny #subscribe,"Two adorable twin babies are walking toward one toy — but only one can win! Watch their cute competition, laughter, and ...", Ai  dream world
youtube,Rahmat ASMR AI,,yt_subscribers,1490,1,0,2,5,,,,https://www.youtube.com/watch?v=iJcBgFaNvfw,,2025-10-06,Twin Jets Defy the Storm 🌩️✈️&quot;#aigenerated #breakingnews #shorts#subscribe#like#fypシ #skydominators,,Rahmat ASMR AI
youtube,CatStory,,yt_subscribers,4610,1,0,2,5,,,,https://www.youtube.com/watch?v=dgb6tfvOrSQ,,2025-10-05,"She Fell, But Her Twin Won the Fashion Show!#catstory #ai #lovestory #videocat",,CatStory
youtube,Priyanka Sharma,,yt_subscribers,23300,1,0,1,5,,,,https://www.youtube.com/watch?v=SJjEd2DDPa4,,2025-10-01,Har 5 me se 1 mahila AI se romantic rishte me… | Priyanka Sharma,"ytshorts #shorts #viralvideos #priyankasharma अमेरिका में चौंकाने वाली रिसर्च, हर 5 में से ...",Priyanka Sharma
youtube,How to Digital,,yt_subscribers,352000,1,0,0,5,,,,https://www.youtube.com/watch?v=gywQVgOb-KA,,2025-09-27,How To Use Your Voice in Invideo AI Video Generator (Step by Step Tutorial),"Learn how to use your own voice in the InVideo AI Video Generator with this step-by-step tutorial! In this beginner-friendly guide, ...",How to Digital
youtube,Curious Tube,,yt_subscribers,2160,1,0,2,5,,,,https://www.youtube.com/watch?v=6Llst_-JEso,,2025-10-04,"Geography Q&amp;A: Continents, Oceans, Time Scale &amp; Dating Explained","Geography Follow-Up Questions & Answers In this video, we go through short, clear Q&A on: ✔️ Formation of continents and ...",Curious Tube
youtube,Pablo Milandu,- YouTube,yt_subscribers,1450,1,1,1,5,https://youtu.be/TojkDnAWzkI,,https://youtu.be/TojkDnAWzkI/contact,https://www.youtube.com/watch?v=e8sy4JIC4XM,,2025-09-29,"Q&amp;A: $16k clients, scaling a SaaS, failing cold email campaigns",How to Scale to $50000/month With Cold Email AI Agents (FULL 7+ HOUR COURSE) https://youtu.be/TojkDnAWzkI Link to the ...,Pablo Milandu
