platform,subreddit,url,author_handle,title,excerpt,evidence_quote,score,created_utc
youtube,Coach Rogue,https://www.youtube.com/watch?v=PbqbrKQZ_5E,Coach Rogue,He planned the gank 1 min in advance WOW,Watch full coaching session / book a coaching session with me at the link in my bio,eta,67100,1759763456
youtube,Emmanuel Rentoy,https://www.youtube.com/watch?v=9HQtG9O7sxA,Emmanuel Rentoy,Coach's Secret: From Sleepless Nights to Family Time: PRIME Strategy! #shorts,"Discover how one coach uses a simple strategy to maintain work-life balance. He reflects to stay present for family, win or lose. The PRIME framework helps him get back to balance and be 100% present for his family. #worklifebalance #coaching #familytime",strategy,12600,1759730564
youtube,Anuj Jindal,https://www.youtube.com/watch?v=wV9OrYaYw5A,Anuj Jindal,Coaching or Not? RBI Grade B 2025 Strategy | RBI 2024 Topper Amit Kumar | Anuj Jindal,,strategy,362000,1759728633
youtube,Emmanuel Rentoy,https://www.youtube.com/watch?v=b3Qlwtw-C3I,Emmanuel Rentoy,Coach's Secret: From Sleepless Nights to Family Time: PRIME Strategy! #shorts,"Discover how one coach uses a simple strategy to maintain work-life balance. He reflects to stay present for family, win or lose. The PRIME framework helps him get back to balance and be 100% present for his family. #worklifebalance #coaching #familytime",strategy,12600,1759727080
youtube,FITXBUSINESS,https://www.youtube.com/watch?v=sz0w1apB0NQ,FITXBUSINESS,Auditing A Women’s Weightloss Coach Instagram Profile,Want a 15-Min Strategy Call to Grow Your Brand? Watch this short video & apply below 👇   Free Live Event: How to Build a Personal Brand That Gets Clients on Autopilot Happening soon - save your spot now 👇 https://www.fitxfearless.com/free-session-yt/?el=byt  Just Getting Started? Join Content School,strategy,10400,1759690845
youtube,Coach Rogue,https://www.youtube.com/watch?v=ZKeoZLYRIPM,Coach Rogue,You've NEVER seen vision play like this before,Watch full coaching session / book a coaching session with me at the link in my bio,eta,67100,1759676938
youtube,Competishun+,https://www.youtube.com/watch?v=PpzoN590aco,Competishun+,How to Improve Chemistry with PYQs | Smart Strategy for JEE & NEET Students,"Chemistry preparation can feel overwhelming, but the right strategy makes all the difference. If you are practicing 2–3 lectures daily and solving PYQs (Previous Year Questions), then scoring 160–170 out of 300 shows you are on the right track. PYQs are not just practice but also the best way to rev",mindset,46000,1759653011
youtube,Akil Stokes (Trading Coach at Tier One Trading),https://www.youtube.com/watch?v=XpxU7Qgpvlw,Akil Stokes (Trading Coach at Tier One Trading),The Problem with Quitting a Trading Strategy Too Soon,The Problem with Quitting a Trading Strategy Too Soon    Check Out The Full Episode  ▶️YOUTUBE - https://www.youtube.com/watch?v=3MSOOwRsa9s&list=PL3pkGkL2zWpEDoOVAm9FJD7QAtpMOh2Gi&index=1  ▶️SPOTIFY - https://open.spotify.com/episode/15St5j9HkFbQlX0rCzed4d?si=a9ade718de0a403f,strategy,56000,1759651243
youtube,Akil Stokes (Trading Coach at Tier One Trading),https://www.youtube.com/watch?v=XDz7-p2D4IE,Akil Stokes (Trading Coach at Tier One Trading),The Fastest Way to Kill a Profitable Strategy,The Fastest Way to Kill a Profitable Strategy  Many traders turn winning systems into losers by constantly adding or removing rules. Simplicity wins in trading.  📽️ Watch the Full Video Here https://www.youtube.com/watch?v=UqnuvPT5YKI&t=509s&t=53s&t=2s&t=840s&t=932s&list=PL3pkGkL2zWpH3lJNsFVB3D-bmIZ,strategy,56000,1759593655
youtube,Coach Rogue,https://www.youtube.com/watch?v=Y4H9DUvSSM0,Coach Rogue,Abusing bouncing waves (AGAIN),Watch full coaching session / book a coaching session with me at the link in my bio,eta,67100,1759590354
youtube,3T Warrior Academy ,https://www.youtube.com/watch?v=_fEtTxVQ-1Q,3T Warrior Academy ,"Bitcoin Strategy: Calmly Profit, Protect, and Leverage!  #crypto",#Xrp #Xrpnews #Xrparmy #3tAcademy #CoachJV #Crypto #greatreset #crypto   🔥REPORT A FAKE/SCAM ACCOUNT: https://app.chainpatrol.io/coach-jv/report  🔥FILL OUT: Needs Assessment Wealth Protection Team (Insurance): https://freedominsurancellc.com/consultation  🔥APPLY for 4 Week live workshop with Coach J,strategy,254000,1759514840
youtube,Your SAT Coach,https://www.youtube.com/watch?v=WhavfYZ7VGI,Your SAT Coach,The tricky SAT question most skip,Ready to Maximize Your SAT Score? Step 1: Learn these 10 Proven SAT Strategies to Boost Your Score Instantly ⭐ Watch now: https://www.futureadmit.com/strategy-yt  Step 2: Check out our program ⭐ Join Today: https://www.futureadmit.com,strategy,296000,1759510232
youtube,The Real Estate Show with Pat Lopez,https://www.youtube.com/watch?v=RJ7LB9LYF_c,The Real Estate Show with Pat Lopez,Real Estate Coach Reveal TOP Strategies for Part Time Agents,"This week, we're diving deep into an incredible success story that proves where you start isn't where you must finish. We sit down with Tess Adams, Realtor, Team Leader, and Real Estate Coach at KW Empower, to talk about her remarkable journey. Tess started out working in operations and accounting, ",strategy,39400,1759503606
youtube,COACH YG,https://www.youtube.com/watch?v=A-HXZAXPq30,COACH YG,Stop Looting Wrong! ❌ Learn Brazilian Fast Loot Strategy 🔥 For Early Rotation Domination 💀,Stop Looting Wrong! ❌ Learn Brazilian Fast Loot Strategy 🔥 For Early Rotation Domination 💀 #freefire #freefiremax #coachyg #freefireesports #freefireindia #freefiretournament #freefirebrasil  Most teams waste too much time looting and end up rotating early with weak resources 😵. That’s the BIGGEST m,strategy,17500,1759495582
youtube,LSAT Demon,https://www.youtube.com/watch?v=W3HSly0Be7g,LSAT Demon,"The 1L Strategy Guide | Crushing 1L, Ep. 7","Abhi is joined by attorney and 1L strategy coach Angela Vorpahl to unpack what students should expect, and how to prepare, for their first year of law school. Angela explains how law firm recruiting for 1L and 2L summer positions has shifted earlier than ever, with competitive firms now hiring in th",strategy,18500,1759433581
youtube,Leila Hormozi,https://www.youtube.com/watch?v=-z6IfOcyZks,Leila Hormozi,Shame vs. Accountability,"Want to learn how to scale your business? You can get my free personalized roadmap here: https://www.acquisition.com/roadmap  If you’re new to my channel, my name is Leila Hormozi.   I’m the founder and CEO of Acquisition.com, where we help ambitious people scale extraordinary companies.  A little a",accountability,976000,1759617000
youtube,Association of African Universities (AAU),https://www.youtube.com/watch?v=fSsRRdvZMkE,Association of African Universities (AAU),AFCHIX Tech Women Summit 2025 | Mentorship for Women in Tech,"AfChix Tech Women Summit 2025 has brought together trailblazing women in tech to explore ""The Value of Mentorship for Women in University and Early-Stage Careers."" This hybrid event featured inspiring keynote speeches, impactful panel discussions, and rapid-fire mentorship talks — all focused on emp",leadership,42400,1759343774
youtube,MLM SHARATH (GRIFFINS GURUKUL),https://www.youtube.com/watch?v=9oWXRBMkris,MLM SHARATH (GRIFFINS GURUKUL),What mlm Sharath becomes coach and consultant for mlm Industry?  Why is he doing this ? Full detail,#aboutmlmsharath #whymlmsharathstartthisassociationnewsapaper #whysharathnotdoingmlm #DigitalMarketingConference #NetworkMarketingEvent #DirectSellingSummit #MultiLevelMarketingExpo #NetworkMarketing #DirectSelling #MultiLevelMarketing #MLM #Entrepreneurship #BusinessOpportunity #HomeBusiness #Onlin,mindset,19200,1759634096
youtube,ScoreApp,https://www.youtube.com/watch?v=XmFb9DHdV74,ScoreApp,Don’t Sell Coaching – Do This Instead,"Want more people to say “yes” to working with you?  Stop trying to sell your coaching or consulting package straight away.  Instead, start with a free assessment.  Just like a doctor does an x-ray before treatment, you should run a quick test before offering a solution.  It shows people where they a",strategy,17400,1758639006
youtube,Multifamily Media Network,https://www.youtube.com/watch?v=Agaj5kiJwzs,Multifamily Media Network,"23 - Leadership Today - Trainer, Mentor, Coach?","In this episode of Multifamily Elevated, host Suzanne Hopson speaks with Booker Farrier, founder of Coaching by the Book, about the evolving landscape of executive coaching and leadership development. They discuss Booker's journey from corporate executive to coach, the importance of understanding th",personal development,11800,1759233630
youtube,The Mind Management Mentors Podcast ,https://www.youtube.com/watch?v=RU2d90XFenU,The Mind Management Mentors Podcast ,What Does Great Leadership Look Like?,"What Does Great Leadership Look Like? What Does Good Leadership Look Like with James Andrews: Steering Through Storms and Cultivating Resilience  Join us on Mind Management Mentors as we navigate the challenging seas of leadership with seasoned expert James Andrews, whose insights are shaped by over",mindset,34000,1757934050
youtube,Dr. Brooke Weinstein,https://www.youtube.com/watch?v=bwCM35AxIwM,Dr. Brooke Weinstein,People Pleasing vs. Boundaries: What Your Nervous System Needs to Know,"Real talk: How many times have you compromised your boundaries thinking it would save the relationship?  If someone can't respect your boundaries, they're showing you exactly who they are. Believe them. Your boundaries aren't negotiable. Period.  The right people will THANK you for being clear about",mindset,22700,1759349186
youtube,VantagePoints- VBS,https://www.youtube.com/watch?v=pD_mBH5otFU,VantagePoints- VBS,How to engineer a system reset for personal growth #entrepreneur #motivation #creativecommunication,"Engineer a system reset. I knew that to be seen differently, I first had to be somewhere different. My old environment had a memory, and it would constantly pull me back into the invisible role I was trying to escape. to make real headway i had to change my environment completely for me this meant l",strategy,20300,1758565183
youtube,Thais Gibson - Personal Development School,https://www.youtube.com/watch?v=fWBKsVe9yII,Thais Gibson - Personal Development School,Why Fearful Avoidants Explode Over “Nothing”,"It’s not about the dishes. Or the missed text. Or the small comment.  For Fearful Avoidants, tiny triggers feel like massive threats—because their nervous system is wired to expect betrayal.  This video breaks down why emotional outbursts happen in Fearful Avoidant relationships—and how to stop taki",personal development,417000,1758456104
youtube,Mindset Motivation,https://www.youtube.com/watch?v=vvZ0VvhgczY,Mindset Motivation,How to Build Systems to Actually Achieve Your Goal | BEST MOTIVATIONAL SPEECH BY MYRON GOLDEN,"#Motivation, #SuccessMindset, #GoalSetting, #Discipline, #Consistency, #PersonalGrowth,  Description: In this 28-minute motivational speech, discover the life-changing principle of building systems that guarantee your success. 🎯 Too many people set big goals but fail to reach them because they lack ",mindset,12200,1758114123
youtube,Inul Chowdhury,https://www.youtube.com/watch?v=WdG7tjSOJ78,Inul Chowdhury,Transforming Yourself  A Journey to Self Improvement,#Entrepreneur #coach #motivation #motivationalvideos #inspiration #inspiringvideos #foryou #foryoupage #podcast #lifecoach #coaches #explore #podcastclips #businesscoach #mindset #mindsetcoach #personalgrowth #personaldevelopment,mindset,86000,1758868338
youtube,Coach Keren Eldad (PCC),https://www.youtube.com/watch?v=DT0c5w0IjtQ,Coach Keren Eldad (PCC),Apply now! #business #businesscoach #personaldevelopment #lifecoach #lifeadvice #executivecoaching,,leadership,19200,1758668476
youtube,KPs 21st Century College,https://www.youtube.com/watch?v=Ci43eJUVMXA,KPs 21st Century College,#KaunBanegaKPChamp#promo#KPChamp#KPSir#21stcenturyiasacademy#trending#shorts#promo#reels#kpsir#ssc,"https://youtu.be/FNzMGgkGSPo The union government has initiated several programs to promote entrepreneurship among women, with the Stand-Up India Scheme being one of the most prominent. Many other initiatives also provide financial and training support for women entrepreneurs.   Gateway to IAS Succe",strategy,12600,1759753816
youtube,MJ Business Academy,https://www.youtube.com/watch?v=V8FJMaAXw_I,MJ Business Academy,Clients in Just 6 Weeks | An NEMT Entrepreneur Story,"Thinking about starting your own medical transportation business? Hear the real story of Marybelle Transportation Services just 6 weeks into launching. From buying her first van to tackling early obstacles, she shares her startup lessons and takeaways from our Los Angeles workshop, Is NEMT Right for",entrepreneurship,25400,1759430157
youtube,Boss Wallah Academy Telugu,https://www.youtube.com/watch?v=AjvGg7V4sGM,Boss Wallah Academy Telugu,కోటీశ్వరుడు అయిన డెలివరీ బాయ్: Ambur Iyyappa Success Story #flipkartsuccessstory,"Want to start a business but don’t know how? Boss Wallah is your all-in-one business app, offering step-by-step plans for hundreds of ideas, 11,000+ practical lessons, and expert support from 2,000+ service providers—all for just ₹999/year.  👉 Download the Boss Wallah App now - https://bw1.in/192  📚",mindset,316000,1759217406
youtube,Entrepreneur India TV,https://www.youtube.com/watch?v=ztHpUf0YiQk,Entrepreneur India TV,Entrepreneurship Champion Award 2025 |  Rising Dance Academy,"Rising Dance Academy is a premier institute dedicated to nurturing talent and spreading the joy of dance. Offering structured programs in contemporary, hip-hop, classical, Bollywood, and freestyle, it builds strong foundations in rhythm, flexibility, and expression. With expert instructors and stage",entrepreneurship,1230000,1759062166
youtube,Boss Wallah Academy Telugu,https://www.youtube.com/watch?v=jJgjQOJuZM0,Boss Wallah Academy Telugu,Business Start చేయాలా? తప్పక చూడండి! 🚀 #shorts,"Want to start a business but don’t know how? Boss Wallah is your all-in-one business app, offering step-by-step plans for hundreds of ideas, 11,000+ practical lessons, and expert support from 2,000+ service providers—all for just ₹999/year.  👉 Download the Boss Wallah App now - https://bw1.in/192  📚",mindset,316000,1758983430
youtube,MT RESIN ARTS INDIA (ACADEMY),https://www.youtube.com/watch?v=YqZBI8MdGpM,MT RESIN ARTS INDIA (ACADEMY),MT Resin Arts Academy Epoxy Flooring Training with Entrepreneurship 9352125722,"MT Resin Arts Academy Epoxy Flooring Training with Entrepreneurship  Hear it straight from the graduates! In this energetic post-training review, we catch up with Raj and Subhash as they share their excitement and satisfaction with the comprehensive learning experience at MT Resin Art India Academy!",entrepreneurship,26000,1758901988
youtube,Ali Abdaal,https://www.youtube.com/watch?v=FSj7LX5GYgA,Ali Abdaal,The Ultimate Guide to Building a Lifestyle Business,Get Grammarly today! http://grammarly.com/aliabdaal08  Join the Lifestyle Business Academy waitlist: https://go.aliabdaal.com/lbaytd  Check out Chris Ducker's book 'The Long Haul Leader' here: https://longhaulleader.com/  --------  MY PRODUCTIVITY APPS  📝 Momentum: Energising Habits (iOS) - Download,habits,6450000,1758718837
youtube,TENACITY ACADEMY (Cleaning Business Channel ),https://www.youtube.com/watch?v=USItJaSwI4E,TENACITY ACADEMY (Cleaning Business Channel ),Biggest Hiring Challenges: Finding Great Employees #shorts,"Discover the biggest hurdle for businesses right now: finding and retaining quality employees. It's a struggle many owners share, and one that can make or break success. Overcoming staffing shortages is key. #businesschallenges #staffing #entrepreneurship #hiring #leadership",leadership,36400,1758584868
youtube,TENACITY ACADEMY (Cleaning Business Channel ),https://www.youtube.com/watch?v=5rXd4slDCMQ,TENACITY ACADEMY (Cleaning Business Channel ),Importance of Community: Mental Health & Entrepreneurship #shorts,"Entrepreneurship's mental toll is heavy. A supportive community, filled with those who understand the unique struggles, is crucial. They're the ones who can truly offer encouragement and understanding in tough moments. #entrepreneurship #mentalhealth #community #supportsystem",entrepreneurship,36400,1758544177
youtube,TimesLIVE Video,https://www.youtube.com/watch?v=1-Tl9pTr0CM,TimesLIVE Video,Delicious Festival trader academy empowers young entrepreneurs with key skills,"The Delicious Festival Trader Academy, powered by FoodBev SETA, showcased 11 graduate entrepreneurs from its first two full programmes.The Academy empowers emerging food entrepreneurs through mentorship, training, compliance support, and trading opportunities. FoodBev Manufacturing SETA further faci",eta,316000,1758543885
youtube,Area71 Academy,https://www.youtube.com/watch?v=EKGb8r_oMv8,Area71 Academy,Chance to WIN Academy Bundle For FREE | Area71,"ভোট দিন ও একদম Free-তে Access নিন Academy Bundle Training Program-এর.  Area71 Academy-তে চলছে AACSU নির্বাচন আর এই নির্বাচনে Academy Bundle Training Program-টি Free-তে পেতে আপনাকে Follow করতে হবে 3 Step. বিস্তারিত জানতে Comment Section Check করুন।   ⚡ Stay updated with our latest content, Subscribe ",mindset,12300,1758474948
youtube,AIM Network,https://www.youtube.com/watch?v=Vq_GMrXewVo,AIM Network,Is it a Challenge for Mangaluru? #Karnataka #LatestNews,"Mangaluru is set to get its first-ever tech park under the ₹1,000 crore LEAP (Local Economy Accelerator Programme) by the Government of Karnataka. Announced by Minister Priyank Kharge at Mangaluru Technovanza 2025, this ambitious project will provide 3.5 lakh sq. ft. of workspace and support over 3,",entrepreneurship,204000,1759667440
youtube,Uno Aroma X Shantanu ,https://www.youtube.com/watch?v=LXFBL-FOXoY,Uno Aroma X Shantanu ,Day - 149 Of 25 Of My Company Store In Next 365 Day 🔥,Do Follow Me on Instagram : https://www.instagram.com/shantanuxunoaroma  #365dayschallenge #365days #unoaroma #25ofmycompanystore #25ofmycompanystoreinnext365day #entrepreneur #entrepreneurship #challenge #challengeaccepted #perfume #perfumestore #25ChallengesIn365Days #YearLongChallenge25 #365Days2,entrepreneurship,23500,1759037472
youtube,BrakeHard,https://www.youtube.com/watch?v=-B1Y_n-llC0,BrakeHard,Closing Laps | SVG Wins ANOTHER Road Course | ZIlisch and Heim Win #10 | Logano Gets In,Closing Laps | SVG Wins ANOTHER Road Course | ZIlisch and Heim Win #10 | Logano Gets In,closing,16900,1759836926
youtube,Aanant Bisht,https://www.youtube.com/watch?v=ebQcw4UMAdA,Aanant Bisht,Realtor Closing Secrets: How to Build Trust Without Pressure | Aanant Bisht,Get my Realtor One Blueprint program 👉 https://therealtorone.com/  Join our Realtor Community today and unlock free access to our exclusive course: https://chat.whatsapp.com/Koh5hdlyr8wJmFBJNyqN6w  Welcome to my channel!   My name is Aanant Bisht. I am a Strategic Belief Coach specializing in workin,mindset,15800,1759680066
youtube,Malviya Academy ,https://www.youtube.com/watch?v=EMVZVZ2Oz4U,Malviya Academy ,Biggest Discount on CUET Online & Offline Courses 🎉 विजय उत्सव Offer is closing soon💯,📢Printed Books Launched for CUET UG 2026 All Subjects. Pre-Booking is now open for first 1000 Books. ➡️Home Delivery Available ! Exclusive 👇 Newly Launched Book 1st Chapter PDF is now available only on Telegram ! Telegram Link : t.me/malviyaacademyofficial Subscribe Now !  📢All Time Best Offer on Al,strategy,661000,1759572032
youtube,Shipping Updates,https://www.youtube.com/watch?v=chKHnTUWsrM,Shipping Updates,Hurry! GMI 8-Month Merchant Navy Course – Form Closing Soon!#shorts,"B.Tech Mechanical graduates, apply for the GMI 8-month Merchant Navy course! 📌 Max Age: 28 | Unmarried | Seats: 40 | Form Last Date: 30 Sept 👉 Apply Link in Description & First Comment",closing,30000,1759158554
youtube,vlogize,https://www.youtube.com/watch?v=_K-EG3nWQeE,vlogize,Properly Using click:outside with Vuetify Dialogs: A Guide to Closing Your Date Picker,Discover how to manage the state of your Vuetify dialog using the `click:outside` event. Learn how to ensure your date picker opens and closes correctly in this easy-to-follow guide. --- This video is based on the question https://stackoverflow.com/q/63531848/ asked by the user 'UmbrellaCorpAgent' (,closing,13300,1759042944
youtube,JAIIB CAIIB - English Medium,https://www.youtube.com/watch?v=eFZXCqieLFk,JAIIB CAIIB - English Medium,CAIIB Aspirants Alert  Registration Closing on 30th September | By Vishal Mantri,✅ JAIIB - CAIIB GUIDANCE FORM :- Link 📌 https://forms.gle/fzwLjcLDrz8A4khPA  CAIIB Virtual Library (Free for all) - https://forms.gle/L7knJEUhucTnnJaS9 For more queries 📞: 09819819247 ✅To Join Telegram group:-CAIIB BFM & Vishal Mantri Link:-📌 https://t.me/caiibvishalmantri  ✅Access AI DoubtGuru here,closing,14800,1758982051
youtube,vlogize,https://www.youtube.com/watch?v=TUSbZJgrTd4,vlogize,How to Properly Handle Form Closing Events in C#  Using EventArgs,"Learn how to manage your C#  form closing events effectively, especially when dealing with multiple ways to trigger them, like button clicks. --- This video is based on the question https://stackoverflow.com/q/63073459/ asked by the user 'playorrelay' ( https://stackoverflow.com/u/11985730/ ) and on",closing,13300,1758934852
youtube,Defence Wallah,https://www.youtube.com/watch?v=-1qgG2VIccc,Defence Wallah,NDA 1 2026 Complete Roadmap | Strategy to Crack NDA 2026 Exam | NDA Exam 🪖🔥,"Lecture by Raj Roshan Singh Sir  NDA 1 2026 Complete Roadmap | Strategy to Crack NDA 2026 Exam | NDA Exam 🪖🔥 Get the complete roadmap & strategy for NDA 1 2026! 🪖🔥 Step-by-step plan to crack NDA Exam, covering Maths, GAT, English & preparation tips. Follow this strategy to boost your NDA 1 2026 prep",strategy,1370000,1759835700
youtube,PW COMBATANT ,https://www.youtube.com/watch?v=UFEbs0g_FmQ,PW COMBATANT ,7 Months KOTA STRATEGY - NEET 2026 ⚠️ MD Sir & SKC Sir Months Roadmap‼️#neet2026 ,"SKC Sir in MD Sir's Class 🔥 KOTA STRATEGY - NEET 2026 ⚠️ Toppers Mindset #neet2026   neet 2026, neet 2026 roadmap, neet 2026 pw batch, neet 2026 study vlog, neet 2026 plan, neet 2026 syllabus, neet 2026 11th barbaad, neet 2026 strategy, neet 2026 preparation, neet 2026 latest news today, neet 2026 c",mindset,65300,1759825974
youtube,CUET Adda,https://www.youtube.com/watch?v=eCMk7aqkhXY,CUET Adda,CUET 2026 Humanities | 6 Months Roadmap 🔥| Full Strategy to Crack Exam,"📢 For Batch Admission related queries, Call us at 09650076247  💬 Direct Doubt Support — Connect with Faculty Now! Fill the Google Form: https://forms.gle/HiQ7y2WUx9XycZWc6  🎯CUET UG Mahapacks for Science, Commerce, Arts & GAT + Language – specially designed for CUET UG aspirants. ✨ All-in-One Batch ",strategy,1180000,1759822206
youtube,GeeksforGeeks GATE,https://www.youtube.com/watch?v=5V1AIYPYGXc,GeeksforGeeks GATE,Score 80+ In GATE 2026 | Last 4 Months Strategy | GATE 2026 Roadmap,"Aiming for 80+ marks in GATE 2026 is possible with the right last four months strategy and a well-structured roadmap. This video explains how to organize study hours, prioritize high-yield subjects, and master core concepts by targeting weights and analyzing previous year questions. Discover proven ",strategy,76500,1759811923
youtube,NITian Shubham [NITP🔁IIT Bh] 369k View. 1 hour ago,https://www.youtube.com/watch?v=L6XGXAkIYNw,NITian Shubham [NITP🔁IIT Bh] 369k View. 1 hour ago,JEE 2026| JEE Mains 2026| JEE Mains 100 Days Roadmap|🚨 Important Update| |Urgent Update For JEE 2026,My whatsapp no for guidence 7654890856 or 8409888995 for Confirm ques & guidence;-  https://chat.whatsapp.com/Ez0HswirJxZ8KRQHpysjrN?mode=ems_copy_t For Masterclass Pdf whatsapp me @PhysicsWallah  @iitjeeone  @JEEVedantu  @PW-JEEWallah  @VOHRA CLASSES @ExphubShorts  @NextToppers23   NTA Update⛔️|Con,strategy,27200,1759811801
youtube,Law Entrance,https://www.youtube.com/watch?v=52mAi_DLad8,Law Entrance,"CLAT 2026 Preparation: 60 Days Strategy, Roadmap & Revision Plan | CLLST","Only 2 months left for CLAT 2026! Time to maximize your preparation with a focused 60-day roadmap. This session/short will guide you on how to revise, strategize, and approach each section effectively.  🎯 What You'll Learn:  Step-by-step roadmap for last 60 days. Section-wise revision strategy for L",strategy,24500,1759808057
youtube,GATE ACADEMY - CE | ME | CH by Umesh Dhande,https://www.youtube.com/watch?v=FvFperJIEv8,GATE ACADEMY - CE | ME | CH by Umesh Dhande,"Roadmap for GATE 2026 || 4 MONTHS LEFT, STRATEGY क्या रखें? #roadmap",📌 Our AE JE FOUNDATION BATCH [Online & Offline Classes] : REGISTER NOW 👇🏻👇🏻👇🏻 https://docs.google.com/forms/d/e/1FAIpQLSchT-rEHirUmfD013WDWXAfKaBiSagFjMLW5iF8O3I_QRiD0w/viewform  📌 Our SSC JE SAMBHAV BATCH:  https://classplusapp.com/diy/courses/course-overview?id=696004  📌 Our CGVYAPAM Course: ➡️Non,strategy,153000,1759780976
youtube,CUET Adda,https://www.youtube.com/watch?v=ylpRVYbpzkw,CUET Adda,How to Start CUET 2026 Preparation? Most Powerful Strategy 🔥 Complete Roadmap,"To access the video and other study materials on Adda247 app, click - https://applink.adda247.com/d/EGRy70udrE .    📢 For Batch Admission related queries, Call us at 09650076247  💬 Direct Doubt Support — Connect with Faculty Now! Fill the Google Form: https://forms.gle/HiQ7y2WUx9XycZWc6  Share your ",strategy,1180000,1759757656
