platform,subreddit,url,author_handle,title,excerpt,evidence_quote,score,created_utc,website,contact_url,email,company
youtube,GMA Integrated News,https://www.youtube.com/watch?v=8wM79xIR4_M,GMA Integrated News,SP Sotto - There is no legal or constitutional basis or a framework to do that | GMA Integrated News,"“There is no legal or constitutional basis or a framework to do that...""   Ibinahagi ‘yan ni Senate President Tito Sotto sa kaniyang press conference ngayong araw, October 6, 2025, bilang tugon sa hirit ni Senator Alan Peter Cayetano na magkaroon ng snap elections para maibalik ang tiwala ng publiko",eta,17500000,1759730008,,,,GMA Integrated News
youtube,TEDx Talks,https://www.youtube.com/watch?v=4sRa172CPww,TEDx Talks,The N.E.X.T. framework for navigating change with courage | Brittany Roberts | TEDxParrish Street,"This talk is about letting go of the things that no longer serve you so you can walk into your NEXT opportunity Brittany Roberts is an educator, leader, and advocate whose journey in education spans over a decade. A proud alumna of UNC Charlotte, she holds a Bachelor's degree in Middle Grades Educat",leadership,43700000,1758902866,,,,TEDx Talks
youtube,MasterTalk,https://www.youtube.com/watch?v=ZEyHcVUFXz8,MasterTalk,How to Answer Tell Us About Yourself in an Interview,,eta,53800,1758650441,,,,MasterTalk
youtube,Vinh Giang,https://www.youtube.com/watch?v=jPoPGfoaoZo,Vinh Giang,Why You Freeze In Conversations (Even If You're Smart!),In this video I'm sharing with you why we all fall FREEZE in conversations especially work meetings and how to use frameworks to think and speak clearer.  FREE Communication Frameworks Training ➡ https://bit.ly/4gzOiIk I'll teach you 3 communication frameworks to master conversations 🗣️  FREE 3 Part,habits,3900000,1758291900,,,,Vinh Giang
youtube,CTM Consulting Group,https://www.youtube.com/watch?v=mVtVMyL0FBg,CTM Consulting Group,Today’s Leadership Insight is about Toxic Leadership: Lean in!,"Today’s Leadership Insight is about Toxic Leadership:   Lean in and reflect: Are you leading in a way that builds trust and growth—or unintentionally creating an environment that stifles it?   Like, SHARE, Subscribe!  #ctmconsultinggrp #unleashyourpotential #nadidahcoveney #leadershipinsights #ctmle",mindset,12800,1759499841,,,,CTM Consulting Group
youtube,CTM Consulting Group,https://www.youtube.com/watch?v=bLRFmGWUKAc,CTM Consulting Group,Today’s Leadership Insight is about The Mindset That Keeps You Stuck: Lean In!,"Today’s Leadership Insight is about The Mindset That Keeps You Stuck:   Lean in and reflect: What story are you telling yourself that no longer serves you—and how can you rewrite it into one that fuels growth?   LIKE, SHARE, SUBSCRIBE  #ctmconsultinggrp #unleashyourpotential #nadidahcoveney #leaders",mindset,12800,1758861035,,,,CTM Consulting Group
youtube,CTM Consulting Group,https://www.youtube.com/watch?v=s8E5TGdchlQ,CTM Consulting Group,Today’s Leadership Insight is about Rebuilding Yourself. Lean in!,Today’s Leadership Insight is about Rebuilding Yourself.   Lean in and reflect: What part of yourself is it time to rebuild so you can RISE into your next level of leadership and impact?   #ctmconsultinggrp #unleashyourpotential #nadidahcoveney #leadershipinsights #ctmleadershipbytes #leadershipdeve,mindset,12800,1757682998,,,,CTM Consulting Group
youtube,SuperGrads CUET by Toprankers,https://www.youtube.com/watch?v=E8DJH2F4aR4,SuperGrads CUET by Toprankers,CUET 2026: Time-Wasting Habits That Drop Your Rank | Avoid These Mistakes Now! #shorts #ytshorts,👉Get 1-on-1 CUET 2026 Counselling Here: https://bit.ly/42KYrvl 👉Join telegram Group : https://t.me/cuet_samarth_Exam_Prep ========================================= CUET 2026: Time-Wasting Habits That Drop Your Rank | Avoid These Mistakes Now! #shorts #ytshorts   Struggling to improve your CUET 2026 ,habits,86300,1760167808,https://bit.ly/42KYrvl,,,SuperGrads by Toprankers
youtube,BTree Systems,https://www.youtube.com/watch?v=J5xrx5vDFTY,BTree Systems,5 Python Habits Every Coder Should Master | python full course in tamil,"🐍 Want to become a better Python developer? In this video, we’ll cover 5 essential Python coding habits that every programmer must practice in 2025:  Writing clean & readable code Using virtual environments Following PEP 8 standards Debugging effectively  Writing reusable functions & modules  👉 Must",habits,62500,1760016629,,,,BTree Systems
youtube,Master Motivate ,https://www.youtube.com/watch?v=yQ3MvA3rlqw,Master Motivate ,“How to Constantly Improve Yourself | 8 Powerful Habits for Personal Growth 🌱”,"Want to become a better version of yourself every day? 💪 In this video, I’ll share 8 simple yet powerful ways to constantly improve your life and mindset. From reading books to surrounding yourself with the right people — these habits will help you grow mentally, emotionally, and professionally. 🌟  ",mindset,14500,1759983460,,,,Master Motivate 
youtube,Keshav Shinde,https://www.youtube.com/watch?v=MMH3nGByUdY,Keshav Shinde,Money Making Habits for Financial freedom 🎯 Wealth Gk Courses 💲 Portfolio strategy 💱#stockmarket,,habits,45100,1759888815,,,,Keshav Shinde
youtube,Learn English With ZiTA,https://www.youtube.com/watch?v=VDgLbN0Z5ZM,Learn English With ZiTA,Day 7| Hidden Formula to Talk About Reading Habits in English 📚 | Free English Speaking Course,"Hidden Formula to Talk About Reading Habits in English 📚 | Day 7  Watch our 18-minute FREE Masterclass for Working Professionals & Housewives here → https://www.zitaenglish.in/lp-sf1  Welcome to Day 7 of the Free English Speaking Course – English Startup Challenge! In today’s session, we’re unlockin",habits,876000,1759847406,https://www.zitaenglish.in/lp-sf1,,,Free Training For English Speaking
youtube,BARI ENGLISH ACADEMY,https://www.youtube.com/watch?v=Z9BhxOAIZL8,BARI ENGLISH ACADEMY,Master the secret of speaking about your past habits correctly — it’s all about ‘used to’ 🔥,,habits,1140000,1759843498,,,,BARI ENGLISH ACADEMY
youtube,PW OnlyIAS Prarambh,https://www.youtube.com/watch?v=Ng_wNbwTnLA,PW OnlyIAS Prarambh,These 5 Habits Can Make You a UPSC Topper 🤫 | I Wish I Knew this Sooner 😓,"For UPSC 2028 Complete Preparation from Zero, check out these batches 👇  👉 UPSC Prararmbh 2028 Hinglish: https://physicswallah.onelink.me/ZAZB/styn87q3 👉 UPSC प्रारंभ 2028(in  Hindi) https://physicswallah.onelink.me/ZAZB/gy0159ht  To Get More Information about Online/Offline Courses, fill out this f",mindset,615000,1759584620,https://physicswallah.onelink.me/ZAZB/gy0159ht,,support@pw.live,UPSC प्रारंभ 2028
youtube,Femi Adisa,https://www.youtube.com/watch?v=4a-WOqsUuiU,Femi Adisa,Coach Femi Adisa's session at the Biblical Billionaire Conference 2025 (Day 1),"Your mindset is the limit to how far you can go.  Every time you stretch your thinking, you stretch your future.  That’s how builders become billionaires, by expanding their minds before their empires.  #BiblicalBillionaireConference2025",mindset,16900,1760129013,,,,Femi Adisa
youtube,EVEREST COACHING POINT,https://www.youtube.com/watch?v=yTYoxqpj1Sc,EVEREST COACHING POINT,Students and Their Realities – Laxmi Madam’s Insightful Speech,"📚 Welcome to Everest Coaching Point – The Best SSC Coaching Centre in Hyderabad & South India  Everest Coaching Point is India’s trusted institute for SSC CGL, CHSL, MTS, GD, SI, Constable, and other central & state government job exams. Known as the No.1 SSC coaching centre in Hyderabad, we provide",eta,113000,1760094115,,,,EVEREST COACHING POINT
youtube,Dubai Motivational Speaker,https://www.youtube.com/watch?v=fA0_h9n33cc,Dubai Motivational Speaker,"Public Speaking Coach for GCC Leaders, CEOs & Billionaires | Media Training To Speak With Authority",,mindset,28900,1760021904,,,,Dubai Motivational Speaker
youtube,Let’s talk clarity with Rakesh Mathuria,https://www.youtube.com/watch?v=__GAQ76usk4,Let’s talk clarity with Rakesh Mathuria,Effective Communication TIPS Mastered by EXPERTS,"Effective Communication TIPS Mastered by EXPERTS  Want to communicate like a pro? 🗣️ In this video, discover one of the most powerful communication tips mastered by experts — the art of being curious about others. Learn how genuine curiosity, active listening, and letting others speak more can compl",mindset,37700,1759994146,,,,Let’s talk clarity with Rakesh Mathuria
youtube,Deepak Cameraman Official,https://www.youtube.com/watch?v=361Zfza0hrw,Deepak Cameraman Official,Eta Dipil Dipil Dhiri Dipil || Somoni Baskey || New Santhali Program Video 2025 || Rangabadh Bolpur ,Title :- Eta Dipil Dipil Dhiri Dipil || Somoni Baskey || New Santhali Program Video 2025 || Rangabadh Bolpur  :::::::::::::::::::::::::::::::::::::::::::::::::::::::::::::::::::::::::::::::: Singer :- Somoni Baskey :::::::::::::::::::::::::::::::::::::::::::::::::::::::::::::::::::::::::::::::: Keyb,eta,88200,1757646002,,,,Deepak Cameraman Official
youtube,RwandaTV,https://www.youtube.com/watch?v=4j6YS3KWxTI,RwandaTV,"🔴LIVE: MPA Pioneer Cohort Matriculation Ceremony, 25 September 2025",Join this channel to get access to perks: https://www.youtube.com/channel/UCyRvjnhiC0MOXWS-7COPtyQ/join  #RBANews #RBAAmakuru #Rwanda #RBAHafiYawe  Click here to SUBSCRIBE : https://www.youtube.com/user/RwandanTV?sub_confirmation=1  Follow us on Twitter:    https://twitter.com/rbarwanda    https://t,eta,1260000,1758837389,https://www.youtube.com/channel/UCyRvjnhiC0MOXWS-7COPtyQ/join,,,RwandaTV - YouTube
youtube,Loida Velasquez,https://www.youtube.com/watch?v=lz90eEbdUoc,Loida Velasquez,The 5 Stages of Real Estate Prospecting Every Agent Needs to Know,🎯 Free Skool group for serious agents: https://www.skool.com/prospecting  Discover the five essential stages of real estate prospecting in this in-depth video. Learn how to transition from making initial calls to converting appointments into signed listings. Whether you're a new agent or looking to ,prospecting,97000,1757970809,https://www.skool.com/prospecting,,,Dominate Prospecting
youtube,Impressive Glow,https://www.youtube.com/watch?v=IwpmZW5NRHI,Impressive Glow,Whitening Business Blueprint Ep. #1,"💫Whitening Business Blue Print💫  When you’re just starting your teeth whitening business and practicing with friends or family — remember this: nothing is really free. 😉  You’re giving them a complimentary service, but you should be getting something way more valuable in return: 📸 Content — videos, ",strategy,13000,1759781008,,,,Impressive Glow
youtube,Aanant Bisht,https://www.youtube.com/watch?v=fGjXFRJjWJE,Aanant Bisht,Dubai Realtor Coaching: Proven Blueprint to Earn 1 Million Dirhams Commission | Aanant Bisht,"Get my Realtor One Blueprint program 👉 https://therealtorone.com/  If you want to take the next step, book an Exclusive Free 30-minute Transformation Strategy Call with me here: https://calendly.com/aanant-bisht/30-minute-discovery-call  Welcome to my channel!   My name is Aanant Bisht. I am a Strat",mindset,15800,1759059038,https://therealtorone.com/,https://therealtorone.com/contact,contact@therealtorone.com,Community Page - Realtors one
youtube,Vedic Astrology,https://www.youtube.com/watch?v=SXGtvul4FII,Vedic Astrology,7-Day Growth & Meditation Workshop | Boost Your Third Eye,"7-Day Growth & Meditation Workshop | Boost Your Third Eye  😃 Our special book – The First Step to Vedic Astrology is now available! 👉 Order Now: https://bookyantra.com/product/the-first-step-to-vedic-astrology/  एक नया 7-Day Meditation Workshop शुरू हो रहा है, जिसका मकसद है आपके growth को guarantee ",mindset,32500,1760067903,https://bookyantra.com/product/the-first-step-to-vedic-astrology/,https://bookyantra.com/product/the-first-step-to-vedic-astrology/contact,joyybannerjii@gmail.com,वैदिक ज्योतिष का पहला कदम – Book Yantra
youtube,Ball Goldricher,https://www.youtube.com/watch?v=xJQFNZpuWfU,Ball Goldricher,Workshop Gold to the Moon!,Workshop Gold to the Moon!  Join Community Signal XAUUSD Goldricher Link : BIO    #xauusdsignal #forex #trader #goldricher #motivation #inspiration #เทรดทอง #mindset #สอนเทรดทอง #วิเคราะห์ทองคำ #ไลฟ์เทรด #ballgoldricher #shorts,mindset,15300,1759761070,,,,Ball Goldricher
youtube,Brian Robinson Coaching,https://www.youtube.com/watch?v=r5t0tFNvjmQ,Brian Robinson Coaching,The Most Underrated Leadership Book of All Time,#DRIVENpreneurPodcast #businesscoaching #brianrobinsoncoaching ************************************************************** Subscription Link: youtube.com/BrianRobinsonCoaching?sub_confirmation ***************************************************************  Not all leaders are created equal. Be t,mindset,19300,1760122820,,,,Brian Robinson Coaching
youtube,What's up PRO,https://www.youtube.com/watch?v=ycBgTMu-Iig,What's up PRO,"Kiran Parandekar,Peak Performance Coach,Champion Mindset Speaker,Workplace Productivity Consultant.","With over 25 years of experience across entrepreneurship, sales, marketing, business development, and training, Kiran shares powerful insights on how to build a winning mindset, create workplace happiness, and unlock your highest potential.  From boardrooms to karaoke nights, from helping profession",mindset,14700,1759928737,,,,What's up PRO
youtube,Australian Property Academy With Moxin Reza ,https://www.youtube.com/watch?v=ARCq6a8LhHk,Australian Property Academy With Moxin Reza ,The #1 Australian City to Invest In 2025,Townsville in Queensland is about to explode in property value! Median house prices are set to jump 25–30% in 2025 👉 from $520K to $650K+. With $30 billion in major projects fueling growth – from the Horton Pipeline to renewable energy & defense upgrades – this regional city is unstoppable. Don't mi,pipeline,11400,1757757846,,,,Australian Property Academy With Moxin Reza 
youtube,Vinh Giang,https://www.youtube.com/channel/UC9K9Wnz6t4cLnCdTzAVrXqQ,Vinh Giang,Channel: Vinh Giang (avg_views:223321),"G'day! My name's Vinh Giang - I'm a communication skills teacher, part-entrepreneur, and part-magician (Yes I'm a bit of a mixed breed lol)

I'm passionate about helping you unlock your voice to unlock your potential.

I've dedicated the last 10 years to mastering my communication ability - speaking",public speaking,3900000,1760189246,,,,Vinh Giang
youtube,Life Coaching Academy,https://www.youtube.com/channel/UC-VnwuOt3fUrmOLvqYyYs8Q,Life Coaching Academy,Channel: Life Coaching Academy (avg_views:5206),"The Life Coaching Academy is dedicated to provide profound knowledge, Training & Motivation about Personality Development & Life Transformation for Sri Lankan People in Sinhala Language.

💠 Redesign Your Life with - LifeCoach.lk  
Visit: https://www.lifecoach.lk  for more information.

🔸 Inquiries: ",life coaching,67800,1760189251,https://www.lifecoach.lk,,dd0a55ccb8124b9c9d938e3acf41f8aa@sentry.wixpress.com,Home | Life Coaching Academy
youtube,Business Mentor,https://www.youtube.com/channel/UCtJbij2UfQpUKxO12bQC9EQ,Business Mentor,Channel: Business Mentor (avg_views:5226),"Welcome to Business Mentor! 🚀

For Paid Promotion : 0370 140 7176

At Business Mentor, we’re dedicated to empowering entrepreneurs, business leaders, and professionals with the insights and strategies they need to thrive. Our channel is your go-to resource for actionable advice, industry trends, and",leadership,20300,1760189253,,,,Business Mentor
youtube,FNG ACADEMY,https://www.youtube.com/channel/UCt3rz2NOIXEpp5NZPG0VJSQ,FNG ACADEMY,Channel: FNG ACADEMY (avg_views:28928),"The FNG Academy is run by Sean ""Buck"" Rogers a former Green Beret, author of Rising Above and former Law Enforcement Officer. Buck and his team provide the very best in mental preparation for special operations. From the best gear to one on one coaching and mentoring, this is the premier training ac",operations,283000,1760189255,,,,FNG ACADEMY
