platform,subreddit,url,author_handle,title,excerpt,evidence_quote,score,created_utc
youtube,NITian Shubham [NITP🔁IIT Bh] 369k View. 1 hour ago,https://www.youtube.com/watch?v=Rk-LcBKIRtw,NITian Shubham [NITP🔁IIT Bh] 369k View. 1 hour ago,Last 100 Days JEE Roadmap ⁉️- 99 percentile in 3 month JEE 2026 💯| Is one Shot Sufficient for 99%ile,One Shots Sufficient for JEE ⁉️ Best One Shot for JEE Mains 🎯 ⁠ ⁠ ⁠ 🔴JEE 2026 Strategy| Jan Attempt | 🎯90 Days Roadmap | 📚Strategy & Resources to Score 220+ | Vinay Shur Sir JEE 2026: 100 Days to IIT selection🚀 | Complete Road  to Score 99%ile in Jan Attempt | Harsh Sir JEE 2026 : Score 99%ile in 10,strategy,27200,1759757058
youtube,NITian Shubham [NITP🔁IIT Bh] 369k View. 1 hour ago,https://www.youtube.com/watch?v=B5u0_ehH7c0,NITian Shubham [NITP🔁IIT Bh] 369k View. 1 hour ago,I Score 99 Percentile in 3 Month ✅| My 100 Days Roadmap JEE 2026 🔥| Last 3 Month Strategy JEE 2026,My whatsapp no for guidence 7654890856 or 8409888995 for Confirm ques & guidence;-  https://chat.whatsapp.com/Ez0HswirJxZ8KRQHpysjrN?mode=ems_copy_t For Masterclass Pdf whatsapp me @PhysicsWallah  @iitjeeone  @JEEVedantu  @PW-JEEWallah  @VOHRA CLASSES @ExphubShorts  @NextToppers23   ⁠ ⁠ ⁠ 🔴JEE 2026 ,strategy,27200,1759726281
youtube,PW COMBATANT ,https://www.youtube.com/watch?v=3rhgGqERYAI,PW COMBATANT ,NEET 2026 Paper Level ⚠️ Bio or Chem Tough ⁉️ 7 Months Balanced Strategy 🔥 MR Sir #neet2026 #mrsir ,"NEET 2026 Paper Level ⚠️ PCB Balance - 7 Months Strategy | No one will Tell you! #neet2026 #mrsir  neet 2026, neet 2026 roadmap, neet 2026 pw batch, neet 2026 study vlog, neet 2026 plan, neet 2026 syllabus, neet 2026 11th barbaad, neet 2026 strategy, neet 2026 preparation, neet 2026 latest news toda",strategy,65300,1759721033
youtube,Board Breakers 9th - 12th,https://www.youtube.com/watch?v=VbR0vZxtxaM,Board Breakers 9th - 12th,Class 12 Board Exam 2025 Roadmap | Class 12 October Strategy | TOPPERS Study Plan🔥 | Board Breakers,"Class 12 Board Exam 2025 Roadmap | Class 12 October Strategy | TOPPERS Study Plan | Board Breakers  Join Telegram Channel : https://t.me/Board_Breakers  Welcome to Board Breakers! 🔥  It’s time to gear up for your Class 12 Board Exam 2025! In this video, we bring you the October Study Plan & Roadmap ",strategy,10200,1759663806
youtube,Pradeep Giri 11th and 12th  Academy,https://www.youtube.com/watch?v=lJs7GujxPkg,Pradeep Giri 11th and 12th  Academy,12th English | COMPLETE ROADMAP | SEMESTER EXAM | Pradeep Giri Sir,#importantupdate #12thenglish #completeroadmap #semesterexampreparation #maharashtraboard #pradeepgirisir   12th ENGLISH Maha-Oneshot Live Session : https://youtube.com/live/xiZvzK29iUw?feature=share  💬NEW Whatsapp CHANNEL : https://whatsapp.com/channel/0029VbAlXfO8V0tmxKW3bM1F  Attention Standard 1,strategy,193000,1759660472
youtube, GATE Wallah (English),https://www.youtube.com/watch?v=ogskjtljRbs, GATE Wallah (English),GATE 2026 Daily Schedule for Single Digit Rank | Complete Roadmap & Strategy,"Session By Aditya Jain Sir  The GATE 2026 Daily Schedule for Single Digit Rank is designed to help aspirants plan their day-to-day preparation with precision. Achieving a top rank in GATE 2026 requires not just hard work but also a structured daily routine, a smart study plan, and a consistent revis",strategy,158000,1759641956
youtube,Arvind Academy,https://www.youtube.com/watch?v=M7AU044UWZw,Arvind Academy,😱 Only 3 Months Left! Class 11 & 12 Boards 2026 Roadmap | Score 95%+ Guaranteed,"😱 Sirf 3 Months ka Roadmap for Class 11 & 12 Boards 2026 – Follow this Final Strategy and Score 95%+ Guaranteed! 🔥 Best Study Plan, Physics Strategy & Preparation Tips for Boards 2026 – Maximum Marks in Less Time!  💥Download the Arvind Academy app (Google Play) Download Arvind Academy app 👉 http://b",strategy,1270000,1759640406
youtube,NITian Shubham [NITP🔁IIT Bh] 369k View. 1 hour ago,https://www.youtube.com/watch?v=5AsT0H0ycmE,NITian Shubham [NITP🔁IIT Bh] 369k View. 1 hour ago,Confirm Question in JEE Mains 2026 😱|  Last 100 Days Roadmap JEE Mains🎯  JEE mains registration 2026,My whatsapp no for guidence 7654890856 or 8409888995 for Confirm ques & guidence;-  https://chat.whatsapp.com/Ez0HswirJxZ8KRQHpysjrN?mode=ems_copy_t For Masterclass Pdf whatsapp me @PhysicsWallah  @iitjeeone  @JEEVedantu  @PW-JEEWallah  @VOHRA CLASSES @ExphubShorts  @NextToppers23   ⁠ ⁠ ⁠ 🔴JEE 2026 ,strategy,27200,1759639511
youtube,CUET 2025 by EduShield,https://www.youtube.com/watch?v=OMGSZi_LrS8,CUET 2025 by EduShield,"CUET English 2026 Strategy | 9-Month Roadmap to Topper | Vocabulary, PYQ, Mock Tests & EduShield App","EduShield App 📲 – Download here for FREE CUET English PYQs & Mock Tests 👉 https://play.google.com/store/apps/details?id=co.diy4.aambb  Are you preparing for CUET English 2026 and want a clear topper strategy? 🤔 This video gives you a 9-month roadmap that covers everything you need: antonyms, idioms,",strategy,47600,1759595408
youtube,AIIMS Nursing Institute,https://www.youtube.com/watch?v=6rhzNSVAINk,AIIMS Nursing Institute,AIIMS BSc Nursing 2026 | Final 7 Months Strategy 🔥 | Score 90+ Marks | Complete Study Roadmap,#aiimsbscnursing #aiims #bscnursingexam #aiimsnursingbook   Welcome to AIIMS NURSING INSTITUE ( All AIIMS Competitive Exams) Preparation.  AIIMS BSc Nursing 2026 | Final 7 Months Strategy 🔥 | Score 90+ Marks | Complete Study Roadmap  WHATSAPP NUMBER:- 8619850532 +912235288880  🔴𝐉𝐎𝐈𝐍 𝐎𝐔𝐑 𝐓𝐄𝐋𝐄𝐆𝐑𝐀𝐌 𝐂𝐇𝐀,strategy,623000,1759593523
youtube,"Engineers Wallah - AE, JE",https://www.youtube.com/watch?v=PdaOhLtGG_I,"Engineers Wallah - AE, JE",2026 में Sarkari Engineer कैसे बनें? | Full Roadmap | AE/JE Exams Preparation 2026 | SSC JE | RRB JE,"2026 में Sarkari Engineer कैसे बनें? | Full Roadmap | AE/JE Exams Preparation 2026 | SSC JE | RRB JE 🚀 How to Become a Government Engineer in 2026? | Full Roadmap for AE/JE Exam Preparation 💼  If you want to succeed in SSC JE, RRB JE, or other AE/JE exams 2026, this video gives you a complete step-b",strategy,474000,1759586537
youtube,Prem Sharma,https://www.youtube.com/watch?v=z5Zi51DrSDA,Prem Sharma,START CLASS 10th from 7 OCTOBER 🔥 4 Months Most Easy Roadmap Score 98% in Board Exam,START CLASS 10th from OCTOBER 🔥 4 Months Most Easy Roadmap Score 98% in Board Exam   My Educart GRANTH PYQ's Book 👇 (Limited 240 Books Left) https://amzn.to/4jK9RWV   Download CBSE Sample Papers (New) 📖 https://drive.google.com/drive/folders/17725fgdE55UPZ-itULFtGergOuoyOli1  Solution of Sample Pape,strategy,251000,1759577724
youtube,Jayant Padhi,https://www.youtube.com/watch?v=5jlIiE1aBr4,Jayant Padhi,The Ultimate Sales Training for 2026 [Full Course],"Get all my AI Resources here: https://jayant.myflodesk.com/xa0xxbfzhn Apply to work with us here: https://onepagebusinessplan.in/apply?sl=Jayant Funnel Map: https://miro.com/app/board/uXjVKDdP0Qc=/?share_link_id=68795125895  Most people think selling is about talking more, convincing harder, and clo",sales training,21400,1759647077
youtube,Yasin Shakir Official ,https://www.youtube.com/watch?v=lnBh9-Q5aw4,Yasin Shakir Official ,Sales Training Lahore | Best Techniques for Sales Targets Achievement | Yasin Shakir,#salestraining  #salestips  #salestargets  #salesincrease  #salestechniques  Course NO:4 LAHORE SESSION Sales Booster Program سیلز ٹارگٹ سیٹ اور اچیو کیسے کریں؟ YSELTI ONLINE TRAINING 3 گھنٹے کے فزیکل ٹریننگ سیشن میں آپ سیکھیں گے ۔ کونی کمپنیاں کبھی سیلز ٹارگٹس حاصل نہیں کر پاتیں؟ کامیاب کمپنیز سیلز,business coaching,40500,1759302335
youtube,Chef Dheeraj Bhandari(Billionaire Chef Media Pvt),https://www.youtube.com/watch?v=aFcEZOfnEUU,Chef Dheeraj Bhandari(Billionaire Chef Media Pvt),This Simple Technique Will Double Your Restaurant's Sales 📈,"Join Chef Dheeraj Bhandari for an exclusive behind the scenes look at the brand new Casa Laban Global Dessert Gelato Shop in Hyderabad! In this video, we are pulling back the curtain to show you.   This is more than just a cooking video; it's a real world case study on what it takes to launch a succ",eta,157000,1759062600
youtube,Ankush Pare - Stammering & Speaking Coach,https://www.youtube.com/watch?v=RBmsbF3sFM0,Ankush Pare - Stammering & Speaking Coach,Master Public Speaking & Overcome Stage Fear in 109 minutes - Full Course,Apply Here For FREE CONSULTATION: Watch 90 Min Free Masterclass & Get Complete Stammering Solution Strategy With Steps & 95% Fluency In 21 Days Only.  CLICK TO WATCH - https://ankushpare.com/freetraining/ 🔗  🆓 Get FREE Access Now  🎥 Full Masterclass + Fluency Training → https://youtu.be/9Inj5cRyR-k?,mindset,58100,1759761031
youtube,Bishal Sarkar Best Public Speaking Coach India,https://www.youtube.com/watch?v=PLkhf_LVzUc,Bishal Sarkar Best Public Speaking Coach India,3 Tricks to Make Your Voice Irresistible 😲🎶,"Speak, lead, and influence like a CEO—join the Masterclass today: https://link.thekingofconfidence.com/?utm_source=organic  🎤 *Stop wasting time in your life and join our NEXT World-Class Speaking Public Speaking Program* for Leaders (limited group size), get in touch with our team at +91-88803-6152",leadership,22200,1759676449
youtube,Bishal Sarkar Best Public Speaking Coach India,https://www.youtube.com/watch?v=LkaAAGzlB40,Bishal Sarkar Best Public Speaking Coach India,3 Hacks to Unlock Unshakable Confidence 🔓😲,"Speak, lead, and influence like a CEO—join the Masterclass today: https://link.thekingofconfidence.com/?utm_source=organic  🎤 *Stop wasting time in your life and join our NEXT World-Class Speaking Public Speaking Program* for Leaders (limited group size), get in touch with our team at +91-88803-6152",leadership,22200,1759590040
youtube,Recording lk,https://www.youtube.com/watch?v=NvHMs95Ieu0,Recording lk,ශාස්ත්‍රීය සංගීතය හැදෑරිය යුත්තේ ඇයි | Why study classical music? | voice training,"#voicetraining  #muic #musicworkhop  voice training, voice training mtf, voice training ftm, voice training for beginners, voice training for trans women, voice training for singers, voice training exercises, voice training for speaking, voice training for deeper voice, voice training exercises mtf,",public speaking,148000,1759320057
youtube,Method K9,https://www.youtube.com/watch?v=bBGWG2T9aCw,Method K9,Level 1 Dog Training Course,Our certification programs will be a excellent fit for the average dog owner looking to start a career in dog training or for professional dog trainers looking to add more certifications to their tool box.  •Online and In-Person Options.  •Go and your own pace.  •Payment Plans (These will be offered,business coaching,22700,1759089644
youtube,Method K9,https://www.youtube.com/watch?v=1IDlrElxHZs,Method K9,Find Your Training Client's Priorities,Our certification programs will be a excellent fit for the average dog owner looking to start a career in dog training or for professional dog trainers looking to add more certifications to their tool box.  •Online and In-Person Options.  •Go and your own pace.  •Payment Plans (These will be offered,business coaching,22700,1758996035
youtube,Bishal Sarkar Best Public Speaking Coach India,https://www.youtube.com/watch?v=DvA0fFrF_bE,Bishal Sarkar Best Public Speaking Coach India,Want a Life of Freedom? Start With This One Shift 🗝️✨,"Speak, lead, and influence like a CEO—join the Masterclass today: https://link.thekingofconfidence.com/?utm_source=organic  🎤 *Stop wasting time in your life and join our NEXT World-Class Speaking Public Speaking Program* for Leaders (limited group size), get in touch with our team at +91-88803-6152",leadership,22200,1758985224
youtube,Method K9,https://www.youtube.com/watch?v=Wy8A6zK84p0,Method K9,A Career in Training,Our certification programs will be a excellent fit for the average dog owner looking to start a career in dog training or for professional dog trainers looking to add more certifications to their tool box.  •Online and In-Person Options.  •Go and your own pace.  •Payment Plans (These will be offered,business coaching,22700,1758909643
youtube,pyramid Classes Defence ,https://www.youtube.com/watch?v=uF0sV6j7SWo,pyramid Classes Defence ,Motivation for competitive exams | best Banking Railway SSC coaching centre in Bhubaneswar,"📞 Call Us: 9090660256  | 📍 Visit Us: Nayapalli, Bhubaneswar. 📲 Download the App Now! 👇👇👇👇 https://bit.ly/3bBBpdQ                      Telegram Channel - https://t.me/pyramidclasses 🌟 ଆସୁଛି ନୂଆ Govt. Job Vacancy ପିଲାମାନେ, ଏବେ ତୁମ Govt Job ସ୍ଵପ୍ନ ସାକାର କରିବାର ପାଇଁ, 📢 Join କରନ୍ତୁ!  ନୂଆ Foundation Batch",strategy,15400,1758889877
youtube,Bishal Sarkar Best Public Speaking Coach India,https://www.youtube.com/watch?v=0BiWTuloDGQ,Bishal Sarkar Best Public Speaking Coach India,How These 4 Leaders from Different Cities Are Transforming Their Speaking with Bishal Sarkar,"Speak, lead, and influence like a CEO—join the Masterclass today: https://link.thekingofconfidence.com/speak-with-confidence?utm_source=organic  🎤 *Stop wasting time in your life and join our NEXT World-Class Speaking Public Speaking Program* for Leaders (limited group size), get in touch with our t",leadership,22200,1758870000
youtube,Vijender Masijeevi,https://www.youtube.com/watch?v=t91EUJidjW4,Vijender Masijeevi,YouTube Teachers EXPOSED? Online Coaching Reality Check: Are Students Really Learning?,"Why is online education turning into a battle for attention? With student attention span dropping to just 8 seconds, many online teachers and online coaching platforms are resorting to cringe content to stay relevant. But is this really improving learning outcomes, or simply distracting from the rea",public speaking,1490000,1758720351
youtube,Bishal Sarkar Best Public Speaking Coach India,https://www.youtube.com/watch?v=tvw5EQQy96c,Bishal Sarkar Best Public Speaking Coach India,3 Deadly Communication Mistakes That Push People Away 💥❌,"Speak, lead, and influence like a CEO—join the Masterclass today: https://link.thekingofconfidence.com/?utm_source=organic  🎤 *Stop wasting time in your life and join our NEXT World-Class Speaking Public Speaking Program* for Leaders (limited group size), get in touch with our team at +91-88803-6152",leadership,22200,1758553241
youtube,WellTalk Institute,https://www.youtube.com/watch?v=qBgMIf9Osb8,WellTalk Institute,Hilarious English presentation | Spoken English | How to give  presentation in English | WellTalk ,https://youtu.be/eOqNMm7B1p8 part one👆     Best Public speaking Confidence Building  https://youtu.be/YklcKSS60MA   Confidence Building activity  https://youtu.be/mB064n7TBtY  solitary English speaking Debate https://youtu.be/BXWGlDKQq84  Debate on street food  https://youtu.be/WIMP-FmaUCs  Cabin cr,leadership,552000,1758548187
youtube,EVEREST COACHING POINT,https://www.youtube.com/watch?v=WkrXACN5cds,EVEREST COACHING POINT,Heart Touching Words by Jain Sir Everest Coaching Point || Govt Job Preparation 2025,"📚 Welcome to Everest Coaching Point – The Best SSC Coaching Centre in Hyderabad & South India  Everest Coaching Point is India’s trusted institute for SSC CGL, CHSL, MTS, GD, SI, Constable, and other central & state government job exams. Known as the No.1 SSC coaching centre in Hyderabad, we provide",eta,113000,1758538864
youtube,Astute NewsHound,https://www.youtube.com/watch?v=eih6lDwEumo,Astute NewsHound,How Drones Can Transform African Military Operations?,"Drones offer significant potential in Africa by enhancing military operations through threat detection and providing force multiplication beyond human capabilities, stated Colonel Abubakar Surajo Imam, head of the Center for Innovation and Creativity at the Nigerian Defense Academy. However, he poin",operations,10600,1759045505
youtube,Tone Academy,https://www.youtube.com/watch?v=nTQ15k8yUok,Tone Academy,Operation Bhaskar | Indian Armed Forces Major Mission | Tone Academy #gk,"Operation Bhaskar is one of India’s notable defence operations, highlighting the country’s strategic strength and security initiatives.  #OperationBhaskar #indiandefence #defencecurrentaffairs #toneacademy #indianarmy #cds  #mcqs #CurrentAffairs2025 #militaryoperations #ndaexam #capfexam #competitiv",operations,93500,1758101424
youtube,Tone Academy,https://www.youtube.com/watch?v=mSY8nz2NQOg,Tone Academy,"Army’s Operation Rahat | Important GK for UPSC, SSC, Defence Exams #gk","Welcome to @TOneAcademy   #OperationRahat #indianarmy  #defencegk  #currentaffairs2025  #gk2025  #toneacademy  #upsc  #ssc  #competitiveexams  #defencemcqs  #generalknowledge #updates #news #latestupdates #tgpsc #telgunews  In this video, we explain Army’s Operation Rahat, one of the largest humanit",operations,93500,1757482567
youtube,Casey Zeman,https://www.youtube.com/watch?v=nxYo4MF2Xnc,Casey Zeman,The Truth About Automated Webinars (No One Tells You),"Automated webinars can look and feel just like a live event… but here’s the part most people never talk about. If you want to use automation to scale your business without losing trust, you need to understand the fine line between authenticity and deception.  👉 Join Casey’s Free Training: https://bi",entrepreneurship,75000,1759281548
youtube,Casey Zeman,https://www.youtube.com/watch?v=UKZkanLbS1M,Casey Zeman,From Click to Client: Automated Webinar Strategy,"Most ads don’t convert… but it’s not the ad’s fault. The secret lies in the funnel that comes after the click. In this video, I’ll break down the exact process of how to take someone from seeing your ad to signing up for your webinar and ultimately becoming a client.  👉 Join my Free Training: https:",strategy,75000,1759196801
youtube,Didi Muriadi,https://www.youtube.com/watch?v=PU_FlCZJ9go,Didi Muriadi,Strategi Jitu Tingkatkan Profit Bisnis Anda | Webinar UMKM - Coach Didi Muriadi,"Apakah bisnis Anda sering terjebak dalam perang harga dengan kompetitor? 🤔  Turunin harga terus malah bikin profit makin tipis, dan ujung-ujungnya bisnis jadi nggak sehat.  Di video ini, saya akan membagikan tips praktis dan strategi ampuh untuk: ✅ Menentukan value bisnis agar tidak dibandingkan han",mindset,21700,1758776865
youtube,Circadia Skincare,https://www.youtube.com/watch?v=jjV6RK_FV5o,Circadia Skincare,Circadia Business + Accelerator Launch Webinar,"Increase your spa revenue, attract new clients, and simplify your retail sales with our all-in-one membership program.  - FREE Shipping 4x/month - Elevated Drop shipping Program - Listed Partner Locator for National Ad Campaign - FREE Access to ALL Advanced Education - Monthly Strategic Business Coa",business coaching,12800,1758578468
youtube,Circadia Skincare,https://www.youtube.com/watch?v=NRoaAJsWlz4,Circadia Skincare,Circadia + Business Accelerator,"Increase your spa revenue, attract new clients, and simplify your retail sales with our all-in-one membership program.  - FREE Shipping 4x/month - Elevated Drop shipping Program - Listed Partner Locator for National Ad Campaign - FREE Access to ALL Advanced Education - Monthly Strategic Business Coa",business coaching,12800,1758576433
youtube,Circadia Skincare,https://www.youtube.com/watch?v=PJRtLp4ECS8,Circadia Skincare,Circadia Business + Accelerator Launch Webinar,"Increase your spa revenue, attract new clients, and simplify your retail sales with our all-in-one membership program.  - FREE Shipping 4x/month - Elevated Drop shipping Program - Listed Partner Locator for National Ad Campaign - FREE Access to ALL Advanced Education - Monthly Strategic Business Coa",business coaching,12800,1758568604
youtube,Simon Leung,https://www.youtube.com/watch?v=elNqcCJ_wyw,Simon Leung,How to Run a Webinar That Converts #webinars #webinarsales #salesstrategy #salesclosing #ai #shorts,"How to Run a Webinar That Converts  Running a webinar is one thing; running a webinar that actually converts is another. From creating engagement to building trust to delivering the perfect pitch, every step matters. In this video, Simon Leung shares the strategies behind high-converting webinars so",mindset,12600,1758475865
youtube,Jaboneko,https://www.youtube.com/watch?v=mQZ6DL2fa-A,Jaboneko,webinar formas de emprender en cosmética #jabón #cosmeticanatural #emprendedores,,eta,13300,1758391243
youtube,Simon Leung,https://www.youtube.com/watch?v=SpFCcmQ46jw,Simon Leung,Why Webinars Work: The Psychological Edge #webinars #webinarsales #webinarclosing #webinarselling,"Why Webinars Work: The Psychological Edge  Webinars aren’t just another sales tool; they’re built on psychology. They combine authority, storytelling, scarcity, and community to create a powerful buying environment. Done right, they feel less like a pitch and more like an experience. That’s why webi",mindset,12600,1758386466
youtube,Hummingbot,https://www.youtube.com/watch?v=z7Bw46QR1N4,Hummingbot,Botcamp Cohort 12 Demo Day (Full),"In this video, Michael introduces Demo Day for Cohort 12 of Botcamp, where traders and developers learn to build and deploy automated crypto trading bots.  Discover what students in Cohort 12 accomplished, including: - VWAD Enhanced Bollinger Strategy - Following Spot Orderbook Skew & Fading Open In",strategy,14400,1759498796
youtube,FinnovationZ by Prasad,https://www.youtube.com/watch?v=WBBNttcUsQo,FinnovationZ by Prasad,Most successful investment strategy!#smallcase #valueinvesting,,strategy,2640000,1758544459
youtube,Buying Online Businesses,https://www.youtube.com/watch?v=5XVC737NlF0,Buying Online Businesses,[Case Study] Acquiring A Media & Membership Business Doing $2K Net Profit P/mth In 6 Months with AJ,"This episode is an eye-opening case study where Jaryd Krause sits down with AJ, a Buying Online Businesses graduate who made the leap from running a large IT team at a global bank to building an online business portfolio.  AJ shares how he went from launching a failing startup to successfully acquir",business acquisition,10500,1758135605
youtube,Coach Praveen Wadalkar,https://www.youtube.com/watch?v=5Zsy7MDxc_k,Coach Praveen Wadalkar,The Battle Inside Your Head  #neurology #motivation #selfimprovement,"Your brain isn't one boss—it's a team of a 300-million-year-old president (fear), a 200-million-year-old VP (habits), and a young 300,000-year-old CEO (logic). The battle inside your head is real. Learn how to train your inner team. #BrainHacks #Neuroscience #SelfMastery #PersonalDevelopment #MindMa",habits,87200,1759718031
youtube,Peggy | Identity & Self-Leadership Coach,https://www.youtube.com/watch?v=Z61eUX157B4,Peggy | Identity & Self-Leadership Coach,"If you wanna break the cycle, tune in for more! 🤎✨ #mindsetcoach #selfdevelopment #limitingbeliefs",#selflovetips #loveyourselffirst #selfcarematters #selfcaretips #selflovecoach #dailyselflove #relationships101 #relationshipsbelike #relationshipquote #datingadvice #relationshipboundaries #mindsetcoach #relationshipskills #relationshipstruggles #relationshiphealing #situationship #womencoachingwom,mindset,16100,1759569821
youtube,MVN Kasyap - Telugu,https://www.youtube.com/watch?v=rVDBmK0mwCU,MVN Kasyap - Telugu,Do You Always Want Everything to Be Perfect? | Telugu Motivation Shorts | MVN Kasyap,Do You Always Want Everything to Be Perfect? | Telugu Motivation Shorts | MVN Kasyap  Call Us @ +91 7842031011 / +91 8106739252 / +91 6304094817   Join our WhatsApp Community:- https://chat.whatsapp.com/GuFJMCHHhAtJWU3Oyk8w4n?mode=r_c  Fill in your Details to get More updates about our programs:- ht,eta,361000,1759059054
youtube,Sneh Desai,https://www.youtube.com/watch?v=NHtlvyzol2Y,Sneh Desai,Goa Is Calling Your Next Level #snehdesai #ytshorts #ultimatelifebootcamp #transformation #mindset,"Comment ""GOA"" for the Registration Link   If you’re feeling lost, low, or stuck, remember this, life shifts the moment you decide to move forward.  That first step could be your biggest breakthrough.  At the Ultimate Life Bootcamp in Goa (Oct 8th–12th, 2025), you’ll experience 5 days designed to res",mindset,725000,1758723582
youtube,KarriereFunk,https://www.youtube.com/watch?v=EK9Xre8Q6Io,KarriereFunk,Bootcamp-Syndrom: Bleiben oder Job wechseln? 🤔  #jobwechsel  #bewerbung  #karriere  #mindset,"Quälst du dich im Job oder ist es nur das Bootcamp-Syndrom? Erfahre, wie du erkennst, ob du einfach durchhalten musst oder ob es wirklich Zeit für einen Neuanfang ist. 🚀  Hol dir die Klarheit für deine nächsten Karriereschritte. 🎯  Gehe auf https://karrierefunk.com/ und sichere dir mit dem Code ""YOU",mindset,55300,1757336421
youtube,Cole Gordon,https://www.youtube.com/watch?v=tchSbnW0yuI,Cole Gordon,The Ultimate Sales Training For 2026 (5+ Hour Course),Copy and Paste the 11 Funnels That Helped Me Hit $30M/yr👇 https://bit.ly/StealMy30mFunnels  Want my personal help scaling your business? Or staffing your sales team? Click here 👇 https://bit.ly/WorkWithClosersio,sales training,38200,1759334498
youtube,D2D Experts,https://www.youtube.com/watch?v=QWtVhMIA3xc,D2D Experts,Why Most Sales Managers Fail — And How to Fix It in 2 Days 💼,"Most managers are promoted without ever being trained to lead... and it shows.   The Sales Manager Bootcamp is designed to change that. In two focused days, you'll learn how to coach reps, lead meetings, drive accountability, and build a team that actually performs. 💼   📍 Sandy, UT 🗓️ October 6–7 🎟️",mindset,43900,1758501044
