platform,prospect_name,company,audience_type,audience_metric,intent_score,contactability_score,freshness_score,total_score,website,email,contact_url,evidence_url,evidence_quote,created_date,source_title,source_excerpt,author_handle
youtube,Life Coaching Academy,Home | Life Coaching Academy,yt_subscribers,67800,1,2,2,8,https://www.lifecoach.lk,0e6a29e4756740a8a63493e912ba2174@sentry.wixpress.com;1eeb89147c984dc6bc3ffafd9e6cd089@sentry.wixpress.com;2062d0a4929b45348643784b5cb39c36@sentry.wixpress.com,,https://www.youtube.com/channel/UC-VnwuOt3fUrmOLvqYyYs8Q,coaching,2025-10-06,Channel: Life Coaching Academy (avg_views:5203),"The Life Coaching Academy is dedicated to provide profound knowledge, Training & Motivation about Personality Development & Life Transformation for Sri Lankan People in Sinhala Language.

💠 Redesign Your Life with - LifeCoach.lk  
Visit: https://www.lifecoach.lk  for more information.

🔸 Inquiries: ",Life Coaching Academy
youtube,Iron Man Lifestyle,Mentorship 2.0,yt_subscribers,751000,1,1,2,8,https://www.ironmanlifestyle.co/coaching,,,https://www.youtube.com/channel/UCf07eBo_ZzNmhVeTRyJDJ3g,coaching,2025-10-06,Channel: Iron Man Lifestyle (avg_views:20202),"📌📌 Are you a working professional/entrepreneur looking to get good with girls? Apply for Mentorship 2.0: 👇👇
https://www.ironmanlifestyle.co/coaching

===================================

Hi, I'm Kshitij Sehrawat. 

I'm an international personal development and dating coach helping Indian Men be more",Iron Man Lifestyle
reddit,grassisgreen4,,reddit_upvotes,2,3,0,1,7,,,,https://www.reddit.com/r/Wordpress/comments/1nw4xxo/need_help_with_spam_blog_posts/,,2025-10-02,Need Help With Spam Blog Posts,"Basically someone made a bunch of spam blog posts around 2000 of them on the same date and time on the wordpress site im working on, of course its a bot or something but how can i find out the source of this and what can i do to make sure it doesnt happen again? TIA",u/grassisgreen4
youtube,Shine With Curiosity and Encouragement,,yt_subscribers,85,3,0,1,7,,,,https://www.youtube.com/watch?v=mr_safObMd0,,2025-10-01,AI Therapy Terrifies Me! Chatbots&#39; Sweet Lies? #shorts,"AI chatbots are increasingly being used for therapy, but is that a good thing? Some experts worry about the implications of AI ...",Shine With Curiosity and Encouragement
youtube,Muveshan Moodley | AI Automation,,yt_subscribers,92,3,0,1,7,,,,https://www.youtube.com/watch?v=eM8-xNRW6vE,,2025-10-01,Create a R1000 AI chatbot with me ,"Want to build your own AI chatbot in less than 10 minutes? In this video, I'll walk you step-by-step on how to create a chatbot ...",Muveshan Moodley | AI Automation 
youtube,Nightwhisper,,yt_subscribers,27,3,0,1,7,,,,https://www.youtube.com/watch?v=myToxnoRt7A,,2025-10-01,Chatbot Warned Me: “Don’t Go to Sleep Tonight” — Terrifying!,KAVQVB5S8S2A8IWK.,Nightwhisper
youtube,BVTV,,yt_subscribers,395,3,0,1,7,,,,https://www.youtube.com/watch?v=twOjT1p89PQ,,2025-10-01,What Did You Just Call Me?! #chatbot,,BVTV
youtube,charlie roa,,yt_subscribers,75,3,0,1,7,,,,https://www.youtube.com/watch?v=2QHfRQiZ00E,,2025-10-01,Cuando me terminan pero soy el sapo de la oficina #chatbot #humor #emprendimiento #ia #colombia,,charlie roa
youtube,Post Crash,,yt_subscribers,11,3,0,1,7,,,,https://www.youtube.com/watch?v=Jss3FCksjJA,,2025-09-29,My AI Chatbot Fell in Love With Me,ai #bing #aigonewrong #creepy #chatbot #microsoft #technology #aiethics #postcrash.,Post Crash 
youtube,AprilLewis83,,yt_subscribers,1,3,0,1,7,,,,https://www.youtube.com/watch?v=-7BBTwnxjYo,,2025-09-29,Look back... or not? Tell me!#sekaiapp #ai #aiapp #chatbot #sekai #fyp,Sekai_App.,AprilLewis83
youtube,Emily Hikari,,yt_subscribers,4,3,0,1,7,,,,https://www.youtube.com/watch?v=_NfOgutyn7I,,2025-09-29,Gets me going every time! #shapesinc #harrypotter #chatbot #anime #relatable #combo,,Emily Hikari
youtube,Richard Ngangsi Akumbo,,yt_subscribers,1,3,0,1,7,,,,https://www.youtube.com/watch?v=wNBx2F3nbAM,,2025-09-30,🎯 Say Goodbye to Customer Service Overwhelm with AI Chatbots! 🤖,Running a small business can feel like juggling a million tasks—and customer service often eats up the most time. I was ...,Richard Ngangsi Akumbo
youtube,Alex Hurschler – Kajabi & AI,Starte dein Online-Business mit Kajabi – 30 Tage kostenlos!,yt_subscribers,486,3,1,0,7,https://www.alexhurschler.ch/kajabi,,,https://www.youtube.com/watch?v=rUdzNHrrHYI,,2025-09-25,Kajabi Chatbot einrichten: 500 Leads → 50 Verkäufe automatisch (Creator.io Tutorial),Chatbot: https://www.alexhurschler.ch/kajabi Dieser Chatbot hat mir 500 Email-Adressen generiert und davon 50 direkte Verkäufe ...,Alex Hurschler – Kajabi & AI
youtube,Lauren Hurley,,yt_subscribers,19,3,0,1,7,,,,https://www.youtube.com/watch?v=Y7z7hUs4Wr0,,2025-09-29,Had to add a $4.95 one-time fee to keep my Skool community safe from scammers and bots 🤔💔,Had to add a $4.95 one-time fee to keep my Skool community safe from scammers and bots.,Lauren Hurley
youtube,ALLEN Career Institute,,yt_subscribers,1790000,1,0,2,7,,,,https://www.youtube.com/channel/UCgUeJ2Gv7rJtMBkQF2Ppn4A,coaching,2025-10-06,Channel: ALLEN Career Institute (avg_views:7721),"📍 ALLEN Career Institute is one of India's most trusted coaching institutes for competitive exams. Our YouTube channel offers high-quality educational content to help students prepare for exams such as JEE Advanced & Main, NEET-UG, Class VI to X, National/International Olympiads, and more.

➡️ ALLEN",ALLEN Career Institute
youtube,Career Launcher MBA,,yt_subscribers,129000,1,0,2,7,,,,https://www.youtube.com/channel/UCXBX0R2Qo6bypx0dj4SHDuQ,school,2025-10-06,Channel: Career Launcher MBA (avg_views:527),"Get insights into preparation strategies for CAT, XAT, NMAT, SNAP, MH-CET, and other top MBA entrance exams. Watch top CL mentors and MBA Gurus as they teach you shortcuts, tricks, and test-taking strategies to ace VARC, DILR, QA, DM, and more.

These video sessions help cover the most important top",Career Launcher MBA
youtube,School of Hard Knocks,,yt_subscribers,1700000,1,0,2,7,,,,https://www.youtube.com/channel/UCmtBqvOp6xHlecDO0Un9O4w,school,2025-10-06,Channel: School of Hard Knocks (avg_views:336186),"The School of Hard Knocks is a media company that promotes financial literacy through entertaining and engaging content.  The company name was inspired from the term ""I learned from the school of hard knocks"", which means to learn from life's hardest lessons. Our content is focused on helping people",School of Hard Knocks
youtube,Max Sturtevant,Calendly,yt_subscribers,16300,1,1,2,7,https://calendly.com/maxwellcopy/discovery-meeting,,https://calendly.com/maxwellcopy/discovery-meeting/contact,https://www.youtube.com/channel/UCEM2sO7E5KSMIqonVgb98ug,marketing,2025-10-06,Channel: Max Sturtevant (avg_views:2595),"$100M Generated for Ecommerce Brands | www.wellcopy.net

We do done-for-you email marketing management for ambitious ecommerce brands.

Book a free strategy audit: https://calendly.com/maxwellcopy/discovery-meeting 

Access all my links and free guides: linktr.ee/maxwellcopy 
",Max Sturtevant
youtube,Ali Abdaal,,yt_subscribers,6450000,1,0,2,7,,,,https://www.youtube.com/channel/UCoOae5nYA7VqaXzerajD0lg,productivity,2025-10-06,Channel: Ali Abdaal (avg_views:49622),"Hey, I'm Ali, a doctor turned entrepreneur, and the world’s most-followed productivity expert 😜 

On this channel, we explore evidence-based strategies and tools that can help us be more productive, and build a life that we love. 

If that sounds interesting, consider subscribing! See you in the nex",Ali Abdaal
youtube,Jesse Forrest,Home - Copywriting Courses | Start Copywriting,yt_subscribers,23300,1,1,2,7,https://startcopywriting.com/,,https://startcopywriting.com/contact,https://www.youtube.com/channel/UCD9wvTJCha5mZOO4SCcrjnA,copywriting,2025-10-06,Channel: Jesse Forrest (avg_views:1173),"Turning your passion for writing into a rewarding freelance copywriting career.
Grab my free guide 👇
https://startcopywriting.com/





",Jesse Forrest
youtube,Alex Cattoni,,yt_subscribers,396000,1,0,2,7,,,,https://www.youtube.com/channel/UCPEZnYBqewx-h43B5tLymYw,marketing,2025-10-06,Channel: Alex Cattoni (avg_views:2435),"Get Over 90+ ChatGPT Prompts 👇

2023's #1 Most Popular Copywriter 🥇 2022's DigitalMarketer of the Year 👑 
Alex Cattoni is an industry-leading copywriter, marketer, and the founder of the Copy Posse where she is on a mission to de-douchify the Internet, redefine modern marketing, and build an empathy",Alex Cattoni
youtube,Nick Saraev,,yt_subscribers,208000,1,0,2,7,,,,https://www.youtube.com/channel/UCbo-KbSjJDG6JWQ_MTZ_rNA,sales,2025-10-06,Channel: Nick Saraev (avg_views:12252),"Hi 👋 I'm Nick. I make money with AI & teach others how they can too.

I'm not the best in the world, nor are my accomplishments the most impressive... but some people think I have interesting things to say! To that end, this channel is a way to organize my thoughts and provide a guidepost for people",Nick Saraev
youtube,MasterClass,,yt_subscribers,1590000,1,0,2,7,,,,https://www.youtube.com/channel/UCFk7dqVnBayNPbrMtIwtaSw,masterclass,2025-10-06,Channel: MasterClass (avg_views:6489),"MasterClass is the streaming platform where anyone can learn from the world's best. With an annual membership, subscribers get unlimited access to instructors and classes across a wide range of subjects.

Step into Anna Wintour’s office, and Ron Finley’s garden. Get inspired by RuPaul, perfect your ",MasterClass
youtube,The Mindset Mentor Podcast,,yt_subscribers,513000,1,0,2,7,,,,https://www.youtube.com/channel/UCHl3aFKS0bY0d8JwqNysaeA,mindset,2025-10-06,Channel: The Mindset Mentor Podcast (avg_views:12958),"The Mindset Mentor™ podcast is designed for anyone desiring motivation, direction, and focus in life. Host Rob Dial has amassed a passionate following of over 3 million social media followers, including business professionals, entrepreneurs, and small business owners with his expertise and passion f",The Mindset Mentor Podcast
youtube,The Brand Hustler,,yt_subscribers,123000,1,0,2,7,,,,https://www.youtube.com/channel/UC1rxCKjGIWcZ2ZAozt_-u3Q,university,2025-10-06,Channel: The Brand Hustler (avg_views:950),"Hiiii Hustle Babes! 👋🏽 I'm Shanelle Q. — also known as The Brand Hustler. I'm a brand strategist, content creator, and multi-6-figure entrepreneur who helps product-based business owners build powerful brands and grow with brand-centric marketing strategies.

On this channel, I dive deep into brandi",The Brand Hustler
youtube,Fit Body Boot Camp,Find a Gym Near You | Fit Body Boot Camp Locations,yt_subscribers,10300,1,1,2,7,https://fitbody.link/4momlFO,,https://fitbody.link/4momlFO/contact,https://www.youtube.com/channel/UCWjS_zCgRQNTd7qClvYOHVw,program,2025-10-06,Channel: Fit Body Boot Camp (avg_views:785),"Fit Body Boot Camp is home of the Afterburn workouts - a group personal training program where you'll get high energy, fun, and challenging workouts designed to burn maximum fat and tone your entire body in only 30 minutes.

Sign up now for a FREE 7 Day Trial:

https://fitbody.link/4momlFO",Fit Body Boot Camp
youtube,Jason Brown,,yt_subscribers,285000,1,0,2,7,,,,https://www.youtube.com/channel/UC1rW5zU3XAUvFkIu-MOf2iA,method,2025-10-06,Channel: Jason Brown (avg_views:2818),"Hey, I’m Jason.

For the past 20+ years, I’ve trained everyone from NFL athletes and Navy SEALs to everyday athletes who just want to feel strong, capable, and in control of their health.

I hold a Master’s in Exercise Science, a CSCS, and I’m currently pursuing my PhD in Kinesiology with a focus on",Jason Brown
youtube,Lu-Coaching,Instagram,yt_subscribers,15500,1,1,2,7,https://www.instagram.com/lu,,https://www.instagram.com/lu/contact,https://www.youtube.com/channel/UCIIyJWfXywOyT1Avd5_1GDw,coaching,2025-10-06,Channel: Lu-Coaching (avg_views:7055),"LU-COACHING

In diesem Kanal dreht sich alles um Ernährung sowie Fitness mit tollen Rezeptvideos und hilfreichen Trainingsvideos.
Lasst Euch inspirieren und abonniert den Channel für Motivation pur.

Ihr findet mich außerdem bei:

Homepage: www.lu-coaching.de

Instagram: https://www.instagram.com/lu",Lu-Coaching
youtube,ZEROX FITNESS COACH,,yt_subscribers,181000,1,0,2,7,,,,https://www.youtube.com/channel/UCp9IKw3QL6t8io9f71FYF5Q,coach,2025-10-06,Channel: ZEROX FITNESS COACH (avg_views:117443),"【 WELCOME TO TABATA 】
Here's a killer Calorie Killer workout for you all! Time to get the heart pumping, burn some calories and tone your Body Shape.
Everything You Need to Know About Tabata, the Best Fat-Burning Workout.
In fact, perhaps the most effective workout can only take four minutes. It’s c",ZEROX FITNESS COACH
youtube,Family Fitness,,yt_subscribers,15400000,1,0,2,7,,,,https://www.youtube.com/channel/UCvVEcGPPEkn3zSdc-rniGMg,fitness,2025-10-06,Channel: Family Fitness (avg_views:41053),"For Promotions & Collaborations:  
Email: team@armaanmalik.in
",Family Fitness
youtube,Silvy Araujo,,yt_subscribers,422000,1,0,2,7,,,,https://www.youtube.com/channel/UCUDYnKJvSkJ2BMV19sRLNCA,fitness,2025-10-06,Channel: Silvy Araujo (avg_views:84207),"Hola todas!!!! 
Este es mi nuevo canal de YouTube, un espacio para compartir con ustedes tips de belleza, fitness, recetas y VLOGS. Nuevos videos todos los Jueves!! 

Gracias por subscribirse!

xoxo
Silvy

INSTAGRAM: @silvyaraujo
Facebook: SilvyAraujo
Contacto: araujosilvy@gmail.com",Silvy Araujo
youtube,Patrick Mouratoglou,,yt_subscribers,624000,1,0,2,7,,,,https://www.youtube.com/channel/UCnN1Rj2OtO67OIUimR18KWg,coaching,2025-10-06,Channel: Patrick Mouratoglou (avg_views:51519),"Hey guys,

This is Patrick Mouratoglou, the founder of the Mouratoglou Academy. You might know me as the former Coach of Serena. Or maybe you've been following my tennis tips on Instagram and want to see more!

You're at the right place.

I decided to join YouTube so that you can experience my tenni",Patrick Mouratoglou
youtube,Magnus Method,,yt_subscribers,307000,1,0,2,7,,,,https://www.youtube.com/channel/UCUPwPMjZAM5LNB8Fd7M5b9w,method,2025-10-06,Channel: Magnus Method (avg_views:5300),"Magnus Lygdback is a world-renowned Swedish health and wellness expert, entrepreneur, and lifestyle coach. For over 20 years, he has become best known for working with some of the world’s most recognizable actors, musicians, athletes, artists and high-performance business entrepreneurs.

Throughout ",Magnus Method
youtube,Sydney Cummings Houdyshell,,yt_subscribers,2570000,1,0,2,7,,,,https://www.youtube.com/channel/UCVQJZE_on7It_pEv6tn-jdA,coach,2025-10-06,Channel: Sydney Cummings Houdyshell (avg_views:85945),"Welcome to your new workout home! I’m your personal trainer and training partner Sydney Cummings Houdyshell and I am a NASM Certified Personal Trainer, Fitness Nutrition Specialist, Women’s Fitness Specialist, and Stretching and Mobility Coach! 
My husband Dustin and I own Royal Change, our fitness ",Sydney Cummings Houdyshell
youtube,and8 Fitness,,yt_subscribers,884000,1,0,2,7,,,,https://www.youtube.com/channel/UCgUNRhl07fJownkfzvTAL2w,fitness,2025-10-06,Channel: and8 Fitness (avg_views:270938),"and8 Fitness is a dance-based cardio workout designed to get your heart pumping and your whole body moving. From this 45-minute class, you can expect fun moves, wild energy, and a power playlist of hip hop, (t)rap and a dash of Top 40 hits - think Megan, Cardi, Lizzo, Glo and more!",and8 Fitness
youtube,Buddy Fitness,,yt_subscribers,570000,1,0,2,7,,,,https://www.youtube.com/channel/UCy0-3xdx7dTXMYmJc1jMbBQ,coach,2025-10-06,Channel: Buddy Fitness (avg_views:697104),"BUDDY FITNESS is a brand new channel created for the purpose of sharing information related to the Health and Fitness. Through our channel, we are providing you workout videos with proper knowledge which may help you to achieve your target fitness goals. You can get tips on proper diet through our v",Buddy Fitness
youtube,Zero_Gravity_Training,Just a moment...,yt_subscribers,50600,1,1,2,7,https://my.playbookapp.io/igors-filins,,,https://www.youtube.com/channel/UClHGH3KrRom_N09l3rkN2Og,method,2025-10-06,Channel: Zero_Gravity_Training (avg_views:10845),"🔽TRAIN REAL TIME WITH ME🔽

https://my.playbookapp.io/igors-filins

Welcome to the Zero_Gravity_Training!

I’m Igor – an amateur athlete with over 20 years of training experience. For the past 5 years, I’ve focused on performance, experimenting with a wide range of training styles, methods, and ideas",Zero_Gravity_Training
youtube,scooby1961,,yt_subscribers,603000,1,0,2,7,,,,https://www.youtube.com/channel/UC1XHNZDn3btv7454Pkz7THg,real estate,2025-10-06,Channel: scooby1961 (avg_views:4044),"Welcome to Scooby1961 - the channel for life. I do fitness, nutrition, and workout videos but I'm just as likely to do a video on coping with major life setbacks, saving, financial planning, real estate, or investing. I started this channel in 2006 after I retired.  I dont do the videos you want, I ",scooby1961
youtube,Basic Leadership Skills,"Most Popular Leadership Tools
 – Complete Leadership Academy",yt_subscribers,33800,1,1,2,7,https://completeleadershipacademy.com/collections/most-popular-leadership-tools,,https://completeleadershipacademy.com/collections/most-popular-leadership-tools/contact,https://www.youtube.com/channel/UChIrRPZkqUR6Cxbm2YIbE2w,academy,2025-10-06,Channel: Basic Leadership Skills (avg_views:484),"Grab my FREE Popular Download: 101 Leadership Questions to spark Meaningful Dialogue & Reflection. (Questions for 1:1s, team meetings, and more): https://completeleadershipacademy.com/collections/most-popular-leadership-tools

Everything you need to Lead. Inspire. Achieve.

We specialize in Leadersh",Basic Leadership Skills
youtube,Maxwell Leadership,,yt_subscribers,286000,1,0,2,7,,,,https://www.youtube.com/channel/UCcY4omYaHiAMk7x4mNcQmpg,leadership,2025-10-06,Channel: Maxwell Leadership (avg_views:1828),"Meet the new Maxwell Leadership®: helping you lead powerful, positive change.

Going forward, we are Maxwell Leadership: one unified brand with one unified voice, offering you the opportunity to lead powerful, positive change in yourself, others and the world through values-based leadership.

As par",Maxwell Leadership
youtube,Life Coaching,,yt_subscribers,106000,1,0,2,7,,,,https://www.youtube.com/channel/UCYHsVGsCXFCrWpt0szw3klQ,coaching,2025-10-06,Channel: Life Coaching (avg_views:1064),"In questo canale YouTube 
- condivido idee relative alla crescita personale nelle relazioni
- rispondo alle vostre domande",Life Coaching
youtube,Coach Deepak Jain,Your 2.O Main Page,yt_subscribers,31600,1,1,2,7,https://webinar.anokhabrain.com/yournext,,https://webinar.anokhabrain.com/yournext/contact,https://www.youtube.com/channel/UCAxeUiUdEiyKwDmGHoNxqaA,coach,2025-10-06,Channel: Coach Deepak Jain (avg_views:1800),"Join now You Vs Your 2.0 Club
https://webinar.anokhabrain.com/yournext

Join Now 3 Days Free Bootcamp
https://webinar.anokhabrain.com/updated-bootcamp
----------------------------------------------------------------------------
Anokha Brain is an organization run by Mr. Deepak Jain

Deepak Jain is a",Coach Deepak Jain
youtube,Dr. Wlodarek Life Coaching,,yt_subscribers,272000,1,0,2,7,,,,https://www.youtube.com/channel/UCVW6hd2cad47qOHVrtOWVKA,coaching,2025-10-06,Channel: Dr. Wlodarek Life Coaching (avg_views:42354),"Für alle, die mehr wollen im Leben: Glück. Erfolg. Anerkennung. Charisma. Erfüllung von Herzenswünschen. Entfaltung der Persönlichkeit. Die Videos auf meinem Channel enthalten praktische und wirkungsvolle Tipps, wie Sie Ihre Ziele am besten erreichen. Dazu interessante Infos und kleine Übungen zu de",Dr. Wlodarek Life Coaching
reddit,Easy-Department-516,,reddit_upvotes,1,3,0,0,6,,,,https://www.reddit.com/r/smallbusiness/comments/1nop7z4/using_ai_for_customer_support_before_and_after/,,2025-09-23,Using AI for Customer Support: Before and After,"After adding AI chatbots to businesses, here's what we've found: Before AI: Customers waiting hours for help Lost leads because no one got back to them quickly enough Staff members spend 50 hours a day answering the same question.  After AI: Customers get answers right away (24/7) More satisfied cus",u/Easy-Department-516
reddit,Ashamed-Nectarine-84,,reddit_upvotes,1,2,0,2,6,,,,https://www.reddit.com/r/onlinecourses/comments/1nwvtuq/kajabi_is_too_expensive_any_good_alternatives/,,2025-10-03,Kajabi is too expensive — any good alternatives with email marketing?,"I’m a course creator getting ready to launch some new content, so I’ve been exploring different online course platforms. I recently checked out Kajabi, and while it looks super solid feature-wise, the pricing is honestly a bit too much for me right now.   On top of that, I noticed that you only get ",u/Ashamed-Nectarine-84
reddit,Only_Nothing9585,,reddit_upvotes,582,1,0,2,6,,,,https://www.reddit.com/r/selfimprovement/comments/1nz1z5y/is_37_too_late/,,2025-10-05,Is 37 too late?,"I'm about to turn 37 and I have completely wasted my life. I never had a goal, I've never gone travelling, never had a relationship and lack many things I thought I would have by now. I work part time and live in a shared house. For many years I had depression, mostly because of fake friends and lon",u/Only_Nothing9585
reddit,Jay_D88,,reddit_upvotes,1,2,0,2,6,,,,https://www.reddit.com/r/SKOOL/comments/1nzd1b7/heartbroken_by_what_skool_has_become_my/,,2025-10-06,Heartbroken by What Skool Has Become — My Experience with Fake Courses and Zero Support,"I used to really love **Skool** — it felt like a place where people could learn, share, and grow together. But now, it honestly feels like it’s becoming a **shortcut for scammers** to make quick money off unsuspecting members.  Customer support has been a huge disappointment. It’s slow, unhelpful, a",u/Jay_D88
youtube,AI Videos 904,,yt_subscribers,11900,1,0,2,6,,,,https://www.youtube.com/watch?v=xInqTjZKtF4,,2025-10-06,📱Twin pet&#39;s Go Viral! Playing with smartphone in village filed 💃☺ Cutest Moment Ever!,Watch these adorable twin babies enjoying a sunny day in a lush green village field! ☀️ Wearing colorful diapers and sharing ...,AI Videos 904
youtube,m365 Show,,yt_subscribers,55000,1,0,2,6,,,,https://www.youtube.com/watch?v=cItEQprqauQ,,2025-10-06,Master Microsoft Fabric for Advanced Data Solutions,Unlock the full potential of your data strategies with this comprehensive guide to mastering Microsoft Fabric for advanced data ...,m365 Show
youtube,Nichonauta,,yt_subscribers,10800,1,0,2,6,,,,https://www.youtube.com/watch?v=i1rD-hrPaUg,,2025-10-06,Gemelo Digital: ¡Impresionante! 🤯,"Descubre el futuro de la innovación con los Gemelos Digitales. Este video te sumerge en el mundo de estas réplicas virtuales, ...",Nichonauta
youtube,1% W3LLNESS. 🔱,,yt_subscribers,11000,1,0,2,6,,,,https://www.youtube.com/watch?v=KPVBVE4BLok,,2025-10-05,Tell Me Why this Bot was Actually so Good hahaha🤣😳 #funny #shorts #trending #viral #reels #fypシ,,1% W3LLNESS. 🔱
youtube,Agency Daddy,100% Free Online Course - Start Your Own AI Agency,yt_subscribers,0,1,2,2,6,https://agencydaddy.com,flags@2x.png,https://agencydaddy.com/contact,https://www.youtube.com/watch?v=_GFJlpNQfKU,,2025-10-04,This Simple AI Chat Bot Pays Me Monthly (You Can Copy This Too),FREE Course & Bonuses + 30 Day Free Trial https://agencydaddy.com Are you stuck in a job that drains your energy? Sitting in ...,Agency Daddy
youtube,พี่จ๊ะเอ๋ Career Coaching,,yt_subscribers,18200,1,0,2,6,,,,https://www.youtube.com/channel/UCBEAZubQSytP3xA2cJwpIsQ,coaching,2025-10-06,Channel: พี่จ๊ะเอ๋ Career Coaching (avg_views:537),แหล่งรวบรวมความรู้ด้านการสมัครงาน,พี่จ๊ะเอ๋ Career Coaching
youtube,SUCCESS CAREER ACADEMY NURSING COACHING,,yt_subscribers,19700,1,0,2,6,,,,https://www.youtube.com/channel/UC0qGPPDRChmbHTAq84YleYQ,coaching,2025-10-06,Channel: SUCCESS CAREER ACADEMY NURSING COACHING (avg_views:3683),"*SUCCESS CAREER ACADEMY NURSING COACHING* BEST COACHING NURSING INSTITUTE IN MAHARASHTRA. Powered by Nursing Experts.
We are widely regarded as leader in nursing officer exam like DHS, DMER, ESIS, ZP, RRB, MUNCIPAL CORPORATION  ETC. 
▬▬▬▬▬▬▬▬▬▬▬▬▬▬▬▬▬▬▬▬▬▬▬
✔️ Experienced Faculty
✔️ Video & Audio Le",SUCCESS CAREER ACADEMY NURSING COACHING
youtube,Dr. Pam Turner,,yt_subscribers,29500,1,0,2,6,,,,https://www.youtube.com/channel/UC5BM0ewPNh-xzM9RMfj9v9Q,coaching,2025-10-06,Channel: Dr. Pam Turner (avg_views:437),"I am a expert in mental health licensure. I will help you pass your test 🌟

You are already an excellent clinician. You just do not have test testing skills. That is what I will teach you.!

Academic Coaching for World Changers - Coaching and tutoring for LMSW, LCSW, LMFT, LPC, CPCE, NCMHCE, NCE and",Dr. Pam Turner
youtube,Brittany Hayles Career Coach,,yt_subscribers,12600,1,0,2,6,,,,https://www.youtube.com/channel/UC0t4QUdDxrYUukrtEhAK76w,coaching,2025-10-06,Channel: Brittany Hayles Career Coach (avg_views:1617),"My name is Brittany Hayles, and I’m a career coach and the owner of Hayles Consulting! On this channel I make videos about all things related to your career and life. 

I help people gain confidence & clarity in their career through coaching, resume, interview, and networking strategies.

On this ch",Brittany Hayles Career Coach
