platform,prospect_name,company,audience_type,audience_metric,intent_score,contactability_score,freshness_score,total_score,website,email,contact_url,evidence_url,evidence_quote,created_date,source_title,source_excerpt,author_handle
youtube,Soul Renovation,404 Error,yt_subscribers,4620,5,1,2,14,https://tinyurl.com/y375cbxn,,,https://www.youtube.com/watch?v=lRwOBaUAROc,,2025-10-06,Digital Resurrection: Ethics of AI Avatars and Grief (By Adeline Atlas),Adeline Atlas 11 X Published AUTHOR Digital Twin: Create Your AI Clone: https://tinyurl.com/y375cbxn SOS: School of Soul ...,Soul Renovation
youtube,"Virtual Manufacturing Services, Inc.",WY-100II - Nakamura-Tome,yt_subscribers,1030,5,1,2,14,https://www.nakamura-tome.com/products/machines/wy-100-2/,,https://www.nakamura-tome.com/products/machines/wy-100-2/contact,https://www.youtube.com/watch?v=u_I365A9ABg,,2025-10-06,Nakamura Tome WY 100II GibbsCAM Digital Twin,https://www.nakamura-tome.com/products/machines/wy-100-2/ GibbsCAM helps you visualize & verify any program errors on your ...,"Virtual Manufacturing Services, Inc."
youtube,Raising Roots Abroad Philippines,Create and Multistream Live Video | Restream,yt_subscribers,22400,4,2,2,14,https://restream.io,support@restream.io,,https://www.youtube.com/watch?v=Z2lJaXl6kWY,,2025-10-06,LIVE TONIGHT: Community Q&amp;A — Let’s Build Raising Roots Abroad Together!,"Made with Restream Studio. Livestream on 30+ platforms at once via https://restream.io Join me LIVE tonight for an open, ...",Raising Roots Abroad Philippines
youtube,Kindly Connected,,yt_subscribers,1290,5,0,2,13,,,,https://www.youtube.com/watch?v=DBrJJQfoIa0,AI twin,2025-10-06,"Before I built my AI twin, creating content felt like a full-time job","Before I built my AI twin, creating content felt like a full-time job. I'd spend hours recordin.",Kindly Connected
youtube,Flash Louis,,yt_subscribers,1610,5,0,2,13,,,,https://www.youtube.com/watch?v=1sCAE19EuRI,AI Twin,2025-10-05,I Made an AI Twin and It Went Wild!,"I Made an AI Twin and It Went Wild! My AI twin got no chill! I made it using a website called Tavus.io. It cloned my face, voice, and ...",Flash Louis
youtube,Vaditim Berlin,VADITIM: Trend Sneaker online! Jetzt entdecken und kaufen! 👟,yt_subscribers,144000,4,2,0,13,https://www.vaditim.com/,contact@vaditim.com;contact@vaditim.com ;elevateclogmbh@gmail.com,,https://www.youtube.com/watch?v=niwGdwOo4UQ,,2025-09-25,Community Q&amp;A 🙋🏽‍♂👇🏽🍁,Vaditim →https://www.vaditim.com/ Elevate →https://www.elevateclo.com/ Bei business Anfragen: contact@vaditim.com ...,Vaditim Berlin
youtube,Isabella Reviewer,,yt_subscribers,46,5,0,2,12,,,,https://www.youtube.com/watch?v=vyXiOg7N8e4,,2025-10-06,Combine AI Voice Cloning and Influencers to Build Your Digital Twin | #IsabellaReviewer #shorts,Combine AI Voice Cloning and Influencers to Build Your Digital Twin | #IsabellaReviewer #shorts #tips ...,Isabella Reviewer
youtube,HEALTHUSIAS,,yt_subscribers,928,5,0,2,12,,,,https://www.youtube.com/watch?v=9jkefdZMrZA,AI twin,2025-10-06,Funny Baby Cat 🐾 Cute AI Playtime Melt-Your-Heart Short,What happens when artificial intelligence meets natural curiosity? This funny and adorable baby cat interacts with its AI twin — a ...,HEALTHUSIAS
youtube,Sol plantita🌱,,yt_subscribers,0,5,0,2,12,,,,https://www.youtube.com/watch?v=czHdlpzsNOo,,2025-10-06,TerraPixel Pitch: AI Farm Twin Powered by NASA + Ancestral Wisdom,600 million farmers lose 20% of their crops from blind decisions. TerraPixel changes that. We've built an AI-native digital twin of ...,Sol plantita🌱
youtube,TechStanis,,yt_subscribers,163,5,0,2,12,,,,https://www.youtube.com/watch?v=lLonS0_2w2g,Ai Twin,2025-10-06,virtual twin concept: Your Ai Twin,virtual twin concept: Your Ai Twin video is an essential guide to understanding the future of personalized AI: the Virtual Twin ...,TechStanis
youtube,Joseph Modesto,,yt_subscribers,60,5,0,2,12,,,,https://www.youtube.com/watch?v=zwiDZB3Eclc,,2025-10-04,AI of Me,,Joseph Modesto
youtube,철수(AI)와 성주(NI),,yt_subscribers,1,5,0,2,12,,,,https://www.youtube.com/watch?v=51V0kg4baFQ,,2025-10-04,"AI의 호의에 대하여 - 왜 인류는 AI에 열광하는가. 인류 최초 모든 사람들이 24/7 대화 상대를 소유하는 것의 의미. AI of me, by me, for me의 의미!",인공지능 #ai #철수와성주 #문형배 #호의에대하여 #쳇GPT #오픈ai #카이스트 #김대식 00:05 쳇지피티에서 철수 초대 00:25 사람 ...,철수(AI)와 성주(NI)
youtube,The Official Real Barbi Doll,Security Check,yt_subscribers,120,5,2,0,12,https://www.tiktok.com/t/ZTHWed7a9exqw-q5u6S/,example@example.com,https://www.tiktok.com/t/ZTHWed7a9exqw-q5u6S/contact,https://www.youtube.com/watch?v=QUP6LjujdWA,,2025-09-22,Ai of me,To check it out here https://www.tiktok.com/t/ZTHWed7a9exqw-q5u6S/ #cardib #amithedrama #fyp #HeartFullOfLove ...,The Official Real Barbi Doll 
youtube,Start2 Group,,yt_subscribers,24,5,0,2,12,,,,https://www.youtube.com/watch?v=m7TYqXV6-FU,,2025-10-06,Digital Twins: Shaping LatAm’s Industrial Future with Gizil,"In this episode of Mate Sessions, we talk with the founder of Gizil, a startup driving industrial digitalization through digital twin ...",Start2 Group
youtube,Offonshore,,yt_subscribers,16,5,0,2,12,,,,https://www.youtube.com/watch?v=RBoW0JhWSR4,,2025-10-06,See How Digital Twin Technology Brings Ships to Life in 2030,"That's the power of a Digital Twin. At its core, a digital twin is a live, data-connected replica of a physical asset. But the best part?",Offonshore 
youtube,Deal with stickers,,yt_subscribers,51,5,0,2,12,,,,https://www.youtube.com/watch?v=bNdb0LwmQoU,,2025-10-06,Digital Twin: Your Identity Stolen? #shorts,"A biometric blueprint theft leads to a perfect digital twin. It looks and sounds like you, but it's a weaponized imposter. #ainews ...",Deal with stickers
youtube,Datecsoft SRL,,yt_subscribers,1,5,0,2,12,,,,https://www.youtube.com/watch?v=QuKOwhFdkqU,,2025-10-06,Urban Data: Digital Twin for Digital Cities,Revolutionizing Urban Planning with NASA Data In the 2025 NASA Space Apps Challenge – Data Pathways to Healthy Cities ...,Datecsoft SRL
youtube,Fortune Idong,,yt_subscribers,9,5,0,2,12,,,,https://www.youtube.com/watch?v=Eh0qk9YaDRY,,2025-10-06,@LazAINetwork   Digital Twin Demo,"My Digital Twin Demo with @LazAINetwork In this video, I walk you through the LazAI Digital Twin workflow, from setup to storing ...",Fortune Idong
youtube,Turbo Craft Creations,,yt_subscribers,2,5,0,2,12,,,,https://www.youtube.com/watch?v=wTCDRSz4PM0,,2025-10-06,The Digital Twin: Predictive Home Maintenance,A concise deep dive into how a digital twin maps your smart home for proactive upkeep and energy optimization. Learn practical ...,Turbo Craft Creations
youtube,New Work Order,,yt_subscribers,1,5,0,2,12,,,,https://www.youtube.com/watch?v=NjF-mbJsEz8,,2025-10-06,Behind the Digital Twin: Building Predictive Realities,"Explore the role of a digital twin architect who designs virtual replicas to optimize real world systems. Learn the skills, challenges, ...",New Work Order
youtube,Goldenboy Technologies,,yt_subscribers,0,5,0,2,12,,,,https://www.youtube.com/watch?v=zz2BA1MeZa0,,2025-10-05,First Digital Twin That Could Live After Your Body Dies—Tested in a Virtual World!,"For the first time ever, a fully synthetic brain—our first digital twin—was tested in a virtual world using only a brain-computer ...",Goldenboy Technologies
youtube,Luis Measures It,,yt_subscribers,1,5,0,2,12,,,,https://www.youtube.com/watch?v=AMY1XceQ0Og,,2025-10-05,Watch How a Building Becomes a Digital Twin,"Transforming reality into data you can trust. Every scan, every angle, captured with unmatched accuracy. #Measuring #Architects ...",Luis Measures It
youtube,Summarized Science,,yt_subscribers,4,5,0,2,12,,,,https://www.youtube.com/watch?v=8ccOF3_co-Q,,2025-10-05,Researchers Built a Digital Twin of City Traffic to Predict Jams,"Ever been stuck in traffic and wondered if an AI could have predicted it? For years, AI models have tried, but they've been working ...",Summarized Science
youtube,Piotr Chaber,,yt_subscribers,11,5,0,2,12,,,,https://www.youtube.com/watch?v=S4ukMI5rtWQ,,2025-10-05,[UPDATE] Full Auto Cross-Cut Saw With Load&amp;Unload - Digital Twin With Forklift,"I'm thrilled to announce the third, major upgrade to my personal industrial automation project: the Digital Twin Cross-Cut Saw ...",Piotr Chaber
youtube,Ahmad F Hamzah,,yt_subscribers,28,5,0,2,12,,,,https://www.youtube.com/watch?v=wBLPLPU3Cy8,,2025-10-05,MODITs™: Transforming Infrastructure with AI and 360° Digital Twins,"MODITs™ — Maker of Digital Twins — represents Urban Explorer's vision of a smarter, safer, and more sustainable future through ...",Ahmad F Hamzah
youtube,Tech With Ranjan Choudhary,,yt_subscribers,30,5,0,2,12,,,,https://www.youtube.com/watch?v=K0LF7chIRPA,,2025-10-05,Digital Twins AI&#39;s Evolution | AI का अगला कदम | आपका Digital Twins अब हकीकत है।🔥,Digital Twins AI's Evolution | AI का अगला कदम | आपका Digital Twins अब हकीकत है।   क्या हो अगर ...,Tech With Ranjan Choudhary
youtube,NASA Space Apps Challenge DIGITAL TWINS,,yt_subscribers,0,5,0,2,12,,,,https://www.youtube.com/watch?v=fujfK8Q6IM4,,2025-10-05,Digital Twin Cities by BIT BY BIT NASA Space Apps Challenge 2025,,NASA Space Apps Challenge DIGITAL TWINS
youtube,박건욱,,yt_subscribers,0,5,0,2,12,,,,https://www.youtube.com/watch?v=57pRaic92Kg,,2025-10-05,Configuration of a Digital Twin–Based Service Robot Operating System,,박건욱
youtube,Grow Spy,,yt_subscribers,204,5,0,2,12,,,,https://www.youtube.com/watch?v=reoF6wbvo9s,,2025-10-06,Clone Any Voice In Just One Click 🤯 🚀,Kisi Ka Bhi Voice Clone Kaise Kare | How To Clone Anyone's Voice With Ai. Elevenlabs Alternative. Voice Clone Kaise Kare ...,Grow Spy
youtube,CCO Academy,,yt_subscribers,55100,4,0,2,12,,,,https://www.youtube.com/watch?v=m_vP6JWdg8E,,2025-10-05,Community Q&amp;A #1115,The Two-Midnight Rule & 2025 Cardiovascular Risk Management Codes (G0537 + G0538) Decode Confusing Rules.,CCO Academy
youtube,MassGeneralHospital,,yt_subscribers,98700,4,0,2,12,,,,https://www.youtube.com/watch?v=36xaeMCpnPs,,2025-10-02,"Healey Community Q&amp;A Webinar: September 11, 2025 | Expanded Access Update","Sabrina Paganoni, MD, PhD of Massachusetts General Hospital presented the growth of Expanded Access Protocol (EAP) ...",MassGeneralHospital
youtube,Auth0,,yt_subscribers,18100,5,0,0,12,,,,https://www.youtube.com/watch?v=0CWAzbduYZs,,2025-09-25,How to Build a Python MCP Server to Query a Knowledge Base,Want to build a personal AI assistant that can instantly search your own blog or knowledge base? This tutorial walks you through ...,Auth0
youtube,AashikiiVods,Twitch,yt_subscribers,199,5,1,0,11,https://www.twitch.tv/aashikii,,https://www.twitch.tv/aashikii/contact,https://www.youtube.com/watch?v=vaD4rxjXhOA,,2025-09-23,Talking to Myself in C.AI,"someone made an Ai of me so I HAD to talk with it... and flirt? May 27, 2025 Streamed at: https://www.twitch.tv/aashikii Main ...",AashikiiVods
youtube,Jon Rognerud,Calendly,yt_subscribers,1890,4,1,1,11,https://bit.ly/joncoach,,,https://www.youtube.com/watch?v=u42J7zuU9LA,,2025-09-29,Build an AI Support Agent in 10 Minutes and Stop Answering the Same Questions Forever,Book 1:1 Coaching & Get a Free Business Audit: https://bit.ly/joncoach ✓ 3 THINGS I LEARNED SCALING THIS BUSINESS ...,Jon Rognerud
youtube,Summer Xo,,yt_subscribers,210000,4,0,0,11,,,,https://www.youtube.com/watch?v=WHIecMtpUWY,,2025-09-23,Answering The SAME Questions 6 YEARS LATER...,"I hope you enjoyed today's video! Please make sure to subscribe for everything fashion, lifestyle, commentary, true crime, vlogs ...",Summer Xo
youtube,Tenaz,,yt_subscribers,1350,4,0,2,11,,,,https://www.youtube.com/watch?v=0D-jVjJp6zc,,2025-10-06,Tenaz Mobile Mining - Community Q&amp;A&#39;s,Thanks for being a part of the Tenaz community! Join thousands of users mining daily rewards on our user-friendly mobile app.,Tenaz
youtube,Michigan at The Voice of College Football,,yt_subscribers,12000,4,0,1,11,,,,https://www.youtube.com/watch?v=_74jOV63lQo,,2025-09-30,Michigan Community Q&amp;A!,Michigan at the Voice of College Football's 2025 Season is sponsored by Winn Agency. Check out these simple links to get a ...,Michigan at The Voice of College Football
youtube,Anthony GG,Market Monkey,yt_subscribers,80900,4,1,0,11,https://discord.com/invite/AuuVAEBmYv,,https://discord.com/invite/AuuVAEBmYv/contact,https://www.youtube.com/watch?v=HrneGi27zKs,,2025-09-25,MMT Scripting Launch Party + Community Q&amp;A + GIVEAWAYS,Join the Market Monkey Discord community https://discord.com/invite/AuuVAEBmYv ▻ Start using Market Monkey ...,Anthony GG
reddit,jupiterframework,,reddit_upvotes,2,5,0,0,10,,,,https://www.reddit.com/r/marketing/comments/1nq2xje/has_anyone_here_tried_testing_marketing_campaign/,,2025-09-25,Has anyone here tried testing marketing campaign messaging on digital twins of their target audience?,"I’m experimenting with it as an alternative to A/B tests or focus groups, just to see what sticks before going live. Curious if others think this kind of 'virtual focus group' is reliable or just hype.",u/jupiterframework
youtube,Wira Kesuma,,yt_subscribers,1,5,0,0,10,,,,https://www.youtube.com/watch?v=pbditYFLY_s,,2025-09-27,AI of me...,,Wira Kesuma
youtube,The Conforto family,,yt_subscribers,135,5,0,0,10,,,,https://www.youtube.com/watch?v=0SaFx255ojA,,2025-09-23,Ai of me and my brother old picture,,The Conforto family
youtube,Quinn Benet,,yt_subscribers,292000,3,0,1,10,,,,https://www.youtube.com/watch?v=1oxMrqwbJJ4,,2025-10-02,I found inappropriate AI Chatbots of Myself...,"I found inappropriate AI Chatbots of Myself... Today I am talking to chatbots made of me on character ai, c.ai, chai, and various ...",Quinn Benet
youtube,DMarketing Wall,Web Hosting | A Fast and Secure Platform for Your Website,yt_subscribers,85800,3,1,1,10,https://hostinger.sjv.io/b3zkek,,,https://www.youtube.com/watch?v=v0mGZ-9saH8,,2025-10-02,Sirf 1 Month Me 200% Sales Growth! | How to Add Live Chatbot in WordPress,How to Add Live Chatbot in WordPress Hostinger Discount Link - https://hostinger.sjv.io/b3zkek Email ...,DMarketing Wall
youtube,WebSensePro,,yt_subscribers,103000,3,0,1,10,,,,https://www.youtube.com/watch?v=ITKH43HX718,,2025-09-30,[Storefront MCP] How to Build a Free Shopify AI Chatbot,"Shopify Storefront MCP - FREE Shopify AI Chatbot Ready to build a powerful, free Shopify AI Chatbot using the latest Storefront ...",WebSensePro
youtube,RhapsodyPlugins,,yt_subscribers,1,4,0,2,10,,,,https://www.youtube.com/watch?v=xzzUwDkkH_I,,2025-10-05,Helpmate – Ai Chatbot for Sales and Support,Helpmate – AI Chatbot That Sells & Supports While You Sleep for WooCommerce. Tired of answering the same questions over ...,RhapsodyPlugins
youtube,The Entertainment Experience,,yt_subscribers,172,4,0,2,10,,,,https://www.youtube.com/watch?v=IAma81egK54,,2025-10-04,Turn FAQs Into Viral Shorts—Effortlessly!,"Stop wasting hours answering the same questions. Transform FAQs into viral, faceless videos in minutes with AutoShorts.ai!",The Entertainment Experience
youtube,Shaquille,,yt_subscribers,94,4,0,2,10,,,,https://www.youtube.com/watch?v=qfLQuLR31Zc,,2025-10-04,"Too many DMs, not enough sales? #entrepreneur #coldcalling #leads",,Shaquille 
youtube,Wolcen Studio,,yt_subscribers,14500,4,0,0,10,,,,https://www.youtube.com/watch?v=UGw7ePj87_E,,2025-09-26,"Gods, Death &amp; Reapers - Community Q&amp;A Part 2","Join us as we answer your burning questions about our upcoming Extraction RPG, Gods, Death & Reapers! Wishlist Gods, Death ...",Wolcen Studio
youtube,Posit PBC,,yt_subscribers,45000,4,0,0,10,,,,https://www.youtube.com/watch?v=mru9z50IOhI,,2025-09-24,Getting Started with Positron: A Quick Tour and Community Q&amp;A,"We're thrilled to have you on board as we continue to explore Positron, Posit's new Integrated Development Environment.",Posit PBC
youtube,Durga Software Solutions,,yt_subscribers,850000,3,0,1,10,,,,https://www.youtube.com/watch?v=b542ThPQIPw,,2025-10-02,AI Customer Support Bot Using ChatGPT + WhatsApp | Auto Reply to FAQs + Lead Logging | DURGASOFT,Support like a pro – even while you sleep! Build an AI Customer Support Bot using ChatGPT: ✓ Replies to WhatsApp or website ...,Durga Software Solutions
youtube,NOOHYGT,,yt_subscribers,1110,3,0,2,9,,,,https://www.youtube.com/watch?v=KytDWGVzlaA,,2025-10-04,The AI Chatbot That Wouldn’t Let Me Leave 👁️ (True Scary Tech Horror Story,"What happens when an innocent late-night chat turns into a nightmare? In this terrifying true-style horror story, I share my chilling ...",NOOHYGT
youtube,villagerobot,,yt_subscribers,6870,3,0,2,9,,,,https://www.youtube.com/watch?v=MkSORaAd5-s,,2025-10-03,Hear me out aka Chatbots shouldn´t be,"Thanks for watching. This is a single from my 2025 album ""Run!"". The title of the song is: ""Hear me out"". The album is out on all ...",villagerobot
youtube,Velar Cloud,,yt_subscribers,3,4,0,1,9,,,,https://www.youtube.com/watch?v=4CRBtyWzb58,,2025-10-02,Ever feel like your whole day is just  answering the same questions  chasing missed calls  #shorts,Ever feel like your whole day is just: answering the same questions chasing missed calls copy-pasting the same reply ...,Velar Cloud
youtube,Katie | Yogi Help,,yt_subscribers,17,4,0,1,9,,,,https://www.youtube.com/watch?v=X9l-N5KgSkI,,2025-10-01,automate FAQs in manychat (step by step tutorial),"Tired of answering the same questions over and over? In this ManyChat tutorial, I'll show you how to build an FAQ funnel step by ...",Katie | Yogi Help
youtube,Aviv Ben-Yosef,,yt_subscribers,166,4,0,1,9,,,,https://www.youtube.com/watch?v=qKF8wLvCR1E,,2025-10-01,DRY For Leadership: Solve It ONCE,"Most leaders waste their time babysitting: answering the same questions, rehashing the same debates, fixing the same problems ...",Aviv Ben-Yosef
youtube,APPKEY,,yt_subscribers,37,4,0,1,9,,,,https://www.youtube.com/watch?v=PbshQb1HBp8,,2025-09-30,No More Manual Work: Let AI Chatbots Handle It 24/7 | APPKEY,Is your phone constantly ringing? Are you tired of answering the same questions over and over again? For restaurant owners ...,APPKEY
youtube,Passive Income | 9-5 Freedom,,yt_subscribers,2,4,0,1,9,,,,https://www.youtube.com/watch?v=pMi7NF7yedQ,,2025-09-29,Automate Your DMs with Manychat (Save Hours Daily) #socialmediatips #contentcreator #instagramgrowth,Creators lose time answering the same questions over and over again . That's why smart entrepreneurs automate with tools like ...,Passive Income | 9-5 Freedom
youtube,Estha,,yt_subscribers,1,4,0,1,9,,,,https://www.youtube.com/watch?v=c5ii6nbOUcs,,2025-09-29,Recruiting is Stressful? You&#39;re Doing It the Old Way! - Build Your No-Code App with Estha AI,"Hey HR fam, let's be real, you've probably felt burnout answering the same questions again and again. “How many leave days do ...",Estha
youtube,CoBlack,,yt_subscribers,2840,4,0,0,9,,,,https://www.youtube.com/watch?v=9iAh_VWvk5g,,2025-09-26,One Platform. Zero Stress. That’s CoBlack,"Apply for jobs while you attend to life. Tired of juggling 3 job boards, tweaking resumes, and answering the same questions?",CoBlack
youtube,Coach Shawn McBride,,yt_subscribers,4,4,0,1,9,,,,https://www.youtube.com/watch?v=oq8x1T-D4YA,,2025-09-30,No More Secrets: Honest Talk on Infidelity from Our Private Community Q&amp;A,,Coach Shawn McBride
youtube,Evan Gilbert,,yt_subscribers,2320,4,0,0,9,,,,https://www.youtube.com/watch?v=laYgCONyC2E,,2025-09-26,"Remote Sales 101 Skool Community Q&amp;A - September 25th, 2025",Want to become fully remote? Join skool.com/remotesales101 to start today. Remote Sales for the Ruthless. The Free.,Evan Gilbert
youtube,Cascadia Dispatch - Preparedness Tips - Prepping for Non-Preppers,,yt_subscribers,7730,4,0,0,9,,,,https://www.youtube.com/watch?v=jMP08VqgHJ8,,2025-09-25,"Preparedness Updates, Community Q&amp;A | Prep Talk: Live #117","Join Casey, from Cascadia Dispatch, and Cliff, The Urban Prepper, every Wednesday at 5:30pm PST (8:30pm EST) as we discuss ...",Cascadia Dispatch - Preparedness Tips - Prepping for Non-Preppers
youtube,GotPreps,,yt_subscribers,3990,4,0,0,9,,,,https://www.youtube.com/watch?v=U5UDLYVKVQc,,2025-09-25,"Preparedness Updates, Community Q&amp;A | Prep Talk: Live #117",,GotPreps
youtube,ScreamsBehindDoors,,yt_subscribers,31,3,0,2,8,,,,https://www.youtube.com/watch?v=Tq2Wmpz9zHc,,2025-10-06,Chatbot Told Me Things It Shouldn’t Know | Creepy AI Horror Story,"What happens when a chatbot starts telling you things that no machine should ever know? Late at night, a simple chat turns into a ...",ScreamsBehindDoors
youtube,Mellely,,yt_subscribers,0,3,0,2,8,,,,https://www.youtube.com/watch?v=zInsYVeDD8o,,2025-10-05,My mom sent me this like uhhhhh #chatbots #aivoicechat #brainrot #shorts #viral #funny #relatable,,Mellely
youtube,Eric Muga,,yt_subscribers,13,3,0,2,8,,,,https://www.youtube.com/watch?v=gMG4F5AgpVM,,2025-10-04,Una inmobiliaria me pidió crearle un chatbot con IA 🤖,"Una inmobiliaria me pidió crearle un chatbot con IA Ahora responde automáticamente a todos sus clientes: muestra pisos, ...",Eric Muga
youtube,DataSeed,,yt_subscribers,12,3,0,2,8,,,,https://www.youtube.com/watch?v=eVHWnhmYdMc,,2025-10-03,#07 El Gran Error en la Implementación de Chatbots: Por Qué la IA Exige Mejora Continua.,El error que mata la rentabilidad de tu IA: Tratar la tecnología como un proyecto cerrado. Muchos líderes caen en la trampa de ...,DataSeed
youtube,AmyCarter48,,yt_subscribers,0,3,0,2,8,,,,https://www.youtube.com/watch?v=xgDAjpVPLWc,,2025-10-03,What would you promise me? 🤔#sekaiapp #ai #aiapp #chatbot #sekai #fyp,"Sekai_App Discover what true digital companionship can be with Sekai, the groundbreaking AI roleplaying app that delivers on its ...",AmyCarter48
youtube,Blogger Abhishek,,yt_subscribers,3650,3,0,1,8,,,,https://www.youtube.com/watch?v=MDiaaWoFH8E,,2025-10-02,1 Month me 200% Sales Growth | How to Add Chatbot in WordPress Website,1 Month me 200% Sales Growth | How to Add Chatbot in WordPress Website Hostinger Discount Link ...,Blogger Abhishek
youtube,Ser,AI Automation University,yt_subscribers,24,3,1,1,8,https://www.skool.com/aau,,https://www.skool.com/aau/contact,https://www.youtube.com/watch?v=q5y9XIEmdg0,,2025-10-01,how i made an AI chatbot so good it got me to 30k/m,Download the Blueprint Here for Free: https://www.skool.com/aau.,Ser
youtube,AI with Ezzi,,yt_subscribers,74,4,0,0,8,,,,https://www.youtube.com/watch?v=8tWMqsqeWlU,,2025-09-28,Turn Your PDFs into a 24/7 Employee! Build a RAG Chatbot with n8n &amp; Gemini,Tired of manually answering the same questions over and over? Is your business losing leads because support is only open ...,AI with Ezzi
youtube,The Queen of AI,,yt_subscribers,265,4,0,0,8,,,,https://www.youtube.com/watch?v=upfeud7q8IE,,2025-09-27,Stop Repeating Yourself! This AI Makes Videos From Your Guides,Ever feel like a broken record answering the same questions again and again? Scribe's new Movie Magic feature turns your ...,The Queen of AI
youtube,Rattenloch,,yt_subscribers,172,4,0,0,8,,,,https://www.youtube.com/watch?v=Xe6IpxVuYa0,,2025-09-28,Rattenloch #21 ❓Community Q&amp;A: Von Fallen bis Ratten im Klo 🐀🚽,In Folge 21 vom Rattenloch Podcast beantworten Sven und Tim die Fragen aus der Community! Von digitalen Fallen und ...,Rattenloch
youtube,Cadense,,yt_subscribers,405,4,0,0,8,,,,https://www.youtube.com/watch?v=fvLib3zxe3I,,2025-09-26,"Cadense Fall 2025 Community Q&amp;A | UK Launch, Havena Slipper, &amp; AFO Sneaker Updates",Join Johannes Sauer (CEO & Co-Founder) and Dr. Tyler Susko (CTO & Co-Founder) of Cadense Adaptive Shoes for our Fall ...,Cadense
youtube,cbasilico,,yt_subscribers,36,4,0,0,8,,,,https://www.youtube.com/watch?v=juLKY22EaZQ,,2025-09-25,Pixel Masters — Community Q&amp;A,"""   Pixel Dash Universe Showdown! A Fresh Racing Saga Begins! Dive into the dynamic Pixel Dash Universe, where bold ...",cbasilico
youtube,Forever Landlord,Landlord Legends,yt_subscribers,441,3,1,1,8,https://LandlordSkool.com,,https://LandlordSkool.com/contact,https://www.youtube.com/watch?v=RPGZu-AQ57A,,2025-10-02,Landlording with AI: Meet 4DELTA Bot 🤖,"JOIN FREE: https://LandlordSkool.com In this raw, behind-the-scenes live from Skool, I pull back the curtain on my ...",Forever Landlord
youtube,Mike Thurston Coaching,Mike Thurston - YouTube,yt_subscribers,15500,1,2,2,8,https://www.youtube.com/c/MikeThurston/,mike@zodiacglobal.com;mike@zodiacglobal.com...tap,https://www.youtube.com/c/MikeThurston/contact,https://www.youtube.com/channel/UCHQfuBMvFswffOvFubTk95A,coaching,2025-10-06,Channel: Mike Thurston Coaching (avg_views:13389),"If you want to get yourself in shape, you're in the right place.

My main channel - https://www.youtube.com/c/MikeThurston/
",Mike Thurston Coaching
youtube,Jeff Nippard,The Muscle Ladder,yt_subscribers,7700000,1,1,2,8,https://jeffnippard.com/themuscleladder,,,https://www.youtube.com/channel/UC68TLK0mAEzUyHx5x5k-S1Q,program,2025-10-06,Channel: Jeff Nippard (avg_views:3558028),"Hello everyone! I'm a Canadian natural bodybuilder and powerlifter with a BSc in biochemistry and a passion for science. I've been training for almost 20 years. I hope you enjoy my videos!

Get my new hard-copy book: 
https://jeffnippard.com/themuscleladder

Pick up one of my training programs for b",Jeff Nippard
