platform,prospect_name,company,audience_type,audience_metric,intent_score,contactability_score,freshness_score,total_score,website,email,contact_url,evidence_url,evidence_quote,created_date,source_title,source_excerpt,author_handle
reddit,Candid_Positive8832,,reddit_upvotes,1,1,0,2,4,,,,https://www.reddit.com/r/Entrepreneur/comments/1nyv8qw/i_want_to_expand_my_business_but_whitelabel_it/,,2025-10-05,"I want to expand my business, but ""white-label"" it",Hi im a consultant freelancer working from a controversial country and i miss many business opportunities with countries that dont have bilateral connections with mine even though i could provide services there im thinking about creating an ai agent trained on my own knowledge kind of like a digital,u/Candid_Positive8832
reddit,GmailsAreCute,,reddit_upvotes,3,1,0,2,4,,,,https://www.reddit.com/r/Entrepreneur/comments/1nxf5fa/what_happens_when_every_channel_is_flooded_with/,,2025-10-03,What happens when every channel is flooded with AI outreach?,"With AI making it cheap and easy to send massive amounts of cold emails and LinkedIn messages, it feels like those channels are going to be completely saturated in the next few years. At some point inboxes will be AI-filtered, LinkedIn will be full of bots, and “better copy” won’t be enough to stand",u/GmailsAreCute
reddit,croos-sime,,reddit_upvotes,1,1,0,2,4,,,,https://www.reddit.com/r/Entrepreneur/comments/1nwo2mx/any_tips_for_healthcare_software/,,2025-10-03,Any tips for healthcare software?,"I have to say most of the healthcare software in South America countries, such as Colombia Republica Venezuela, half a really poor quality and everything is even worse outside of the capital cities. For example, maybe some doctors in Caracas have good software to manage their appointments, but outsi",u/croos-sime
reddit,ksaize,,reddit_upvotes,1,1,0,2,4,,,,https://www.reddit.com/r/marketing/comments/1nzjxa6/parallels_with_seo_15_years_ago_and_reddit_link/,,2025-10-06,Parallels with SEO 15 years ago and Reddit link building in 2025,"**TL;DR: My prediction about agencies doing Reddit link building for LLM are going to be out of business in 12 months. It is built on hype and not knowledge about LLM or Reddit.**   **Clarification: I do not offer reddit organic marketing services.**  For those unaware, Reddit had deal with Google t",u/ksaize
reddit,Youssef822,,reddit_upvotes,5,1,0,2,4,,,,https://www.reddit.com/r/DigitalMarketing/comments/1ny6q1g/bots_clicks_problem_in_meta/,,2025-10-04,Bots clicks problem in meta,i've made an ad as conversion for my landing website page to get sales but it ended up with a lot of clicks (1377 click cost per click very low 0.19EGP)    without any purchases or even scroll in website very short sessions or very long sessions    in Microsoft clarity it doesn't show up that number,u/Youssef822
reddit,TechnicianVirtual237,,reddit_upvotes,1137,1,0,0,4,,,,https://www.reddit.com/r/DigitalMarketing/comments/1npihxu/throwaway_instagrams_entire_future_depends_on/,,2025-09-24,Throwaway: Instagrams entire future depends on automation (I saw it firsthand),"Throwaway for obvious reasons. Up until 2 months ago I was on the M&A (mergers & acquisitions) team at Meta. I left to work for another company in the social media space, but while I was there I saw enough on the inside to understand how Instagram really thinks about growth and where they’re steerin",u/TechnicianVirtual237
reddit,Expert-Recipe1713,,reddit_upvotes,11,1,0,1,4,,,,https://www.reddit.com/r/selfimprovement/comments/1nvza6k/23_and_dont_know_what_to_do_with_my_life/,,2025-10-02,"23, and don’t know what to do with my life","Hey guys, I’m a male and live in Miami, fl. I went to school for IT and got an associates hoping for a remote job and it never happened. I took google’s UX design course and built a portfolio of projects, yet never landed a remote UX design job. I really don’t want to work in help desk on site for 2",u/Expert-Recipe1713
reddit,covert777,,reddit_upvotes,2,1,0,2,4,,,,https://www.reddit.com/r/productivity/comments/1nz5nde/productivity_help_for_an_overwhelmed_manager_in_a/,,2025-10-06,Productivity help for an overwhelmed manager in a reactionary/incident driven role,"I'm a manager in an IT department where I oversee multiple teams of support techs who work onsite at various company locations. I'd say that about 2/3 of my job is reacting to support situations and the remaining 3rd is working on ""planned"" tasks/projects. It's just the nature of the gig where my te",u/covert777
reddit,SusEmbra,,reddit_upvotes,5,2,0,0,4,,,,https://www.reddit.com/r/webflow/comments/1nomajb/should_i_use_webflow_ecommerce_to_collect/,,2025-09-23,Should I use Webflow Ecommerce to collect payments for in-person courses?,"I’m setting up in-person courses for a client and want a simple way to let people pay online. I already use Webflow as my preferred platform builder so I was thinking of Webflow Ecommerce to list the courses like products and take one-time payments.  There will be no shipping or downloads required, ",u/SusEmbra
youtube,Mitthu's Fantasy World,,yt_subscribers,750,1,0,2,4,,,,https://www.youtube.com/watch?v=6oKE2ViNIxk,,2025-10-06,Twin ...  #shorts #shortsfeed #viral #subscribe #instagram #youtubeshorts #ai #aivideo,,Mitthu's Fantasy World
youtube,Vkuoo Meng,,yt_subscribers,780,1,0,2,4,,,,https://www.youtube.com/watch?v=pWB9RskYbmA,,2025-10-06,🍔🏙️ MCDONALD’S TWIN TOWERS: The AI-Generated Marvel You NEED to See!,[0:07] Wait till you see how Nanobanana and Midjourney bring this iconic fast-food fantasy to life... #AIDesign / #nanobanana ...,Vkuoo Meng
youtube,Meow Cat. AI,,yt_subscribers,273,1,0,2,4,,,,https://www.youtube.com/watch?v=vMupuS0JAIo,,2025-10-06,Twin Cats Shuffle Dance Like TikTok Stars 😻🔥 #dancevideo #shuffledance #shortscat,Get ready to dance with these 3 twin cats as they perform the viral TikTok Shuffle Dance with perfect moves and endless energy!,Meow Cat. AI
youtube,KiddyToons,,yt_subscribers,16,1,0,2,4,,,,https://www.youtube.com/watch?v=m-i5zahjjas,,2025-10-06,😍Bhangra by twin babies 🥰🧓👯 #shorts #trending #ai #cute,"Don't forget to LIKE , COMMENT & SUBSCRIBE for more cute baby dance videos every day! #twins #babydance #foryou ...",KiddyToons
youtube,YTSADDU1,,yt_subscribers,1,1,0,2,4,,,,https://www.youtube.com/watch?v=xkS3ZqyKauI,,2025-10-06,BABY DANCE USA AI BABA CUTEBABY FYP TWIN#aibaby #aitrading #twins #twinsblog #twinlife #funny VIDEO,,YTSADDU1
youtube,AI ENTERTAINMENT,,yt_subscribers,922,1,0,2,4,,,,https://www.youtube.com/watch?v=E-ccqFIPho0,,2025-10-06,Magical mom transformation to twin babies unbelievable transformation #agt #shorts #shortsviral,"Welcome to the ultimate AI Magical Universe ✨ — where dreams, transformations, family love, fantasy, and technology collide in ...",AI ENTERTAINMENT
youtube,Im not no lie,,yt_subscribers,98,1,0,2,4,,,,https://www.youtube.com/watch?v=cIJ90t8C2jE,,2025-10-06,Ai gives me a twin,,Im not no lie
youtube,Jay Marie,,yt_subscribers,3,1,0,2,4,,,,https://www.youtube.com/watch?v=9Ccr9piOP5g,,2025-10-05,How I Make Money Online Without Showing My Face (Faceless AI Instagram Strategy 2025),Peace + profit can exist together. If you're tired of… ⚡ Feeling like you have to be “on” all the time to grow. ⚡ Overthinking your ...,Jay Marie
youtube,Eagle Studios,,yt_subscribers,43,1,0,2,4,,,,https://www.youtube.com/watch?v=FgQR4gh2CTk,,2025-10-05,The Twin Caveman Animated by AI #shorts #ai #viral #viralvideo #aivideo #subscribers #subscribe,Caveman The Rock Bottom Animated by AI #shorts #ai #viral #viralvideo #aivideo #subscribers #subscribe.,Eagle Studios 
youtube,Nilesh Sahoo,,yt_subscribers,0,1,0,2,4,,,,https://www.youtube.com/watch?v=kVJZzqrDJyw,,2025-10-05,Al neural wellness,"Introducing AI Neural Wellness Twin, a next-generation AI-powered companion designed to monitor, predict, and enhance your ...",Nilesh Sahoo
youtube,Bloom with grace 👑,,yt_subscribers,16,1,0,2,4,,,,https://www.youtube.com/watch?v=YnOiJEhzHFA,,2025-10-05,#Judith twin sister#ai #funny 🤣,,Bloom with grace 👑 
youtube,Rafael Fuentes AI,,yt_subscribers,2,1,0,2,4,,,,https://www.youtube.com/watch?v=NqnumVtZ95w,,2025-10-06,Advanced Phishing Scams and AI-Driven Cybersecurity Threats in 2025,Cybersecurity 2025: AI and Zero Trust Strategies Against Modern Threats Welcome to the Rafael Fuentes AI channel (digital ...,Rafael Fuentes AI
youtube,Digital Construction Champions,,yt_subscribers,20,1,0,2,4,,,,https://www.youtube.com/watch?v=fHOFegLEMGk,,2025-10-06,"Vladimir Gutesa from Company TeamCAD on PavleS project, predictive and prescriptive AI maintenance.","In today's #DigitalConstruction environment, project success is no longer defined only by precise design and coordination — but ...",Digital Construction Champions
youtube,Evan Fremin,,yt_subscribers,3370,1,0,1,4,,,,https://www.youtube.com/watch?v=nXglqYBJNmQ,,2025-09-29,L&#39;IA me donne une recette de gateau ? 🎂,Clique sur le lien en bio si tu veux un agent vocal IA dans ton business ! #ia #aivoices #aivoiceagent #intelligenceartificielle ...,Evan Fremin
youtube,Dedi Styawan,,yt_subscribers,206,1,0,2,4,,,,https://www.youtube.com/watch?v=1AQXLycnmCY,,2025-10-03,CloneVoiceAI Demo CloneVoice AI Demo Clone Voice AI Demo CloneVoice AI Discount Code + Promo Code,CloneVoiceAI Demo CloneVoice AI Demo Clone Voice AI Demo CloneVoice AI Discount Code + Promo Code In the ...,Dedi Styawan
youtube,iMitra,,yt_subscribers,148,1,0,2,4,,,,https://www.youtube.com/watch?v=Sd_Zrw3bkA4,,2025-10-03,CloneVoice AI Demo CloneVoiceAI Demo CloneVoice AI Discount Code + Clone Voice AI Promo Code + Bonus,CloneVoice AI Demo CloneVoiceAI Demo CloneVoice AI Discount Code + Clone Voice AI Promo Code + Bonus In today's ...,iMitra
youtube,Adam Loves Guitar,,yt_subscribers,5670,1,0,1,4,,,,https://www.youtube.com/watch?v=KwLcAhANI-g,,2025-10-01,Breakthrough guitar method for serious guitarists - Best guitar learning roadmap 2025,"As a professional guitarist, producer, and teacher, I'm thrilled to share my breakthrough guitar method for serious guitarists.",Adam Loves Guitar
youtube,RAVAN IS LIVE,,yt_subscribers,1480,1,0,1,4,,,,https://www.youtube.com/watch?v=oXDhu2otED0,,2025-09-28,Ravan Is Live Now — Epic Q&amp;A and Myth Discussion,"Title suggestions: - ""Ravan Is Live Now — Epic Q&A & Myth Discussion"" - ""Ravan Live: Secrets, Myths & Q&A from the Ramayana"" ...",RAVAN IS LIVE 
youtube,DXB Crypto,,yt_subscribers,34500,1,0,0,4,,,,https://www.youtube.com/watch?v=Lhh5o_VNfQo,,2025-09-26,🚨 EXCLUSIVE AMA – Mystery Project Revealed! 🚨 Community Focus | LIVE Tonight 11PM Dubai 🕚,DXB Crypto Exclusive AMA Join us tonight at 11PM Dubai time for a community-focused AMA with a Mystery Project that ...,DXB Crypto   
youtube,Business With AI Strategist,,yt_subscribers,17,1,0,2,4,,,,https://www.youtube.com/watch?v=29gwX7TjTmI,,2025-10-06,2 AI Tools That End Content Overwhelm FAST,"Feeling buried in content? Here are 2 AI tools that will change how you learn, capture, and create. Tool 1 – Snip-ai.com Trims ...",Business With AI Strategist
reddit,MrMusicAndFilm,,reddit_upvotes,9,1,0,1,3,,,,https://www.reddit.com/r/Entrepreneur/comments/1nueuij/burnout_exhaustion_and_lack_of_inspiration/,,2025-09-30,"Burnout, exhaustion, and lack of inspiration","As you can probably guess, I'm dealing with all of those things in the title. For better context of how I got here, I'll share some info.  First, I'll be 50 next year, I have a wife, twins that are soon to be 5 (yes, we started late), no real savings outside of Social Security benefits (available in",u/MrMusicAndFilm
reddit,CaptianGooseFlaps,,reddit_upvotes,6,1,0,1,3,,,,https://www.reddit.com/r/Entrepreneur/comments/1nuh6or/helping_5_creators_build_offers_optimize_content/,,2025-09-30,"Helping 5 Creators Build Offers, Optimize Content & Land Clients","I'm looking to help creators package their skills into a clear offer, optimize content for growth, and build a simple sales system that attracts clients consistently. I'll help you make a compelling offer and make content to support that.  I have been an entrepreneur the last 5 years or so . Doing T",u/CaptianGooseFlaps
reddit,technicallyNotAI,,reddit_upvotes,1,1,0,1,3,,,,https://www.reddit.com/r/Entrepreneur/comments/1ntruoo/laidoff_at_a_loss_not_even_sure_what_to_ask_or/,,2025-09-29,"Laid-off - At a loss, not even sure what to ask or where to start","Firstly, I always thought I'd branch out on my own eventually, but my lack of funds at the moment is limiting me. I think the stress also hurts my ability to think straight right now. I have many product ideas but no money to fund it. A few service ideas, but they're half-baked and idk where to star",u/technicallyNotAI
reddit,davidmorelo,,reddit_upvotes,7,1,0,1,3,,,,https://www.reddit.com/r/Entrepreneur/comments/1ntdo6r/33m_entrepreneur_making_good_money_but_worried/,,2025-09-29,33M entrepreneur making good money but worried about future,"I'm 33, living in a small Czech city with my wife and two young kids (6 and 3). I currently make about $5k USD/month from two sources: content writing ($2.5k - but this industry is clearly dying) and a video game I've been developing ($2.5k on Patreon and growing). I have a decent emergency fund and",u/davidmorelo
reddit,Tharnwell,,reddit_upvotes,25,1,0,0,3,,,,https://www.reddit.com/r/Entrepreneur/comments/1nskfhf/looking_back_on_15_years_of_online_business/,,2025-09-28,Looking back on 15 years of online business models and what still works today,"I’ve been online for about 15 years now.   I’ve witnessed several online business model trends over the years. The timeframes mentioned below represent what I consider the golden eras of each business model. This doesn’t mean these strategies won’t work today, but they are far more challenging to su",u/Tharnwell
reddit,belloaisha,,reddit_upvotes,0,1,0,1,3,,,,https://www.reddit.com/r/smallbusiness/comments/1ntf3y6/i_dont_know_where_im_headed_or_what_am_i_doing/,,2025-09-29,I don't know where I'm headed or what am I doing with my life,"I am 21M  My dream is to become rich and escape the rat race so that I can buy whatever I want without even thinking about my bank balance. Every time I saw a new car, bike, phone the first thing that came into my mind is how do I get it and what should I do so that I could afford those things, and ",u/belloaisha
reddit,polygraph-net,,reddit_upvotes,37,1,0,0,3,,,,https://www.reddit.com/r/marketing/comments/1nqt1v9/retrain_the_ad_networks_to_stop_sending_you_bot/,,2025-09-26,Re-train the ad networks to stop sending you bot traffic (image and explanation inside),,u/polygraph-net
youtube,Ryan's Tech Lab,,yt_subscribers,36,1,0,1,3,,,,https://www.youtube.com/watch?v=KHHILtswxH4,,2025-10-02,I Made 4 AIs Solve a Riddle. The Winner Surprised Me.,"The AI Showdown is back! This time, the challenge is different... We gave a classic brain-teaser to ChatGPT, Gemini, Claude, and ...",Ryan's Tech Lab
youtube,Japanese レベルアップの道,,yt_subscribers,232,1,0,1,3,,,,https://www.youtube.com/watch?v=DSni3HydZgA,,2025-09-30,Japanese Speaking Practice Part 5,Today's Japanese speaking practice is all about the grammar form 〜ている. ChatGPT will specifically ask me questions that I am ...,Japanese レベルアップの道
youtube,Connor Larkin,,yt_subscribers,3,1,0,1,3,,,,https://www.youtube.com/watch?v=yG0EAW7BtWQ,,2025-09-29,5 Website Automations That Save You Hours Every Week”,"Your website should be working harder than you are. If you're still chasing reviews, sending invoices manually, or answering the ...",Connor Larkin
youtube,Boundless Ideas,,yt_subscribers,0,1,0,1,3,,,,https://www.youtube.com/watch?v=k0TFxRfLjQw,,2025-10-02,Slaying 1000 Lava Dragons in Old School RuneScape!,"Join us as we take on the massive challenge of slaying 1000 Lava Dragons in Old School RuneScape! In today's adventure, we'll ...",Boundless Ideas
youtube,Holistic_Trader,,yt_subscribers,52,1,0,1,3,,,,https://www.youtube.com/watch?v=YS6mZKadIEY,,2025-09-29,"Sunday Market Review: Stocks, Forex &amp; Crypto Q&amp;A (Live Off the Hip)","Welcome to the Holistic Trader Sunday Review Today we're going off the hip charting stocks, forex, and crypto while ...",Holistic_Trader
youtube,Furydin Warcraft,,yt_subscribers,1220,1,0,0,3,,,,https://www.youtube.com/watch?v=FP2si6yCXD4,,2025-09-27,World of Warcraft: Midnight&#39;s Alpha Launch &amp; Developer Q&amp;A - What to Expect | WoW News Update,In an unusual move Blizzard have provided advanced notice that the Alpha testing cycle for World of Warcraft: Midnight will begin ...,Furydin Warcraft
youtube,Dubb Support,,yt_subscribers,2010,1,0,0,3,,,,https://www.youtube.com/watch?v=-loVnp679Z8,,2025-09-26,"AI Video Marketing, Email Fixes, CRM Integrations &amp; Drip Campaigns | Live Q&amp;A","Welcome to Free-Flowing Friday with Team Dubb! This extended coaching session is packed with actionable strategies, ...",Dubb Support
reddit,amantinband,,reddit_upvotes,0,1,0,0,2,,,,https://www.reddit.com/r/Entrepreneur/comments/1nqfm8s/gave_myself_12_hours_to_build_an_ai_shirt_bot/,,2025-09-25,Gave myself 12 hours to build an AI shirt bot. Here's what happened.,"Hey r/entrepreneur,  Background: I'm deep in building my main startup (Brilliant), but had this intrusive thought of ""What if AI could turn any tweet into a custom shirt design that you can instantly purchase?"".  The constraint: 12 hours to build it. No extensions, no ""I'll finish it tomorrow."" Just",u/amantinband
reddit,RemarkableClothes43,,reddit_upvotes,2,1,0,0,2,,,,https://www.reddit.com/r/DigitalMarketing/comments/1nq05po/need_help_switching_from_sales_to_digital/,,2025-09-25,"Need help: Switching from Sales to Digital Marketing (Performance Marketing, GA4, DV360)","Hello everyone,  I’m an MBA graduate from india currently working in a sales role for the last 6 months with a salary of ₹5.5 LPA. However, I really want to switch my career to **digital marketing**, specifically in **performance marketing, GA4, DV360, programmatic ads, or ad operations.**  Here’s m",u/RemarkableClothes43
reddit,Frosty_Software_170,,reddit_upvotes,1,1,0,0,2,,,,https://www.reddit.com/r/Emailmarketing/comments/1npdi7p/mailchimp_analytics_mpp_exclusion_still_seeing/,,2025-09-24,Mailchimp Analytics & MPP Exclusion – Still Seeing Inflated Opens,"I was asked to dig into some suspicious Mailchimp analytics. From what I’ve heard, Mailchimp support suggested the inflated numbers might be due to automated activity (like bots). I also know Apple’s Mail Privacy Protection (MPP), introduced in 2021, often causes false opens by preloading pixels.  H",u/Frosty_Software_170
youtube,Intrinzi,,yt_subscribers,5,1,0,0,2,,,,https://www.youtube.com/watch?v=gtGHUwwHUkU,,2025-09-24,How to Automate Your Way to More Focus and Growth #shorts,"Feeling like your brain is running a marathon every day but going nowhere? This video reveals the secret to solving the ""business ...",Intrinzi
youtube,St. Louis Arc,,yt_subscribers,829,1,0,0,2,,,,https://www.youtube.com/watch?v=olDRCkcnTL8,,2025-09-25,Missouri Adaptive Ability Scale (MAAS) Q&amp;A,The Missouri Adaptive Ability Scale (MAAS) is a norm-referenced assessment tool administered by a certified assessor with the ...,St. Louis Arc
youtube,AdaptingtoYoutube,,yt_subscribers,13,1,0,0,2,,,,https://www.youtube.com/watch?v=MsE6oON_Mls,,2025-09-22,Attention D&amp;D Dms! Let your Players level up!!!,"Sometimes your party earned it, sometimes your party doesn't earn it... but when they level up, you get to level up too. Too many ...",AdaptingtoYoutube
youtube,JoeDirt FREAK_of_NATURE,,yt_subscribers,953,1,0,0,2,,,,https://www.youtube.com/watch?v=UhybPFK43CA,,2025-09-26,Mein erster YouTube Livestream 🎥✨ - GDT Abenteuer 🏔️ Community Talk 💬 &amp; Q&amp;A Kanada 🇨🇦,Heute ist es soweit - mein allererster YouTube-Livestream und das direkt nach dem großen Finale meiner Great Divide Trail ...,JoeDirt FREAK_of_NATURE
youtube,Tansy Aster Academy,,yt_subscribers,899,1,0,0,2,,,,https://www.youtube.com/watch?v=SK5B_dphvYE,,2025-09-27,Create An AI Knowledge Base To Use For Superior Content Creation,I think the biggest mistake people make with AI is treating it like a single-use tool instead of an engine. We've gone beyond simply ...,Tansy Aster Academy
