platform,subreddit,url,author_handle,title,excerpt,evidence_quote,score,created_utc
youtube,Family First Life,https://www.youtube.com/watch?v=RXxAxV9wy2o,Family First Life,What He Learned From My Daughter About Closing Sales,Sometimes the teacher becomes the student 👊 My daughter showed me a smarter way to run appointments—and it changed everything  #sales #salestraining #salestips #salesman,closing,77500,1758495959
youtube,We Live to Build with Sean Weisbrot,https://www.youtube.com/watch?v=HgNUnTWqcVU,We Live to Build with Sean Weisbrot,The New B2B Buyer Doesn't Want to Talk to You,"The New B2B Buyer Doesn't Want to Talk to You. Nearly 60% of B2B buyers are now millennials who grew up online and expect a seamless, self-service experience. In this interview, B2B expert David explains why personalization and a frictionless, multi-channel journey are the keys to winning over the m",leadership,240000,1758625235
youtube,James Taylor,https://www.youtube.com/watch?v=O4bJe65cVGs,James Taylor,Speaker's Portfolio: Expand Your Career Beyond Keynotes #shorts,Speakers can expand their income by creating video content or offering consulting services. Many options exist to diversify income and grow your reach. Clients will appreciate the expanded services and your career will reach new levels.   Watch/listen to full SpeakersU episode at https://speakersu.c,keynote,11000,1759335211
youtube,Digital Transformation with Eric Kimberling,https://www.youtube.com/watch?v=EEHozQSAx_Y,Digital Transformation with Eric Kimberling,Why Digital Transformations are Failing and How to Make Yours Succeed [KEYNOTE PRESENTATION],"This video explores why so many digital transformations go off track and how my new book, Welcome to the Jungle, can help you avoid the same pitfalls.  #erpsoftware #changemanagement #ai #digitaltransformation   ORDER MY NEW BOOK: Welcome to the Jungle: https://a.co/d/hAFI7cN   CONTACT MY TEAM & I: ",leadership,288000,1757919618
youtube,firmsconsulting,https://www.youtube.com/watch?v=-MuZxGEt090,firmsconsulting,"Microsoft, Google Executive Advisor on an Advertisement Style You’ll Never Get Tired Of","Bree Groff is a transformation expert, author, and Senior Advisor to the global consultancy SYPartners. She has spent her career guiding C-suite leaders at companies such as Microsoft, Google, Pfizer, Target, Calvin Klein, and Hilton through periods of complex change. Previously, Bree served as CEO ",strategy,53700,1757264400
youtube,CTM Consulting Group,https://www.youtube.com/watch?v=bLRFmGWUKAc,CTM Consulting Group,Today’s Leadership Insight is about The Mindset That Keeps You Stuck: Lean In!,"Today’s Leadership Insight is about The Mindset That Keeps You Stuck:   Lean in and reflect: What story are you telling yourself that no longer serves you—and how can you rewrite it into one that fuels growth?   LIKE, SHARE, SUBSCRIBE  #ctmconsultinggrp #unleashyourpotential #nadidahcoveney #leaders",mindset,12800,1758861035
youtube,TheoryTV,https://www.youtube.com/watch?v=OgG2ozF3-S0,TheoryTV,Come i Preconcetti ti Rovinano la vita - Consulenza Integrale di Mindset,Iscriviti subito alla SelfmadeUniversity : https://selfmade.university/  Ogni giorno in Live alle 22:00  Lunedi: A Scuola con i Theory Martedi: Business Hotline Mercoledi’: Theory’s Got Talent Giovedì’: A Scuola con i Theory Domenica: Business Hotline ________________________________________________,mindset,46100,1758628854
youtube,TheoryTV,https://www.youtube.com/watch?v=LEb1MouXvh0,TheoryTV,"I soldi, da soli, non fanno la felicità - Consulenza Integrale di Mindset",Iscriviti subito alla SelfmadeUniversity : https://selfmade.university/  Ogni giorno in Live alle 22:00  Lunedì : BusinessHotline Martedì : Branding & Marketing Hotline Mercoledì : Finance & Organizzazione Hotline Giovedì : Mindest & Leadership Hotline Domenica : A Scuola con i Theory ______________,mindset,46100,1757332840
youtube,nETSETOS,https://www.youtube.com/watch?v=eXFQGoY_6Qk,nETSETOS,DAY 3 MASTER PYTHON BOOTCAMP - Operations,"At Netsetos, we believe technology is not just about writing code – it’s about solving real-world problems, inspiring innovation, and building a community of learners and creators.   We started Netsetos with one mission:  👉 To make learning simple, practical, and industry-ready.     Why We Started  ",operations,30000,1758734971
youtube,Method K9,https://www.youtube.com/watch?v=v9_obd52Yz0,Method K9,A Leader's Job,Our certification programs will be a excellent fit for the average dog owner looking to start a career in dog training or for professional dog trainers looking to add more certifications to their tool box.  •Online and In-Person Options.  •Go and your own pace.  •Payment Plans (These will be offered,business coaching,22700,1759680069
youtube,Method K9,https://www.youtube.com/watch?v=JyySHnuXifk,Method K9,Advocate For Your Dog,Our certification programs will be a excellent fit for the average dog owner looking to start a career in dog training or for professional dog trainers looking to add more certifications to their tool box.  •Online and In-Person Options.  •Go and your own pace.  •Payment Plans (These will be offered,business coaching,22700,1759593645
youtube,Method K9,https://www.youtube.com/watch?v=nALUnpr_Txk,Method K9,Being an Indecisive Dog Owner,Our certification programs will be a excellent fit for the average dog owner looking to start a career in dog training or for professional dog trainers looking to add more certifications to their tool box.  •Online and In-Person Options.  •Go and your own pace.  •Payment Plans (These will be offered,business coaching,22700,1759424476
youtube,Method K9,https://www.youtube.com/watch?v=3BRFLAEYZFI,Method K9,Our Dog Training Subscription Page,Our certification programs will be a excellent fit for the average dog owner looking to start a career in dog training or for professional dog trainers looking to add more certifications to their tool box.  •Online and In-Person Options.  •Go and your own pace.  •Payment Plans (These will be offered,business coaching,22700,1759251646
youtube,Method K9,https://www.youtube.com/watch?v=sttGF9G6ick,Method K9,A Message from Method K9,Our certification programs will be a excellent fit for the average dog owner looking to start a career in dog training or for professional dog trainers looking to add more certifications to their tool box.  •Online and In-Person Options.  •Go and your own pace.  •Payment Plans (These will be offered,business coaching,22700,1759161655
youtube,Method K9,https://www.youtube.com/watch?v=LJ4ujQllJ-E,Method K9,Your Dog's Breed is Not an Excuse,Our certification programs will be a excellent fit for the average dog owner looking to start a career in dog training or for professional dog trainers looking to add more certifications to their tool box.  •Online and In-Person Options.  •Go and your own pace.  •Payment Plans (These will be offered,business coaching,22700,1759003241
youtube,Seattle Voice Lab,https://www.youtube.com/watch?v=Zn-qzvQoWWA,Seattle Voice Lab,Starting Feminine Voice Training - Seattle Voice Lab,"Starting transfeminine voice training can be an arduous, confusing process. Here's a quick (very quick!) guide on how to begin bringing out your true voice. 👒   tags: #VoiceTraining #TransVoice #VoiceAffirmation #GenderAffirmingVoice #LGBTQIA #QueerVoices #Shorts #Viral #TransJoy  Join our Discord! ",public speaking,15400,1758567684
youtube,Dominic Colenso,https://www.youtube.com/watch?v=rDbntnm0be8,Dominic Colenso,Top Public Speaking Coach Reveals Best Mental Preparation Techniques,"The final warm-up stage involves mental preparation, bringing everything to a point of deep focus. Harness the energy created in the physical and vocal warm-ups, ensuring grounding and centering before starting.   🎯 Ready to find out exactly where you can improve your communication and presenting sk",leadership,24000,1757514643
youtube,GovClose | DoD Contract Academy,https://www.youtube.com/watch?v=sQSfpd4V83M,GovClose | DoD Contract Academy,Email That Closes Deals  #govclose,Government Contracting 101: https://www.govclose.com  GovClose Certification Overview: https://www.govclose.com/govclose-certification-program   Connect with Rick on LinkedIn: https://www.linkedin.com/in/govclose/  FREE Federal Sales Training: https://www.govclose.com,strategy,25900,1759540020
youtube,Augmented AI,https://www.youtube.com/watch?v=iGzLj38CBFk,Augmented AI,Stop Writing Cold Emails (This n8n Workflow Does Everything) #Shorts,,cold email,121000,1758682828
youtube,Smartlead,https://www.youtube.com/watch?v=yUrEoxWMxdY,Smartlead,How to send 200k cold emails every month (ft. Suprava Sabat),Comment “cold email” to get the complete guide 💯,cold email,33100,1758544286
youtube,I Design My Life,https://www.youtube.com/watch?v=rA_lkrfR15s,I Design My Life,3 Step Sales Training Process - Transform Your Sales Team,"Building a top-performing sales team doesn’t happen by chance—it requires the right sales training system. In this video, Sumit Agarwal from I Design My Life shares 3 powerful steps every MSME business owner must implement to create consistent, high-performing sales teams. Learn how to design positi",strategy,170000,1757777500
youtube,Him Singh,https://www.youtube.com/watch?v=szBw580DMuk,Him Singh,Easy hack to get 80% reply rate,Cold email limits and how many send daily?👇  How many cold emails can you safely  send per day? 🤔  What’s the best time to send emails ⏰ to get an 80%+ reply rate 📈   and stay out of spam 📥?   ✅ Proven daily sending limits  ✅ Best times for higher open & reply rates  ✅ Deliverability hacks to avoid ,cold email,52400,1757939479
youtube,Lead Gen Jay,https://www.youtube.com/watch?v=bwE1UEwU5RQ,Lead Gen Jay,I Automated Cold Email Domain Setup (5000 Domains in 1 Min),"This automation finds available cold email domains, buys cheap domains in bulk, transfers domains to cloudflare hosting, and then configures the DNS records (DKIM, DMARC, MX, SPF and custom tracking domain)  This AI Agent was built in n8n to help my team setup cold email mailboxes faster. If you wan",cold email,68900,1757693530
youtube,Fadel,https://www.youtube.com/watch?v=D3CU1mVZcgA,Fadel,How to FINALLY Get Web Design Clients Full Course  [No Ads] | 2025,"🚀 Elite Group: My premium community for serious web designers. Get live classes, direct access to me, and support from committed freelancers building real businesses ⤵️ https://wdcelite.com  🌍 Free Community: Thousands of designers are already sharing wins, feedback, and opportunities inside my free",mindset,13900,1757341002
youtube,Instantly,https://www.youtube.com/watch?v=tVhslsVNOf4,Instantly,Full Instantly.ai Tutorial 2025 (Best Cold Email Software),"Use Instantly Today To Get 10x your leads, meetings and deals: https://app.instantly.ai/auth/signup?utm_source=youtube&utm_medium=video&utm_campaign=Demo  Looking to master cold email outreach and take your lead generation to the next level? In this full Instantly.ai tutorial, I break down exactly h",strategy,65100,1757275237
youtube,Kanał Militarny,https://www.youtube.com/watch?v=DXW-23G39ho,Kanał Militarny,Rurociągi paliwowe NATO w Polsce 💢 Co wiemy? #short #shorts #shortvideo #news,3 października podpisano wstępne porozumienie w sprawie rozbudowy polskiej infrastruktury paliwowej i przyłączenia jej do natowskiego systemu rurociągów. Jakie szczegóły ujawniono? 🤔  Wspieraj kanał i zyskaj bonusy: 🔗 https://youtube.com/@KanalMilitarny/join  UWAGA❗  🔴 Źródła użyte do stworzenia fil,eta,25200,1759770031
youtube,MD NURNOBY,https://www.youtube.com/watch?v=PwRU3R90Zbs,MD NURNOBY,এই কারণে মানুষ বাড়িতে এসি লাগায় না | heating pipeline,"People are now replacing air conditioners with smart heating pipelines! In this system, multiple pipes are installed under the floor, connected to a machine that circulates hot water in winter and cold water in summer — keeping the temperature perfectly balanced. Finally, epoxy coating gives the flo",pipeline,3210000,1759759243
youtube,NST Online,https://www.youtube.com/watch?v=_NCl63zaIm8,NST Online,WM Senibong fuels Johor's growth,"Nearly 20 years ago, WM Senibong transformed a quiet fishing spot into Senibong Cove, now a luxury waterfront township.   Today, the group holds over 800 hectares in southern Johor with a GDV of RM36 billion and is expanding into townships like Crest@Austin, The Kews, and the RM10 billion Centennial",pipeline,224000,1759744218
youtube,Tricky Concepts By Er.,https://www.youtube.com/watch?v=Zphs92riGdQ,Tricky Concepts By Er.,Best PVC Drainage System | Modern Pipe Line Design for Home 💧,"इस वीडियो में देखिए PVC Pipe Line का नया design जो आपके घर की drainage system को बनाएगा leak proof, long lasting aur easy to maintain!  ये modern design वाला PVC pipeline system घर की नाली के लिए perfect है — strong joints, smooth flow aur durable fitting के साथ।  ✨ Features:  High-Quality PVC Mater",pipeline,364000,1759684711
youtube,Creators,https://www.youtube.com/watch?v=uSfmCowG6YU,Creators,industry pipeline replace system,,pipeline,79800,1759670955
youtube,MrWork,https://www.youtube.com/watch?v=x5fhm17YzvQ,MrWork,Hot metal pipeline automatic system process,,pipeline,5750000,1759667095
youtube,vlogize,https://www.youtube.com/watch?v=ElHGHAttsys,vlogize,Can Haskell's Type System Enforce Correct Ordering of Data Pipeline Stages?,"Explore how Haskell's type system can ensure the correct ordering of data processing stages in your data pipelines, preventing runtime errors through type-level programming. --- This video is based on the question https://stackoverflow.com/q/63674412/ asked by the user 'Matt' ( https://stackoverflow",operations,13300,1759607487
youtube,Creators,https://www.youtube.com/watch?v=t6rtxR2egQE,Creators,gas pipeline installation system,,pipeline,79800,1759570245
youtube,OTV News English,https://www.youtube.com/watch?v=ofXdGGJvplw,OTV News English,"S-400 Performing Well, Indigenous Systems Also In Pipeline: AP Singh","S-400 Performing Well, Indigenous Systems Also In Pipeline: AP Singh #apsingh #indianarmy #otvnews    --------------------------------------------------------------------------------------------------------- OdishaTV is Odisha's no 1 News Channel. OTV being the first private satellite TV channel in ",pipeline,792000,1759484012
youtube,Defence Xam Master,https://www.youtube.com/watch?v=98xKJK5LT_U,Defence Xam Master,"Offline SSB Coaching with Personal Mentorship |Crack Screening, Psych, GTO & Interview | DXM Academy","Want to crack your SSB Interview and finally wear the uniform you’ve dreamed of? 🇮🇳 Welcome to GARUD Academy’s Offline SSB Coaching Program, designed for serious defence aspirants who want real-time mentorship, personality growth, and complete SSB mastery.  🔥 What You’ll Get: ✅ Complete SSB Intervie",mindset,52000,1759684658
youtube,Nieklesh Nishad,https://www.youtube.com/watch?v=1l-IXHNa6wE,Nieklesh Nishad,What Is The REAL Power Of A MENTOR?,What Is The REAL Power Of A MENTOR?  #nieklesh #niekleshnishad #nikleshnishad #mentor #mentorship #mentorshiptips #leadershipdevelopment #leadershipskills #leadershiplessons #leadershiptips #leadershiptraining #leadershipcoaching #leadershiptips #vivekbindra #harshvardhanjain   I'm diving deep to di,mindset,42300,1759587301
youtube,Marley Jaxx,https://www.youtube.com/watch?v=Hq42KiC1YRQ,Marley Jaxx,How to skip the line to success EVERY TIME,People say there are no shortcuts I completely disagree  The right people can change everything They collapse time Transfer experience Open doors  Who has what you want?  #growthmindset #successprinciples #highperformance #mentorship #wealthbuilding #entrepreneurmindset #personaldevelopment #shortcu,mindset,176000,1758918700
youtube,Thais Gibson - Personal Development School,https://www.youtube.com/watch?v=p-dTNGVykYY,Thais Gibson - Personal Development School,The Real Reason We Fall in Love (and How It Shapes Us),"We don’t just fall in love with people, we fall in love with who we get to become around them.  Sometimes it’s the confidence they reflect, or how seen, needed, or safe we feel.  But this can also keep us stuck in relationships where our worth depends on what we do for others.  This video reveals ho",personal development,417000,1759838486
youtube,Thais Gibson - Personal Development School,https://www.youtube.com/watch?v=baTIgh8YLsQ,Thais Gibson - Personal Development School,The Secret to Caring Without Clinging in Relationships,"Caring deeply doesn’t have to mean losing yourself.  Non-attachment isn’t about detaching or pretending not to feel, it’s about loving without chasing, and staying grounded in your own power.  This video teaches one powerful shift to help you stop anxiously attaching to outcomes, and start building ",personal development,417000,1759752092
youtube,Smart School Bengali - Adda247,https://www.youtube.com/watch?v=EfpUkMhW8_g,Smart School Bengali - Adda247,How to Increase Self Confidence | কীভাবে বাড়াবে নিজের আত্মবিশ্বাস? | Personality Development Course,"How to Increase Self Confidence | Personality Development Course | how to increase self confidence Bengali | how to increase self confidence in study | personality development | personality development course |  In this video, Subhasish Sir shares practical tips and techniques to help you build conf",mindset,42200,1759635006
youtube,Thais Gibson - Personal Development School,https://www.youtube.com/watch?v=hBpKAzvTnRM,Thais Gibson - Personal Development School,Why You’re Really Missing Them (and How to Heal),"You’re not just missing the person, you’re missing the needs they met.  That sense of being seen, heard, supported… the parts of yourself they brought out.  This video helps you understand why the grief feels so intense and gives you a powerful journaling exercise to take back your power and begin h",personal development,417000,1759631474
youtube,MG Legacy,https://www.youtube.com/watch?v=zWbKSvZzoSA,MG Legacy,15 Truths for Personal Growth || MYRON GOLDEN || BEST ADVICE 2025,15 Truths for Personal Growth || MYRON GOLDEN || BEST ADVICE 2025 #myrongolden #motivationalvideo #focusonyourself #motivationalspeechinhindi  Unlock the secrets to transforming your life with 15 Truths for Personal Growth. This powerful motivational speech will guide you through the principles that,mindset,10100,1758849056
youtube,JTR Media House,https://www.youtube.com/watch?v=bf9P7mNb3kM,JTR Media House,Student Development Workshop 2025 | Self Defence & Personal Growth | JTR Media House,"💡 Shaping Students’ Personalities for a Better Future 💡  Jamiat ur Rasheed organized a comprehensive Student Development Workshop 2025 focusing on: ✔️ Self Defence Training – building confidence and protection skills. ✔️ Personal Development – enhancing communication, discipline, and vision. ✔️ Char",personal development,255000,1758806514
youtube,Gs Planet offline ,https://www.youtube.com/watch?v=bPxCTMNnXrI,Gs Planet offline ,⚡ Win Over Yourself First 🏆 | NEET AIIMS BSc Nursing Classes 📖#motivation #shorts #neet2026,"💯 Life is not about competing with others, it’s always ME vs ME 💪 NEET | AIIMS | BSc Nursing Students – Stay focused 📚🔥 Self fight = Self growth 🚀 | Keep hustling, success will be yours 🏆   neet motivation, aiims motivation, bsc nursing motivation, neet aspirants, aiims aspirants, neet aiims nursing",mindset,45500,1758804151
youtube,Learn in brief,https://www.youtube.com/watch?v=3OaxIH5b6RY,Learn in brief,Developing Soft Skills and Personality Week 6 Assignment Answers | July 2025 | Learn in brief,"Welcome to our channel! In this video, we provide detailed answers and explanations for the Week 6 assignment of the NPTEL course on ""Developing Soft Skills and Personality."" We explore the foundational concepts, key strategies, and initial practices for enhancing soft skills and personal developmen",personal development,16800,1758714619
youtube,Learn in brief,https://www.youtube.com/watch?v=XdNWLoLOH0o,Learn in brief,Developing Soft Skills and Personality Week 5 Assignment Answers | July 2025 | Learn in brief,"Welcome to our channel! In this video, we provide detailed answers and explanations for the Week 5 assignment of the NPTEL course on ""Developing Soft Skills and Personality."" We explore the foundational concepts, key strategies, and initial practices for enhancing soft skills and personal developmen",personal development,16800,1758714297
youtube,Sarat Chandra IAS Academy,https://www.youtube.com/watch?v=lFIQp9P_3vQ,Sarat Chandra IAS Academy,Pennar River System|Best Civils Coaching in Vijayawada & Hyderabad|Sarat Chandra IAS Academy,#penna #river  #pennariver  #riversystem #dailynews   #upsc  #saratchandraiasacademy #bestiascoachinginhyd #newstoday #bestiasacademyinhyderabad #bestiasacademy #september #upsccurrentaffairs2025  #dailycurrentaffairs  #monthlycurrentaffairs #weeklycurrentaffairs #september2025   1) Video of our ran,eta,51600,1758610531
youtube,I Design My Life,https://www.youtube.com/watch?v=xM-untkhrCs,I Design My Life,6 Essential Sales SOPs Every Business Must Have | Sales System Training,"Discover the 6 essential Sales SOPs every MSME business owner must implement to build a predictable and scalable sales system. In this video, Sumit Agarwal from I Design My Life shares the step-by-step framework for creating SOPs for Lead Generation, Lead Management, Sales Conversations, Sales Train",business coaching,170000,1758195924
youtube,SONISVISION - Business Automation ,https://www.youtube.com/watch?v=s4_16oJHgKU,SONISVISION - Business Automation ,Failure से घबराओ मत | Success का असली रास्ता यही है,"✨ Success or Failure is a Journey ✨  Life is not only about achieving success or facing failure, it’s about the journey of growth, learning, and self-improvement. Every successful person has faced failures, challenges, and rejections. But instead of stopping, they turned every failure into a lesson ",mindset,22200,1758630678
youtube,CTM Consulting Group,https://www.youtube.com/watch?v=s8E5TGdchlQ,CTM Consulting Group,Today’s Leadership Insight is about Rebuilding Yourself. Lean in!,Today’s Leadership Insight is about Rebuilding Yourself.   Lean in and reflect: What part of yourself is it time to rebuild so you can RISE into your next level of leadership and impact?   #ctmconsultinggrp #unleashyourpotential #nadidahcoveney #leadershipinsights #ctmleadershipbytes #leadershipdeve,mindset,12800,1757682998
youtube,ROSE - The mind Doctor ,https://www.youtube.com/watch?v=vy8SQuDF-DU,ROSE - The mind Doctor ,എന്തുകൊണ്ടാണ് മാറ്റങ്ങൾ നിങ്ങളെ വേദനിപ്പിക്കുന്നത്?,എന്തുകൊണ്ടാണ് മാറ്റങ്ങൾ നിങ്ങളെ വേദനിപ്പിക്കുന്നത്?  Why Growth Feels Uncomfortable — A Lobster’s Lesson  Have you ever wondered why growth feels so uncomfortable?  Lobsters are soft animals — but they live inside a hard shell. And here’s the problem: that shell doesn’t grow with them.  As the lobst,mindset,167000,1757342444
youtube,Ryan Hanley | Finding Peak,https://www.youtube.com/watch?v=r7oMsw0AsZg,Ryan Hanley | Finding Peak,Creating More Impact with the FIRE Framework |  #leadership,Join our community of fearless leaders in search of unreasonable outcomes... * Want to become a FEARLESS entrepreneur and leader? Go here: https://www.findingpeak.com * Listen to Audio version: https://linktr.ee/ryan_hanley,leadership,11500,1759324020
youtube,Basic Leadership Skills,https://www.youtube.com/watch?v=v-RWupnatNY,Basic Leadership Skills,Leaders: Use THIS framework to develop your team like a leader not a manager 🔥🙌🏻 #management #tips,,leadership,33800,1759161675
youtube,Human Capital Innovations,https://www.youtube.com/watch?v=4Kzs28LthKU,Human Capital Innovations,"The Möbius Effect: A Framework for Sustainable Leadership Impact, by Jonathan H. Westover PhD","Abstract: This article explores the application of the Möbius strip as both metaphor and framework for sustainable leadership practice. Drawing parallels between the mathematical properties of the Möbius strip—continuity, non-orientation, and boundary transcendence—and leadership dynamics, the paper",leadership,15900,1759111068
youtube,IT Project Managers,https://www.youtube.com/watch?v=vF8KRarI8XU,IT Project Managers,The Secret Framework That Makes Project Managers Stand Out!,"✅ Advance Your PM Career: https://link.itpmschool.com/sKob71  Most project managers focus on the technical aspects, but to achieve true project success, strong leadership skills are essential. Effective stakeholder management and strategic thinking can significantly boost your career development. En",leadership,57800,1758888113
youtube,Alexa Saarenoja,https://www.youtube.com/watch?v=Ps1uNYPduY0,Alexa Saarenoja,Starts Tomorrow! Join My Small Group Mentorship Before Doors Close,"Link to join program if you are already a Creator Boost Tribe Member: https://www.skool.com/creatorboost/classroom/72f348c1  Link to join Creator Boosts Tribe (skool) if not a member already: https://www.skool.com/creatorboost  Price: $1500 for 3 month GROUP Mentorship Starts: Oct. 1, 2025  Ends: De",business coaching,51400,1759218054
