platform,subreddit,url,author_handle,title,excerpt,evidence_quote,score,created_utc,website,contact_url,email,company
reddit,Entrepreneur,https://www.reddit.com/r/Entrepreneur/comments/1nyv8qw/i_want_to_expand_my_business_but_whitelabel_it/,u/Candid_Positive8832,"I want to expand my business, but ""white-label"" it",Hi im a consultant freelancer working from a controversial country and i miss many business opportunities with countries that dont have bilateral connections with mine even though i could provide services there im thinking about creating an ai agent trained on my own knowledge kind of like a digital,,2,1759687290,,,,Entrepreneur
reddit,Entrepreneur,https://www.reddit.com/r/Entrepreneur/comments/1nueuij/burnout_exhaustion_and_lack_of_inspiration/,u/MrMusicAndFilm,"Burnout, exhaustion, and lack of inspiration","As you can probably guess, I'm dealing with all of those things in the title. For better context of how I got here, I'll share some info.  First, I'll be 50 next year, I have a wife, twins that are soon to be 5 (yes, we started late), no real savings outside of Social Security benefits (available in",,9,1759242854,,,,Entrepreneur
reddit,Entrepreneur,https://www.reddit.com/r/Entrepreneur/comments/1nxf5fa/what_happens_when_every_channel_is_flooded_with/,u/GmailsAreCute,What happens when every channel is flooded with AI outreach?,"With AI making it cheap and easy to send massive amounts of cold emails and LinkedIn messages, it feels like those channels are going to be completely saturated in the next few years. At some point inboxes will be AI-filtered, LinkedIn will be full of bots, and “better copy” won’t be enough to stand",,6,1759535686,,,,Entrepreneur
reddit,Entrepreneur,https://www.reddit.com/r/Entrepreneur/comments/1nwo2mx/any_tips_for_healthcare_software/,u/croos-sime,Any tips for healthcare software?,"I have to say most of the healthcare software in South America countries, such as Colombia Republica Venezuela, half a really poor quality and everything is even worse outside of the capital cities. For example, maybe some doctors in Caracas have good software to manage their appointments, but outsi",,1,1759460814,,,,Entrepreneur
reddit,Entrepreneur,https://www.reddit.com/r/Entrepreneur/comments/1nupi4c/how_my_girlfriend_made_reviewing_academic_papers/,u/Academic_Way_293,How my girlfriend made reviewing academic papers into a small business,"She has reached about $4000 /mo, of course it fluctuates based on demand and scaling it to a bigger business is kind of up in the air right now since it'd mean hiring more people and turning it into more     What she's doing is essentially formatting research papers for uni researchers or people in ",,57,1759266944,,,,Entrepreneur
reddit,Entrepreneur,https://www.reddit.com/r/Entrepreneur/comments/1nuh6or/helping_5_creators_build_offers_optimize_content/,u/CaptianGooseFlaps,"Helping 5 Creators Build Offers, Optimize Content & Land Clients","I'm looking to help creators package their skills into a clear offer, optimize content for growth, and build a simple sales system that attracts clients consistently. I'll help you make a compelling offer and make content to support that.  I have been an entrepreneur the last 5 years or so . Doing T",,4,1759248157,,,,Entrepreneur
reddit,Entrepreneur,https://www.reddit.com/r/Entrepreneur/comments/1ntdo6r/33m_entrepreneur_making_good_money_but_worried/,u/davidmorelo,33M entrepreneur making good money but worried about future,"I'm 33, living in a small Czech city with my wife and two young kids (6 and 3). I currently make about $5k USD/month from two sources: content writing ($2.5k - but this industry is clearly dying) and a video game I've been developing ($2.5k on Patreon and growing). I have a decent emergency fund and",,7,1759138839,,,,Entrepreneur
reddit,Entrepreneur,https://www.reddit.com/r/Entrepreneur/comments/1nskfhf/looking_back_on_15_years_of_online_business/,u/Tharnwell,Looking back on 15 years of online business models and what still works today,"I’ve been online for about 15 years now.   I’ve witnessed several online business model trends over the years. The timeframes mentioned below represent what I consider the golden eras of each business model. This doesn’t mean these strategies won’t work today, but they are far more challenging to su",,29,1759053385,,,,Entrepreneur
reddit,SmallBusiness,https://www.reddit.com/r/smallbusiness/comments/1nvbyg9/spent_a_whole_day_training_someone_yesterday/,u/CodeFlux88,Spent a whole day training someone yesterday. Today they asked me the exact same questions.,I don't even know what to do anymore.   We went from a small team of 3 to 8 since april and I thought hiring would solve problems but really it just created new ones. Like now instead of being stressed about delivering I'm stressed about training people to do the work. We had this new guy just joini,,83,1759333893,,,,SmallBusiness
reddit,SmallBusiness,https://www.reddit.com/r/smallbusiness/comments/1ntf3y6/i_dont_know_where_im_headed_or_what_am_i_doing/,u/belloaisha,I don't know where I'm headed or what am I doing with my life,"I am 21M  My dream is to become rich and escape the rat race so that I can buy whatever I want without even thinking about my bank balance. Every time I saw a new car, bike, phone the first thing that came into my mind is how do I get it and what should I do so that I could afford those things, and ",,0,1759144147,,,,SmallBusiness
reddit,ContentCreators,https://www.reddit.com/r/ContentCreators/comments/1nvbnpc/i_left_my_agency_and_started_managing_myself_its/,u/WillingnessHappy5740,I left my agency and started managing myself. It’s been the best decision financially and creatively,About a year ago I decided to leave the agency that had been managing my brand deals and content partnerships. I was nervous at first but honestly it’s been the best decision I’ve made for both my income and my sanity  I used to feel locked into certain deals that didn’t really match my style or aud,,1,1759333225,https://www.nowfluence.co/,https://www.nowfluence.co/contact,your_email@domain.com,nowfluence: Influencer Campaign Management
reddit,YouTubers,https://www.reddit.com/r/youtubers/comments/1o39yov/my_channel_was_attacked_by_a_bot/,u/Backpackingwithmylen,My channel was attacked by  a bot?,"This is the third time something like this happened so thought of posting here. Just wanted to understand why something like this happened and how to prevent it. In January all of a sudden I gained 160 subs and got 160 unsub the next day. Similarly, in February 77 subs and 77 unsub. But this time th",,4,1760123295,,,,YouTubers
reddit,Marketing,https://www.reddit.com/r/marketing/comments/1nzjxa6/parallels_with_seo_15_years_ago_and_reddit_link/,u/ksaize,Parallels with SEO 15 years ago and Reddit link building in 2025,"**TL;DR: My prediction about agencies doing Reddit link building for LLM are going to be out of business in 12 months. It is built on hype and not knowledge about LLM or Reddit.**  **Clarification: I do not offer reddit organic marketing services.**  For those unaware, Reddit had deal with Google to",,13,1759759358,,,,Marketing
reddit,DigitalMarketing,https://www.reddit.com/r/DigitalMarketing/comments/1o16qsm/are_any_digital_marketers_here_actually_using_ai/,u/jupiterframework,Are any digital marketers here actually using AI digital twins yet?,"AI digital twins can make campaigns 'hyper-personalized' by simulating real audiences, which sounds great - who’s building the best stuff in this space right now and/or the best tool available? ",,3,1759919270,,,,DigitalMarketing
reddit,DigitalMarketing,https://www.reddit.com/r/DigitalMarketing/comments/1o16en6/i_built_my_ai_twin_in_30_seconds_with_my_phone/,u/max-blueprint,"I built my AI twin in 30 seconds with my phone, now it makes more content in a day than I used to make in a year","This isn’t a “coming soon” thing. It’s already happening.  You can open Sora app, scan your face, or upload a single photo and in seconds, you’ve got a photorealistic AI version of yourself that can talkk move, and act naturally on camera.  No lights. No mics. No scripts.  Just text prompts.  Step 1",AI twin,2,1759918067,,,,DigitalMarketing
reddit,DigitalMarketing,https://www.reddit.com/r/DigitalMarketing/comments/1o16qsm/are_any_digital_marketers_here_actually_using_ai/,u/jupiterframework,Are any digital marketers here actually using AI digital twins yet?,"AI digital twins can make campaigns 'hyper-personalized' by simulating real audiences, which sounds great - who’s building the best stuff in this space right now and/or the best tool available? ",,3,1759919270,,,,DigitalMarketing
reddit,DigitalMarketing,https://www.reddit.com/r/DigitalMarketing/comments/1o16en6/i_built_my_ai_twin_in_30_seconds_with_my_phone/,u/max-blueprint,"I built my AI twin in 30 seconds with my phone, now it makes more content in a day than I used to make in a year","This isn’t a “coming soon” thing. It’s already happening.  You can open Sora app, scan your face, or upload a single photo and in seconds, you’ve got a photorealistic AI version of yourself that can talkk move, and act naturally on camera.  No lights. No mics. No scripts.  Just text prompts.  Step 1",AI twin,3,1759918067,,,,DigitalMarketing
reddit,DigitalMarketing,https://www.reddit.com/r/DigitalMarketing/comments/1ny6q1g/bots_clicks_problem_in_meta/,u/Youssef822,Bots clicks problem in meta,i've made an ad as conversion for my landing website page to get sales but it ended up with a lot of clicks (1377 click cost per click very low 0.19EGP)    without any purchases or even scroll in website very short sessions or very long sessions    in Microsoft clarity it doesn't show up that number,,4,1759614908,,,,DigitalMarketing
reddit,DigitalMarketing,https://www.reddit.com/r/DigitalMarketing/comments/1o29h63/digital_marketing_course_help/,u/WoodenTraffic7730,Digital marketing course help,"Hi guys, one of my friend wants to switch her career. She will complete her master’s next year in dietetics but there’s very less scope for her in that subject, so she was thinking of learning digital marketing which will help her get a job along with the course so can you please suggest me some cou",,2,1760024801,,,,DigitalMarketing
reddit,DigitalMarketing,https://www.reddit.com/r/DigitalMarketing/comments/1o1f5z0/tired_of_fake_marketing_groups_looking_for_a/,u/Own-Barracuda-4228,"Tired of fake ""marketing"" groups — looking for a small, real community of passionate marketers","I don’t know if anyone else feels this, but I’m honestly tired of joining “marketing” groups that are full of bots, ghost members, or spammy posts.  I’m new to digital marketing, but I’m serious about learning and improving. I just want to connect with real people who share the same passion — people",,1,1759940530,,,,DigitalMarketing
reddit,DigitalMarketing,https://www.reddit.com/r/DigitalMarketing/comments/1o0br6r/seo_news_google_expands_agentic_features_in_ai/,u/Kseniia_Seranking,"SEO News: Google expands agentic features in AI Mode, OpenAI launches “Buy it in ChatGPT” with Agentic Commerce Protocol, AI Mode now delivers more visual responses in queries",Hey guys! The work week can’t start without a quick look at last week’s fresh news. You might even want to rethink your strategy after reading this one:  **Search / SEO**  * **Old domain history/state needs time to be shaken off**  A Reddit user reported launching a site on a previously owned domain,,13,1759835434,,,,DigitalMarketing
reddit,Emailmarketing,https://www.reddit.com/r/Emailmarketing/comments/1o19g27/advice_wanted_does_anyone_know_a_method_for_if/,u/charliewr,"Advice wanted: does anyone know a method for, if someone signed up for a back in stock notification, didn't purchase the item, and then the item sells out, to email them letting them know they missed ","I work at an eCommerce company where, at the moment, demand is mostly outweighing supply (a good and bad problem for a marketer, lol)  *Most* of our main desireable high-ticket items are out of stock.   Lots of people sign up for email notifications when things come back in. Quite often, things sell",,1,1759927464,,,,Emailmarketing
reddit,OnlineCourses,https://www.reddit.com/r/onlinecourses/comments/1o0d0nu/turning_my_pet_training_experience_into_online/,u/Ashamed-Nectarine-84,Turning My Pet Training Experience into Online Courses – Need Platform Suggestions,"I’m a pet consultant and trainer, and I’ve been helping people train their pets for a while now. Recently, I’ve been thinking about taking my business online by creating pet training courses — something structured and accessible for pet parents everywhere.      I’m currently exploring different onli",,2,1759839148,,,,OnlineCourses
reddit,OnlineCourses,https://www.reddit.com/r/onlinecourses/comments/1o1pk80/accessibility_checklist_for_course_creators/,u/MaddieThinkific,Accessibility checklist for course creators,"Hi! I created this accessibility checklist for a recent event we had (the Peak Season Summit if anyone attended), but figured I might as well share it here too.  **Content & Structure**  * Clear, simple, & consistent language * Logical flow of ideas (i.e. introduction, body, summary) * Break long pa",,2,1759963049,,,,OnlineCourses
reddit,OnlineCourses,https://www.reddit.com/r/onlinecourses/comments/1o1lhca/is_miracamp_legit/,u/briocheburgerbun,Is Miracamp legit?,"Hey everyone,   I came across an online course provider called Miracamp that offers professional video editing programs. Their website looks professional, and they have a 4.9/5 rating on Trustpilot that's also listed in their website, but I noticed a small warning that they might be requesting revie",,2,1759953796,,,,OnlineCourses
reddit,OnlineCourses,https://www.reddit.com/r/onlinecourses/comments/1o0d0nu/turning_my_pet_training_experience_into_online/,u/Ashamed-Nectarine-84,Turning My Pet Training Experience into Online Courses – Need Platform Suggestions,"I’m a pet consultant and trainer, and I’ve been helping people train their pets for a while now. Recently, I’ve been thinking about taking my business online by creating pet training courses — something structured and accessible for pet parents everywhere.      I’m currently exploring different onli",,2,1759839148,,,,OnlineCourses
reddit,OnlineCourses,https://www.reddit.com/r/onlinecourses/comments/1o0blwi/moving_from_blog_online_courses_which_platform/,u/Key_Recognition4437,Moving from Blog → Online Courses: Which Platform Should I Use?,"I’ve been blogging about digital marketing for a while now, and I’m ready to take the next step: converting my blog content into online courses.  Before I commit, I’d love some feedback from folks who’ve gone this route, or from those who know their platforms well.  Here’s what I *really* need:  1. ",,1,1759834981,,,,OnlineCourses
reddit,OnlineCourses,https://www.reddit.com/r/onlinecourses/comments/1nwvtuq/kajabi_is_too_expensive_any_good_alternatives/,u/Ashamed-Nectarine-84,Kajabi is too expensive — any good alternatives with email marketing?,"I’m a course creator getting ready to launch some new content, so I’ve been exploring different online course platforms. I recently checked out Kajabi, and while it looks super solid feature-wise, the pricing is honestly a bit too much for me right now.   On top of that, I noticed that you only get ",,1,1759488779,,,,OnlineCourses
reddit,OnlineCourses,https://www.reddit.com/r/onlinecourses/comments/1nub6hs/best_online_course_platforms_with_affiliate/,u/Ashamed-Nectarine-84,Best online course platforms with affiliate programs?,"I’ve got a site where I do affiliate stuff, and I’m thinking of diving into the online course platform space. I’m looking for platforms that have decent affiliate programs—good commissions, reliable payouts, and easy tracking.   If you’re a platform owner, a marketer, or already promoting one, I’d l",,4,1759233449,,,,OnlineCourses
reddit,OnlineCourses,https://www.reddit.com/r/onlinecourses/comments/1nuayvp/need_suggestions_best_online_course_platform_with/,u/Key_Recognition4437,Need suggestions: Best Online Course Platform with Migration Support,"I’ve got 20+ courses hosted on a popular platform, but they just bumped up their pricing almost 3X. That’s way too much for me to handle, so I’m planning to switch.  Thing is, I don’t really want to go through the hassle of moving all my courses, videos, and student data manually. Do you know any co",,2,1759232800,,,,OnlineCourses
reddit,OnlineCourses,https://www.reddit.com/r/onlinecourses/comments/1ntdsw7/best_platforms_to_sell_online_courses_digital/,u/Ashamed-Nectarine-84,Best Platforms to Sell Online Courses & Digital Downloads?,"I'm looking to launch an online course and also sell digital downloads like templates, guides, and eBooks. I need a platform that's:   * Easy to set up  * Supports both courses and digital products * Handles payments and delivery seamlessly * Offers no transaction fees or low fees  I've come across ",,8,1759139377,,,,OnlineCourses
reddit,SelfImprovement,https://www.reddit.com/r/selfimprovement/comments/1o15267/psa_parts_therapy_helped_me_see_why_i_wasnt/,u/JAG_Ryan,PSA Parts Therapy helped me see why I wasn’t achieving goals,"Almost a year ago I did a parts therapy (Internal Family Systems) session with a hypnotherapist because, mid 40’s, I was desperate to actually start accomplishing goals in life. The therapist said the session would be successful if we got all my parts to agree to work together as a supportive team. ",,2,1759912801,,,,SelfImprovement
reddit,SelfImprovement,https://www.reddit.com/r/selfimprovement/comments/1nz1z5y/is_37_too_late/,u/Only_Nothing9585,Is 37 too late?,"I'm about to turn 37 and I have completely wasted my life. I never had a goal, I've never gone travelling, never had a relationship and lack many things I thought I would have by now. I work part time and live in a shared house. For many years I had depression, mostly because of fake friends and lon",,919,1759702913,,,,SelfImprovement
reddit,SelfImprovement,https://www.reddit.com/r/selfimprovement/comments/1nvza6k/23_and_dont_know_what_to_do_with_my_life/,u/Expert-Recipe1713,"23, and don’t know what to do with my life","Hey guys, I’m a male and live in Miami, fl. I went to school for IT and got an associates hoping for a remote job and it never happened. I took google’s UX design course and built a portfolio of projects, yet never landed a remote UX design job. I really don’t want to work in help desk on site for 2",,9,1759397980,,,,SelfImprovement
reddit,Productivity,https://www.reddit.com/r/productivity/comments/1nz5nde/productivity_help_for_an_overwhelmed_manager_in_a/,u/covert777,Productivity help for an overwhelmed manager in a reactionary/incident driven role,"I'm a manager in an IT department where I oversee multiple teams of support techs who work onsite at various company locations. I'd say that about 2/3 of my job is reacting to support situations and the remaining 3rd is working on ""planned"" tasks/projects. It's just the nature of the gig where my te",,2,1759712997,,,,Productivity
reddit,Wordpress,https://www.reddit.com/r/Wordpress/comments/1o094i5/how_to_optimize_my_wordpress_site_for_performance/,u/Khan8213,How to optimize my wordpress site for performance especially LCP FCP,Good day redditors   I'll try to be a bit detailed and specifics so any good eyes can read the pain I'm going through   I had a wix site to begin with but due to too many issues when it came to performance and not much in hand to be able to almost do anything to fix after 3 years i finally decided t,,15,1759825878,,,,Wordpress
reddit,Wordpress,https://www.reddit.com/r/Wordpress/comments/1o0i8mi/i_built_a_wordpress_plugin_to_block_ai_scrapers/,u/AntiqueStrawberry236,I built a WordPress plugin to block AI scrapers and automatically license your site' content for ChatGPT — feedback welcome,"Following up from my post a couple months ago — I’ve finally launched Copyrightish, a b2b content licensing platform with a robust WP plugin that lets WordPress publishers *control* and *monetize* AI access to their content.   Keep in mind I'm a full stack engineer, not a marketer or dedicated plugi",,13,1759851521,https://wordpress.org/plugins/copyright-sh-ai-license/,,,Copyright.sh – AI License – WordPress plugin | WordPress.org
reddit,Skool,https://www.reddit.com/r/SKOOL/comments/1nzd1b7/heartbroken_by_what_skool_has_become_my/,u/Jay_D88,Heartbroken by What Skool Has Become — My Experience with Fake Courses and Zero Support,"I used to really love **Skool** — it felt like a place where people could learn, share, and grow together. But now, it honestly feels like it’s becoming a **shortcut for scammers** to make quick money off unsuspecting members.  Customer support has been a huge disappointment. It’s slow, unhelpful, a",,3,1759737475,,,,Skool
youtube,"Beau Eckstein, Business Ownership Coach",https://www.youtube.com/watch?v=19J2boMQJxY,"Beau Eckstein, Business Ownership Coach",Why Franchising Is the Easiest Path from W-2 to Entrepreneur,"Why Franchising Is the Easiest Path from W-2 to Entrepreneur  Franchising gives W2 employees the proven playbook to transition into business ownership with less risk. 🚀 With coaching, systems, and built-in support, it’s the smartest path to freedom and wealth.  Book a call - http://bookwithbeau.com/",mindset,15500,1759950001,http://bookwithbeau.com/,,,"Beau Eckstein | Business Advisor specializing in SBA Financing, Franchise Discovery, & Expense Reduction Strategies"
youtube,Daniel Priestley,https://www.youtube.com/watch?v=WiTIgjYxWbE,Daniel Priestley,"I’ve Mentored 1,000 Millionaires - Here’s My Playbook","People pay me $10,000 to teach them what I know about business and entrepreneurship. I've taught them 1:1 or through my entrepreneur accelerator (Dent).  In this video, I'm going to give you that same advice completely FREE. Nothing held back. This is my playbook on how to get rich and we're going t",entrepreneurship,51100,1759660549,,,,Daniel Priestley
youtube,The Koerner Office Business Ideas,https://www.youtube.com/watch?v=UciTrnSr8pA,The Koerner Office Business Ideas,The Playbook Rich Entrepreneurs Don’t Talk About,🎙️ Into full episodes and deeper business breakdowns? Check out our main channel for the podcast and longform content: ​⁠@thekoerneroffice ​⁠ ​⁠ ​⁠ ​⁠​⁠ ​⁠ ​⁠ ​⁠​⁠ ​⁠ ​⁠ ​⁠​⁠  ​⁠ ​⁠ ​⁠ ​⁠ ​⁠​⁠ ​⁠​⁠ ​⁠ ​⁠ ​⁠ ​⁠ ​⁠ ​⁠ ​⁠ ​⁠   ​⁠ 👉 Learn more unique business ideas and side hustles today! Get the detail,eta,80000,1759616664,,,,The Koerner Office Business Ideas
youtube,OpenAI,https://www.youtube.com/watch?v=hS1YqcewH0c,OpenAI,OpenAI DevDay 2025: Opening Keynote with Sam Altman,"Sam Altman kicks off DevDay 2025 with a keynote to explore ideas that will challenge how you think about building. Join us for announcements, live demos, and a vision of how developers are reshaping the future with AI.",keynote,1830000,1759775224,,,,OpenAI
youtube,Micha Gruber,https://www.youtube.com/watch?v=lIGLp0uz46E,Micha Gruber,📲 Apple Keynote Tutorial iPad (Deutsch) - für Einsteiger & Umsteiger 🚀,⬇️📎 Lade dir das ausführliche PDF-Tutorial von meiner Patreon Seite herunter: https://www.patreon.com/posts/apple-keynote-so-139619176  📖🎓 Interesse an einer Fortbildung zum Themenbereich digitalen Arbeiten im Apple-Ökosystem? ➡️ Schreib mir via Mail: info@AMP-Artworks.de   In diesem Video zeige ich,keynote,28000,1758967274,,,,Micha Gruber
youtube,Odoo,https://www.youtube.com/watch?v=mifDzUGDMos,Odoo,Keynote - Master Class: Hyperscale & Company Culture,Try Odoo online at https://www.odoo.com/r/xGhi,keynote,282000,1758399042,https://www.odoo.com/r/xGhi,,,Open Source ERP and CRM | Odoo
youtube,Charles Botensten,https://www.youtube.com/watch?v=EOYH6nagGgo,Charles Botensten,Challenge Yourself: Accountability is the Path to Greatness #shorts,"It's time to self-impose challenges: no drinking, no drugs, no gossiping, no lying. Have a backbone. This is a call to greatness and accountability. Get your money and body right. Get back into shape. #challenge #accountability #greatness #discipline #selfimprovement",accountability,10200,1759161529,,,,Charles Botensten
youtube,Judith Glory,https://www.youtube.com/watch?v=LeaBxHT81DQ,Judith Glory,Resilience Bootcamp: Build a Thriving Coaching Business Together! #shorts,"Build a resilient business with the right systems and habits. Join the bootcamp for consistency, growth, accountability, and support. Launch your next coaching course or program with a supportive community. #businessgrowth #resilience #accountability #coaching #community",habits,59300,1759244578,,,,Judith Glory
youtube,Judith Glory,https://www.youtube.com/watch?v=6-jmh2aqBck,Judith Glory,Unlock Business Growth: Action & Implementation Bootcamp! #shorts,"More content doesn't solve business struggles. Action and implementation drive results. Discover how a supportive environment keeps one accountable and moving forward, creating value and a thriving business. #businessgrowth #accountability #implementation #action #successmindset",mindset,59300,1759129242,,,,Judith Glory
youtube,Judith Glory,https://www.youtube.com/watch?v=oujMaXi_jaU,Judith Glory,Launch Your Coaching Income Stream in 90 Days! #shorts,"Imagine launching a new income stream for a coaching business in just 90 days. This bootcamp offers structure and accountability, eliminating guesswork. Participants receive a clear plan and support to achieve their goals. Check the link to express interest. #coachingbusiness #incomestream #bootcamp",accountability,59300,1759114548,,,,Judith Glory
