platform,subreddit,url,author_handle,title,excerpt,evidence_quote,score,created_utc,website,contact_url,email,company
youtube,The Review Radar,https://www.youtube.com/watch?v=m0jD4OEaKlg,The Review Radar,"Discover AI Tools For Productivity To Simplify B2B Sales, See These?",AI Tools For Productivity | B2B Lead Generation | Lead Generation Software ✅ Explee Official:  https://linktr.ee/Explee1  🎬Watch our most recent videos:   https://www.youtube.com/watch?v=iqfZFVBO6qU   https://www.youtube.com/watch?v=a0vbyRNo7Bg    Looking for the best AI tools for productivity to bo,strategy,14200,1759755623,https://linktr.ee/Explee1,,asxvmprobertest@gmail.com,Explee | Linktree
youtube,Tech Sales With Higher Levels,https://www.youtube.com/watch?v=7mgvXUcuBa4,Tech Sales With Higher Levels,AI for Tech Sales Use Case Saving 10+ Hours a Week #techsales #aiforsales #ai,▶Take our free tech sales course: https://www.higherlevels.com/free-training?via=youtube ▶Break Into Tech Sales in 6 Weeks: https://www.higherlevels.com/ascension?via=youtube ---For Sales Reps ▶Become a top 0.1% cold caller: https://www.higherlevels.com/cold-call-mastery?via=youtube ▶Master Cold Ema,b2b sales,33600,1759754087,https://www.higherlevels.com/free-training?via=youtube,,team@higherlevels.com,Free Training
youtube,AI Outcomes Podcast & B2B Sales Advice,https://www.youtube.com/watch?v=PtshHqdjKxs,AI Outcomes Podcast & B2B Sales Advice,Ep27: 4–Steps to Engage Customers on AI Transformation (B2B Sales Guide),"In this episode of the AI Outcomes Podcast, we dive into Part 2 of our special series on how B2B sellers, consultants, and pre-sales professionals can effectively engage customers around AI adoption. If you missed Part 1, make sure to check it out first—it lays the foundation by showing why AI is no",strategy,30400,1758615287,,,,AI Outcomes Podcast & B2B Sales Advice
youtube,Vlad Kachur,https://www.youtube.com/watch?v=7imPnup4Df8,Vlad Kachur,How to Increase B2B Sales with AI: Full Review of Alta AI Revenue Workforce,"Sign up for this great AI revenue workforce platform: https://www.altahq.com/?utm_campaign=Influencers&utm_source=VladKachur  In this video, we give you a full review of Alta AI revenue workforce - a platform built to help B2B companies close more deals, boost pipeline, and scale revenue faster.  Al",strategy,901000,1758556366,https://www.altahq.com/?utm_campaign=Influencers&utm_source=VladKachur,,info@altahq.com,Alta's AI Sales and Revenue Workforce: Data-Driven Growth with Intelligent Automation
youtube,Sales Scripter,https://www.youtube.com/watch?v=iJzR-CY2IWw,Sales Scripter,Working in B2B Sales is Like Playing a Game,"Working in sales is like playing a game. It might not feel like that because some of the tasks aren't real fun, but it definitely is a game with winning, losing, rewards, etc. Making selling feel more like a game can help boost motivation and make it more fun.  We explain how ot do that in the full ",b2b sales,30000,1758449037,,,,Sales Scripter
youtube,Sales Scripter,https://www.youtube.com/watch?v=0OIMZvtIIx8,Sales Scripter,Sell more by selling the conversation in B2B sales,"When we first talk with a prospect, the best thing to close for is for talking more and having a longer conversation. The best way to make that close easier it by finding a reason to talk more. And the best way to find a reason to talk more is by asking good questions that uncover challenges or area",b2b sales,30000,1757927928,,,,Sales Scripter
youtube,Hpm India,https://www.youtube.com/watch?v=_Vtxhuu-Pmo,Hpm India,🔧 Precision in Every Weld,"Our engineering workshop is actively engaged in new SS pipeline welding work, ensuring top-quality joints with advanced techniques. Each weld is carried out with precision, safety, and durability in mind. This upgrade strengthens our infrastructure and boosts efficiency for upcoming operations. With",operations,13100,1759223633,,,,Hpm India
youtube,GRH channel,https://www.youtube.com/watch?v=IDaxlaQhN24,GRH channel,Where gold is found in mountains,"Gold prospecting in the mountains 🏔️ is one of the most common types of prospecting  around the world because mountains often contain rocks rich in precious metals, especially gold found inside quartz veins or in old metamorphic rocks. Here’s a simple and detailed explanation of the mountain prospec",operations,49600,1759862985,,,,GRH channel
youtube,Arsenio Gold Hunting,https://www.youtube.com/watch?v=fbKYA1ipV4U,Arsenio Gold Hunting,The process of prospecting for gold and practical and young methods of finding gold #goldmining,The process of prospecting for gold and practical and young methods of finding gold #goldmining,prospecting,218000,1759226482,,,,Arsenio Gold Hunting
youtube,GRH channel,https://www.youtube.com/watch?v=HYPPxj2V1Gg,GRH channel,Simple Method to Detect Palladium,Simple Method to Detect Palladium  Materials Needed: • Nitric acid (HNO3) • Hydrochloric acid (HCl) • Aqua regia (1 part nitric acid + 3 parts hydrochloric acid) • Stannous chloride solution (SnCl2 dissolved in a little warm HCl) • Dimethylglyoxime (DMG) • Hot water • Clean test tube  Test 1 (Using ,operations,49600,1758317011,,,,GRH channel
youtube,Huyen Gold Miner,https://www.youtube.com/watch?v=-hDTTRgtRDo,Huyen Gold Miner,"BIG GOLD ORE EP-56 , Billions Don’t Know This Gold Prospecting Method!","In this 24-minute video, we take you to a barren volcanic hillside where gold may still be hidden.  Before digging, we show you how to read the land and recognize geological signs that indicate gold deposits – a method billions of people have never seen.  Using dowsing rods and a metal detector, we ",prospecting,12600,1757925901,,,,Huyen Gold Miner
youtube,Saeed Ahmed Motivational Speaker,https://www.youtube.com/watch?v=PqdyCisbQKw,Saeed Ahmed Motivational Speaker,PM Shri Zilla Parishad Urdu School #saeed,"If you're looking to enhance your personal and professional growth, attending a personality development workshop or self improvement workshop can be a great starting point. Many people find that self development workshops and self improvement workshops near me offer practical tools for building conf",goal setting,21000,1759215901,,,,Saeed Ahmed Motivational Speaker
youtube,Saeed Ahmed Motivational Speaker,https://www.youtube.com/watch?v=MaToKt4YzYc,Saeed Ahmed Motivational Speaker,"Workshop at Anjuman Islam Mumbai’s Peer Mohammed High School, Pune","If you're looking to enhance your personal and professional growth, attending a personality development workshop or self improvement workshop can be a great starting point. Many people find that self development workshops and self improvement workshops near me offer practical tools for building conf",goal setting,21000,1759129500,,,,Saeed Ahmed Motivational Speaker
youtube,Alexis aka MissTrenchcoat,https://www.youtube.com/watch?v=QUnZCrWmlu8,Alexis aka MissTrenchcoat,🔴 Q4 CRESCENDO WORKSHOP | Q4 Planning + Prep,💫 Join the Charmed Life Master Mind – Q4 Promo Get $111 OFF the Annual Membership + FREE 2026 Master Planner System 👉 https://www.strangecharmed.com/masterplan/join-the-charmed-life-master-mind-lto/  📓 Download Your FREE Q4 Crescendo Workbook Follow along with today’s class and plan your most produc,mindset,94700,1757831077,,,,Alexis aka MissTrenchcoat
youtube,Vidhigya CLAT Coaching ,https://www.youtube.com/watch?v=ymPIxXlwOfg,Vidhigya CLAT Coaching ,🔥CLAT Challenger Boot Camp Day 2 | English Language Strategy & Practice | Aditi Ma'am,📌 Day 2 of CLAT Challenger Boot Camp is here! Today’s focus: English Language 🧠📚 Speed and accuracy are game-changers in English section — and this session will help you level up both.  🎯 What You’ll Learn:  Effective reading strategies for CLAT passages  How to manage time during English section  S,strategy,29000,1759890605,,,,Vidhigya CLAT Coaching 
youtube,TJR,https://www.youtube.com/watch?v=8QDDxwUV1KM,TJR,"How I Made $1,047,984 In 6 Months Of Day Trading (Strategy Revealed)",Join The Mentorship: http://tjrtrades.com/blueprint?el=yt1005  Best Trading Journal: https://tradezella.com?fpr=tjr  Get my free course: https://lp.tjrtrades.com/free-course?el=yt-video  Buy a Futures Funded Here: code TJR https://app.alpha-futures.com/signup/TJR/  Buy a Forex Funded Here: code TJR ,strategy,1000000,1759767508,http://tjrtrades.com/blueprint?el=yt1005,https://tradezella.com/contact-us,partnerships@tradezella.com,The Blueprint
youtube,Sunya IAS,https://www.youtube.com/watch?v=hAD6UTBTfFk,Sunya IAS,PRELIMS BOOTCAMP BATCH | Unique Strategy | ONLY 500 Seats | PRELIMS 2026 | Sunya IAS,"For Query, Call or Whatsapp 8383950315   Prelims Bootcamp Batch 2026: https://www.sunyaias.com/subscription-details/prelims-bootcamp-batch  SAMBHAV 2026: https://sunyaias.com/subscription-details/sambhav-2026  Prelims Revision Program (PRP) 2026: https://www.sunyaias.com/subscription-details/prelims",strategy,132000,1759764733,https://www.sunyaias.com/subscription-details/prelims-bootcamp-batch,,,SunyaIAS - Subscription Details
youtube,Judith Glory,https://www.youtube.com/watch?v=t5ReiXx8vYU,Judith Glory,Grow Your Coaching Business: Bootcamp Strategies & Systems #shorts,"Boot camp isn't passive; it's about actively building. Learn new strategies, systems, and ways to grow a coaching business through action and quarterly launches. It is designed to help you launch something every three months. #coachingbusiness #businessgrowth #bootcamp #strategy",strategy,59300,1759388085,,,,Judith Glory
youtube,MOGUL Elite Club,https://www.youtube.com/watch?v=JhtO5l7g2jI,MOGUL Elite Club,Family Legacy Building Bootcamp – Mailbox Millionaire Banking,"Wealth is not built by accident; it’s built by strategy. And today, we’re unlocking one of the most powerful strategies out there: Mailbox Millionaire Banking. 🚀  This session is all about: ✅ How to put your money to work instead of working for money ✅ The system wealthy families use to keep cash fl",strategy,14500,1759243145,,,,MOGUL Elite Club
youtube,Judith Glory,https://www.youtube.com/watch?v=h4tODhdlz9s,Judith Glory,Coaching Pricing Secrets: Confidently Charge What You're Worth! #shorts,"Many coaches struggle with pricing their services. The bootcamp offers insights into how others confidently charge for their value, potentially inspiring you to resolve pricing issues in your coaching business. Join via the link below! #coachingbusiness #pricingstrategy #businessbootcamp #coachingse",strategy,59300,1759229976,,,,Judith Glory
youtube,Mohd Abdullah,https://www.youtube.com/watch?v=o7ipHCkXgY0,Mohd Abdullah,"""Confidence Building Workshop | India Tour 2025 | Manipur""","Welcome to Our YouTube Channel!  Your ultimate destination for life motivational videos, English concepts, and English speaking tips. Whether you're looking to gain confidence, improve communication skills, or understand key English language principles, we’re here to help. Every video is crafted to ",public speaking,44300,1759838890,,,,Mohd Abdullah
youtube,New York Stock Exchange,https://www.youtube.com/watch?v=_nOO0N8xM7k,New York Stock Exchange,Service Academy Women Rings The Closing Bell®,"The New York Stock Exchange welcomes Service Academy Women to the podium to commemorate the 50th anniversary of President Gerald Ford signing the law requiring our nation's service academies to admit women. To honor the occasion, Dorian Price, West Point Class of 1999, and Gretchen Cook, United Stat",closing,47300,1759867390,,,,New York Stock Exchange
youtube,IACE - Best Institute For Competitive Exams,https://www.youtube.com/watch?v=rKNfYG-dPK8,IACE - Best Institute For Competitive Exams,SBI&IBPS CLERK RIP (REAL INTENSIVE PROGRAM) Closing Day | Vizag IACE,"#iace #IACE #indianacademyofcompetitiveexams   Just one click away to secure your Dream Govt. Job:  https://forms.gle/1dxd3RjKKNibrxbZ6  For Direct Admissions, call us @ 9533 200 400  SBI&IBPS CLERK RIP (REAL INTENSIVE PROGRAM) Closing Day | Vizag IACE  IACE - Indian Academy Of Competitive Exams is ",closing,392000,1759379429,https://forms.gle/1dxd3RjKKNibrxbZ6,,,NEW ADMISSION FORM @ IACE
youtube,IACE - Best Institute For Competitive Exams,https://www.youtube.com/watch?v=C7BcRykodyQ,IACE - Best Institute For Competitive Exams,SBI&IBPS CLERK RIP (REAL INTENSIVE PROGRAM) Closing Day | Anantapur IACE,"#iace #IACE #indianacademyofcompetitiveexams   Just one click away to secure your Dream Govt. Job:  https://forms.gle/1dxd3RjKKNibrxbZ6  For Direct Admissions, call us @ 9533 200 400  SBI&IBPS CLERK RIP (REAL INTENSIVE PROGRAM) Closing Day | Anantapur IACE  IACE - Indian Academy Of Competitive Exams",closing,392000,1759293008,https://forms.gle/1dxd3RjKKNibrxbZ6,,,NEW ADMISSION FORM @ IACE
youtube,Aaron Martinez - Remote Closing Academy,https://www.youtube.com/watch?v=ahuk9jm85GU,Aaron Martinez - Remote Closing Academy,The ONLY Remote Closing Script to Make $10K/Month,Step-by-Step Training On How To Get Started With Remote Closing/Appointment Setting:  👉 https://bit.ly/RemoteClosingTrainingYT  Subscribe to the channel and turn notifications on👇👇👇 https://bit.ly/RCAsubscribe  See more reviews for Remote Closing Academy here: https://theremoteclosingacademy.com/rem,closing,42900,1758906977,https://bit.ly/RCAsubscribe,,,Aaron Martinez - Remote Closing Academy - YouTube
youtube,WRAL,https://www.youtube.com/watch?v=d9BMjoy-pFE,WRAL,"Granville Academy closing over mold issues, students relocated",The maintenance director at Granville County Schools says a mold issue forcing a school to close was preventable for years.,closing,350000,1758808607,,,,WRAL
youtube,DieselHead,https://www.youtube.com/watch?v=vH6DhoaGdik,DieselHead,Tristan Academy Closing Soon 🚨 Don’t Miss Out!,Tristan Academy gives you everything in one place: ✅ Learn high-income skills ✅ Get international clients ✅ Accept payments in crypto ✅ Use AI automation to scale your business  But the doors are closing soon ⏳. Don’t wait until it’s too late.  🚀 Secure your spot today and start growing your busines,closing,11800,1758720665,,,,DieselHead
youtube,Michigan Academy,https://www.youtube.com/watch?v=buPlpoJjl1k,Michigan Academy,Comment apprendre le closing avec la Michigan Academy!! 😌🙌🏻📈,,closing,14400,1758639332,,,,Michigan Academy
youtube,NASKAR ACADEMY,https://www.youtube.com/watch?v=21SmqGPKw0g,NASKAR ACADEMY,প্রবল ভারী বর্ষণে দুই দিন ছুটি ঘোষণা// wb school college Closing for heavy rainfall,পর পর দুই দিন ছুটি ঘোষণা// অতি ভারী বর্ষণের জন্য ছুটি ঘোষণা// সরকারি স্কুলগুলির ছুটি ঘোষণা// প্রবল বর্ষণের কারণে স্কুল কলেজ ছুটি// wb school college Closing 2025// special leave for heavy rainfall// today's leave for heavy rainfall// naskar academy,closing,40100,1758615558,,,,NASKAR ACADEMY
youtube,Edu9 Career Guidance,https://www.youtube.com/watch?v=x1dBC6f060E,Edu9 Career Guidance,Is Kurnool Medical College's MBBS Program RIGHT for You,"Is Kurnool Medical College's MBBS Program RIGHT for You  Kurnool Medical College (KMC), Kurnool, is one of the oldest and most reputed government medical colleges in Andhra Pradesh, offering MBBS, MD, MS, and other medical programs. Known for its academic excellence and advanced clinical training, t",closing,287000,1758549697,,,,Edu9 Career Guidance
youtube,RGR Academy,https://www.youtube.com/watch?v=dh81ZD8bou4,RGR Academy,IISER Admissions 2025: Closing Ranks & Seat Updates for All Campuses!,"🚀 IISER Admissions 2025 is here! Check closing ranks & seat updates for all IISER campuses including Berhampur, Bhopal, Kolkata, Mohali, Pune, Tirupati, and Thiruvananthapuram.  🎯 Programs Covered:  BS-MS, B.Tech., Economic Sciences & Data Sciences programs  📌 Stay updated for round-wise closing ran",strategy,28300,1758354467,,,,RGR Academy
youtube,DieselHead,https://www.youtube.com/watch?v=Cs1zGbRI_uc,DieselHead,Tristan’s Academy Shutting Down! Last Chance to Join with Crypto 🚨,"🚨 Tristan Academy is finally shutting down very soon Drew had already announced this earlier, The 49 dollar earn plan is already showing sold out for card payments but crypto payment method is still working  Nobody knows how long it will last Secure your spot before the doors close forever  🔥 Do not",eta,11800,1758202213,,,,DieselHead
youtube,Mizpah Career Academy,https://www.youtube.com/watch?v=hQ3SYBcRH-Y,Mizpah Career Academy,AIQ Round 2 Results - Cut Off Marks Reduced - Round 2 Closing Marks of Govt and Deemed Universities,AIQ Round 2 Results - Cut Off Marks Reduced - Round 2 Closing Marks of Govt and Deemed Universities - 1st Year MBBS Starts from Sept 30 - Tamil Nadu Medical Colleges Classes Starting Date 2025 - College Opening Date for Tamil Nadu Govt and Private Medical Colleges - Foundation Course for 1st Year MB,strategy,120000,1758099721,,,,Mizpah Career Academy
youtube,Michigan Academy,https://www.youtube.com/watch?v=jbhe_kR6OCI,Michigan Academy,Comment gagner de l’argent en 2026 grâce au closing (Méthode complète),"En 2026, le closing reste l’une des compétences les plus puissantes pour gagner de l’argent en ligne. 🚀  Dans cette vidéo, je t’explique :  • Pourquoi le closing est une opportunité en pleine croissance  • Comment débuter sans expérience ni capital  • Les étapes pour trouver tes premiers clients en ",closing,14400,1758077754,,,,Michigan Academy
youtube,Ivan Hug,https://www.youtube.com/watch?v=FSv1OHU5RH0,Ivan Hug,Your brain isn't broken. Your energy system is. Here's the fix 🎯,"Energy management is the missing piece in productivity. After 30+ years in Fortune 500, I discovered why productivity tools drain knowledge workers. Stanford-MIT research tracking 2,400 professionals proves: more productivity apps = lower actual productivity.  In this video, you'll discover: ✅ Why r",mindset,55200,1759831231,,,,Ivan Hug
youtube,Arian Samouie,https://www.youtube.com/watch?v=KhoyiNn3uhU,Arian Samouie,Regulate Your Nervous System FAST with This One Trick,"Experiencing that ""feeling stuck"" sensation? This video explores practical approaches to ""nervous system regulation"", helping you move forward. Shifting your ""mindset"" is key for ""personal growth"", and learning ""stress management"" techniques can reduce ""anxiety"" and foster ""self improvement"".",mindset,11800,1759415329,,,,Arian Samouie
youtube,Gautam Speaks Now,https://www.youtube.com/watch?v=T_VaAXEE0kU,Gautam Speaks Now,Why 90% People Fail in Self-Growth | Secret of Consistency,"Har koi self-growth shuru karta hai full energy ke saath, lekin 90% log fail ho jaate hain.   Reason simple hai – unke paas system nahi hota. Motivation short-term hoti hai, action 2 din hota hai, phir drop.   Lekin asli growth consistency aur logical execution se aati hai. Agar tumhare paas clear p",mindset,38200,1759108056,,,,Gautam Speaks Now
youtube,D2D Experts,https://www.youtube.com/watch?v=0E7xdzrHdCQ,D2D Experts,From Chaos to Consistency: The Recruiting Systems Every Sales Leader Needs,"Why pick 2 when you could have all 6 tho… 👀   That’s exactly what we cover at the D2D Recruiting Bootcamp... the playbook for sales leaders who want: ✅ A repeatable recruiting pipeline ✅ Reps who actually stick ✅ Systems that optimize your time   📆 Happening October 16-17, 2025 🔗 Link in bio to lock",mindset,43900,1758821424,,,,D2D Experts
youtube,Ryan Blair ,https://www.youtube.com/watch?v=oEdMEWmEBHk,Ryan Blair ,"Consistent sales come from a clear, proven system. #businessadvice #growthmindset","Consistent sales come from a clear, proven system. #businessadvice #growthmindset",mindset,12000,1758726089,,,,Ryan Blair 
youtube,"Anthony Chaine, A Sales Leader",https://www.youtube.com/watch?v=V4Wie_jpYv8,"Anthony Chaine, A Sales Leader",AI Workforce: Maintaining Culture with Systems Leadership #shorts,"Maintaining culture with an AI workforce requires a shift. It's about proof-in-systems leadership, not butts-in-seats management. Publish the AI playbook, celebrate judgment calls, and customer saves. #AIWorkforce #Leadership #AISystems #FutureofWork",leadership,136000,1757706936,,,,"Anthony Chaine, A Sales Leader"
youtube,I Am April Showers,https://www.youtube.com/watch?v=WqWzA2cnwUA,I Am April Showers,Building the Next Generation of Entrepreneurs 🦄 | Ms. April’s Crown & Bookstore Cohort #shorts,"Afro Unicorn® is more than a brand — it’s a movement and a platform to inspire and mentor the next generation of entrepreneurs. 🤎✨  Through my program, Ms. April’s Crown & Bookstore Cohort, I’m helping young dreamers turn their ideas into action. These incredible kids are learning the foundations of",personal development,22000,1760126431,,,,I Am April Showers
youtube,incubez,https://www.youtube.com/watch?v=KSgcL6781O4,incubez,Draper Startup House Cohort 1 Learnings from Founders Part1,"10 days, 15 passionate founders, endless learning. From tackling challenges to discovering new ways to grow, the Draper Startup House Cohort gave founders a unique experience—an environment where ideas flowed, challenges were tackled head-on, and collaboration never stopped.   Hear them share the mo",entrepreneurship,10900,1758788975,,,,incubez
youtube,"Unacademy GATE - ME, PI, XE",https://www.youtube.com/watch?v=rsyDywfn0qY,"Unacademy GATE - ME, PI, XE",Big Dreams Need Micro-Deadlines! Start NOW! ⏳💯  #gate2026  #negisir #dreambig,Big goals can feel overwhelming — break them into 3-day targets. Stick your end goal on the wall and chase it step by step. That’s how real progress happens! 🎯🔥 #GATEPreparation #MiniGoalsBigWins   🎯Start GATE Prep With Flat 60% OFF Kickstart Your GATE Prep with NEGI10 !  📚 Plans starting at just ₹6,mindset,226000,1760183872,,,,"Unacademy GATE - ME, PI, XE"
youtube,Judith Glory,https://www.youtube.com/watch?v=wNc-AEmXlrQ,Judith Glory,3 Steps to 10x Your Results: The A.C.E. Goal-Setting Framework,"Learn the ACE Framework (Alignment, Concentration, Evolution): the proven 90-day system that helps entrepreneurs and leaders stop confusing activity with results. Finally conquer overwhelm and achieve your Breakthrough Goal.  The ACE Framework is your strategic blueprint for business growth. It shif",leadership,59300,1759776997,,,,Judith Glory
youtube,upGrad,https://www.youtube.com/watch?v=Z-GWB6P7N4c,upGrad,Why I Chose Duke’s Product Management Course While Working at Intel: The Real ROI of Education,*Why I Chose Duke’s Product Management Course While Working at Intel: The Real ROI of Education* The discussion opens with a question about the motivation behind pursuing a post-graduate product management course at Duke University while working at Intel. The speaker emphasizes that comfort is the e,personal development,236000,1759493028,,,,upGrad
youtube,Make Math Moments,https://www.youtube.com/watch?v=vbP4CrG-uUc,Make Math Moments,From B+ to A+: How to Turn School Goals Into Actual Instructional Change,"""📈 “Most schools stop at ‘setting goals’—the leap to level 4 is when goals drive decisions.”  @mrjorr breaks down the school improvement ladder:  🎯 Level 3 (B+ Work): → Goals are realistic & aligned → Progress is measured periodically → Example: “70% of PLC time dedicated to math”  🚀 Level 4 (A+ Wor",leadership,10100,1759491049,,,,Make Math Moments
youtube,Rekha The Tarot Queen,https://www.youtube.com/watch?v=PUqcHldo2SU,Rekha The Tarot Queen,60 Days சேலஞ்ச் 2026 புத்தாண்டு எண்ணுவெதல்லாம் உயர்வு ! | Rekha The Tarot Queen #19751 #2026 #tarot,"60 Days New Year Challenge Boost Your Confidence A Powerful Affirmation to Start your New Year 2026  Start your New Year 2026 with strength and self-belief! 💫 Join the 60 Days New Year Challenge — a journey to boost your confidence, attract success, and prepare your mind for greatness. 🌈  Subscribe ",mindset,12700,1759993519,,,,Rekha The Tarot Queen
youtube,Classmate Abhay,https://www.youtube.com/watch?v=wJcs92ZIfls,Classmate Abhay,1 Hour Focus Challenge – Kya mai kar paunga? #shorts,"1 Hour Focus Challenge – Kya mai kar paunga?   day 9/90  Time Optimization, Time Management, Task Prioritization, Personal Development, Life Hacks, Productivity Tips, Stress Management, Time Blocking, Mindfulness, Study Techniques, Motivation Tips, Self Improvement, motivational video, Focus Techniq",mindset,24500,1759911937,,,,Classmate Abhay
youtube,Walter Bond,https://www.youtube.com/watch?v=cn74ZBqg4hU,Walter Bond,"The coach is the SHARK, the players are the SUCKERFISH","Take a look at your life: who is your shark right now? Who is mentoring YOU?   But here’s a better question: who are YOU mentoring??  It’s ok to be a shark, it’s ok to be a suckerfish. But don’t EVER be a parasite.  🦈 SharkMindset.com 🔥 PeakPerformersHuddle.com  #SharkMindset #PeakPerformers #Leader",mindset,23400,1759406472,,,,Walter Bond
youtube,The Ashley Nicole Show,https://www.youtube.com/watch?v=x239lqcFneM,The Ashley Nicole Show,Build Wealth with a Sales System! 💰 #shorts #salesgrowth,"You don’t just need a talk — you need a sales system. 🙌  Because here’s the thing: if you want to build legacy, wealth, a team, and real impact, you can’t wing it. Speaking isn’t just about inspiration — it’s a revenue stream and a powerful marketing tool that fuels your entire business. Books, cons",mindset,15700,1758193440,,,,The Ashley Nicole Show
