platform,subreddit,url,author_handle,title,excerpt,evidence_quote,score,created_utc,website,contact_url,email,company
youtube,The Ashley Nicole Show,https://www.youtube.com/watch?v=0secJQh08uU,The Ashley Nicole Show,Build a 3-Branch Business Like a Pro! #shorts #entrepreneur,"What you’re seeing isn’t random—it’s an ecosystem. 🌱  Three branches working together: the firm, the consulting/coaching, and the speaking.  It’s not about doing it all, it’s about building it streamlined and strategic so every piece fuels the other. That’s how you create something sustainable that ",strategy,15700,1758070919,,,,The Ashley Nicole Show
youtube,Ganemo,https://www.youtube.com/watch?v=GNex_QWWchc,Ganemo,Masterclass de Hiper Crecimiento y CULTURA | Keynote Odoo 19 FT Fabian Pinckaers CEO Odoo,"🎤 Descubre en esta masterclass exclusiva cómo escalar una empresa tecnológica de manera sostenible, basada en más de 20 años de experiencia llevando a Odoo desde una pequeña startup hasta convertirse en una compañía global con más de 6,500 empleados y una valoración multimillonaria.  🚀 En esta prese",keynote,22900,1759428261,,,,Ganemo
youtube,Green Valley Farm,https://www.youtube.com/watch?v=WkRs8L5eBS0,Green Valley Farm,Efficient and labor-saving concrete wall cutting method #automobile #bamboo1 #farmingtraditions,"High-frequency cutting machines are characterized by high efficiency, good quality, and labor-saving in cutting concrete walls. High-frequency cutting machines use diamond saw blades to operate at high frequency, which can quickly cut through concrete structures. Compared with traditional hammer chi",operations,66700,1760012666,,,,Green Valley Farm
youtube,vlogize,https://www.youtube.com/watch?v=LrKVxoa5qVk,vlogize,Understanding Batch Operations in Spring Boot's JpaRepository: Fixing the saveAll Method Issue,Discover why batch operations don't work with JpaRepository's `saveAll` method in Spring Boot and learn how to solve it by switching to sequence generation. --- This video is based on the question https://stackoverflow.com/q/63831206/ asked by the user 'yazabara' ( https://stackoverflow.com/u/228002,strategy,13400,1759658689,https://stackoverflow.com/q/63831206/,https://stackoverflow.com/q/63831206/contact,apple-touch-icon@2.png,postgresql - Spring Boot Appllication. Batch doesn't work in JpaRepository.saveAll method - Stack Overflow
youtube,Ronios Creations,https://www.youtube.com/watch?v=rPezlHDyCuc,Ronios Creations,Airport flight Cargo Service / Flight Service method at Airports,"Airport flight Cargo Service / Flight Service method at airports Airport Cargo Service (Air Freight Handling)  Cargo Service refers to the handling and transportation of goods, mail, and freight via air transport. It involves several steps from booking to final delivery.  🔹 Main Steps:  1. Booking &",operations,55600,1759649456,,,,Ronios Creations
youtube,Interesting Tasty Farm,https://www.youtube.com/watch?v=UXM6185wQrc,Interesting Tasty Farm,Spraying from Above: How an Overhead Method Covers Slopes with Ease,"The Ergonomics of Hands-Free Spraying This improvised technique represents a grassroots solution to the physical challenges of shotcrete application, redistributing equipment weight while optimizing material placement. By using the body as a mobile support structure, the worker creates a stable spra",operations,99000,1759237954,,,,Interesting Tasty Farm
youtube,vlogize,https://www.youtube.com/watch?v=cp_BBafBLjE,vlogize,Efficiently Do Operations on C#  Async Method Result,Discover simple techniques to handle operations on results from asynchronous methods in C# . Learn how to streamline your code with effective async practices! --- This video is based on the question https://stackoverflow.com/q/63455110/ asked by the user 'jlat96' ( https://stackoverflow.com/u/989289,operations,13400,1759025012,https://stackoverflow.com/q/63455110/,https://stackoverflow.com/q/63455110/contact,apple-touch-icon@2.png,.net - Doing Operations on C# Async Method Result - Stack Overflow
youtube,vlogize,https://www.youtube.com/watch?v=kEbOMIIjD4A,vlogize,An Effective Method for Repeating Bits in C#  Using Bitwise Operations,Discover how to repeat bits left and right in C#  effectively with bitwise operations and recursion. --- This video is based on the question https://stackoverflow.com/q/63433127/ asked by the user 'Anton Fedoruk' ( https://stackoverflow.com/u/442441/ ) and on the answer https://stackoverflow.com/a/6,operations,13400,1759020331,,,,vlogize
youtube,DATAVALLEY-INC,https://www.youtube.com/watch?v=VhAMomoatY0,DATAVALLEY-INC,"Python Lists Explained | Interview Series Part-4 (2/3): List Operations, Methods & Best Practices.","Welcome to Part 4 (2/3) of our Python Interview Series! In this session, we take a deep dive into Python Lists—one of the most frequently asked topics in Python coding interviews.   What You'll Learn Today:  What are Python Lists and why are they important?  How to create and manipulate lists  List ",operations,35600,1758974777,,,,DATAVALLEY-INC
youtube,vlogize,https://www.youtube.com/watch?v=Ef0wg1ZoGv4,vlogize,Understanding Why the __setattr__ Method Doesn't Trigger During List Operations in Python,Explore why the `__setattr__` method is not being called while appending to lists in Python and learn how attribute assignment works. --- This video is based on the question https://stackoverflow.com/q/62827203/ asked by the user 'Quint' ( https://stackoverflow.com/u/7975744/ ) and on the answer htt,operations,13400,1758502967,,,,vlogize
youtube,FinEx Training,https://www.youtube.com/watch?v=czmjmXap5-E,FinEx Training,CFA Level2-FSA-Multinational Operations-Current Rate Method and Temporal Method,This video explains Multinational Operations sum with an example from FSA subject of CFA Level 2.  This channel is meant for helping CFA candidates You may follow the @FinEx Training channel on WhatsApp: https://whatsapp.com/channel/0029Va5uS7TLo4hc84sGwJ2z @FinEx Training aims to help CFA aspirants,operations,10100,1758404142,https://whatsapp.com/channel/0029Va5uS7TLo4hc84sGwJ2z,,,FinEx Training | WhatsApp Channel
youtube,vlogize,https://www.youtube.com/watch?v=6gwpxdM7bRg,vlogize,Optimizing DataFrame Operations in Python: Efficient Techniques for Working with Dictionaries,Discover how to optimize operations on dictionaries of DataFrames using Pandas in Python. This post provides a step-by-step solution to calculate and aggregate ratios effectively. --- This video is based on the question https://stackoverflow.com/q/62337355/ asked by the user 'Raghul Raj' ( https://s,operations,13400,1758056518,,,,vlogize
youtube,vlogize,https://www.youtube.com/watch?v=7jFp6U4804U,vlogize,How to Add Custom Operations to the save Method in Django Child Models,"Learn how to extend the `save` method in Django child models inheriting from a base model, ensuring your custom logic runs smoothly alongside parent operations. --- This video is based on the question https://stackoverflow.com/q/62637633/ asked by the user 'rahnama7m' ( https://stackoverflow.com/u/1",operations,13400,1757995634,,,,vlogize
youtube,ABED sir,https://www.youtube.com/watch?v=SM0A3jhc3xQ,ABED sir,Operations Research Unit 1 Quick Revision MCA 2nd Semester II Sem OR OU KU TU PU MGU SU,#or  #operationsresearch  #quickrevision  #mca  #2ndsem  #ou  #unit1  #questionanswer  #imp  #2ndsemester  #1styear  #abedsir  #2024  #2025  #pu  #ou    to support this channel pay your desired amount by clicking here  amzn0012454069@apl     ‎@ABEDsir   #ug  #degree  #osmaniauniversity  #ou  #kakati,operations,55900,1757951482,,,,ABED sir
youtube,Exam Winner Class 7,https://www.youtube.com/watch?v=MUzad30NX28,Exam Winner Class 7,Class 7 Maths | Decimal Methods/ ദശാംശരീതികൾ  | Questions | Exam Winner,USS Community Link : https://chat.whatsapp.com/HnVeD2s9NDm56eeONdS4Ql  📚 For Class 7 Free Classes & Notes: Link 1 : https://chat.whatsapp.com/HPRCjywfjzd21wbWLu2b04?mode=ems_copy_t                                                                                                                        ,eta,494000,1757688620,https://chat.whatsapp.com/HnVeD2s9NDm56eeONdS4Ql,,,WhatsApp Group Invite
youtube,Wall Street Oasis,https://www.youtube.com/watch?v=E1D9KNULbrM,Wall Street Oasis,The SECRET to My Morgan Stanley Internship 🤫,"🚀 Want to break into investment banking and other high finance careers? 🔗 Apply to WSO Academy now and join thousands who have broken into high finance 👉 https://www.wallstreetoasis.com/academy?affiliate=socialwinner-youtube   In this short, WSO Academy student Shresth shares how sending cold emails",cold email,32200,1757631606,,,,Wall Street Oasis
youtube,ebay,https://www.youtube.com/watch?v=HuIMWiEA_-Q,ebay,Workshop | Mastering eBay: Optimize Your Business Operations,"Join us at eBay Open for an in-depth session on effectively running your business on eBay. Explore key topics including managing orders and listings across web and native platforms, enhancing performance metrics, streamlining payments, utilizing the new Offers screen, and applying business policies.",operations,171000,1759410038,,,,ebay
youtube,BANKA MACHINE - RAJKOT INDIA,https://www.youtube.com/watch?v=kXr-1T8zT58,BANKA MACHINE - RAJKOT INDIA,Industrial 6' Lathe for Workshop – Mumbai | BANKA,"A #lathe machine is a precision metal-cutting and shaping tool in which the workpiece is held and rotated about a fixed axis, while one or more #cutting tools are moved in controlled paths relative to it, to perform #operations such as turning, facing, threading, drilling, boring, knurling, and part",operations,78800,1758806996,,,,BANKA MACHINE - RAJKOT INDIA
youtube,MRK STUDY,https://www.youtube.com/watch?v=E4dyEx5LiWE,MRK STUDY,Lath Operation/Mechanical Engineering/MRK STUDY,"A lathe machine is one of the most important machine tools used in workshops. Its main function is to remove material from a rotating workpiece using a cutting tool. The workpiece is held securely in a chuck, faceplate, or between centers and rotated against the tool to produce the desired shape.  L",operations,41400,1757941544,,,,MRK STUDY
youtube,Carey Nieuwhof,https://www.youtube.com/watch?v=JYbHVmodw08,Carey Nieuwhof,Make a decision! #leadership #pastor #growth #decisionmaking,"Is your church stuck in endless meetings, talking about ideas that never actually happen? In this video, I share 5 keys to building a make-it-happen culture at your church. Learn how to make decisions faster, overcome fear, execute with clarity, and lead with courage. Church leaders, this one’s for ",leadership,58600,1760187639,,,,Carey Nieuwhof
youtube,Carey Nieuwhof,https://www.youtube.com/watch?v=gCYx2IECvqQ,Carey Nieuwhof,"If you're overstaffed, you're actually hurting the mission #leadership #strategy #healthyleaders","Nearly twenty years after releasing his groundbreaking book Simple Church, Eric Geiger reflects on why complexity in your church still doesn’t scale, how complexity subtly creeps in as you grow, and what he’s learned since he started leading Mariners Church.   He also shares the great things that ha",leadership,58600,1760136130,,,,Carey Nieuwhof
youtube,Komal Auti - Wealth Coach,https://www.youtube.com/watch?v=skA2NWOjS40,Komal Auti - Wealth Coach,"💰 Salary बढ़ती जा रही है, लेकिन Wealth क्यों नहीं? | Real Reason Explained!","हर साल salary बढ़ती है, फिर भी bank balance खाली क्यों रहता है? जानिए फर्क Income और Wealth में, और कैसे बनाएं असली financial freedom.Komal Auti – Wealth Coach | Author | TEDx Speaker    Learn practical tips for financial freedom, business growth, entrepreneurship, and success mindset. Komal Auti sh",mindset,31900,1760059853,,,,Komal Auti - Wealth Coach
youtube,Komal Auti - Wealth Coach,https://www.youtube.com/watch?v=3jp_ZRBqu0g,Komal Auti - Wealth Coach,"Stop Thinking Like an Employee, Start Thinking Like an Investor 💰","Are you living with an Employee Mindset or an Investor Mindset? The way you think decides your financial destiny – rich or poor.  Employees trade time for money. Investors create assets that work for them.  If you truly want to build wealth and financial freedom, shift your mindset today from being ",mindset,31900,1759991132,,,,Komal Auti - Wealth Coach
youtube,COACH NARENDRA,https://www.youtube.com/watch?v=FdxrNdWLM_Q,COACH NARENDRA,MY TEDX MANIFESTATION - ఆకర్షణ నియమం ద్వారా నా జీవితంలోని అసాధ్యమైన కల  #coachnarendra #hooponopono,"JOIN WHATSAPP GROUP - https://chat.whatsapp.com/LS8lWWt5XveKFRnrhFluol JOIN TELEGRAM GROUP - https://t.me/+7t9dEPLxdaU1ODk9  🌟 Coach Narendra YouTube Channel – మీ జీవితాన్ని మారుస్తుంది! 🌟  🙏 స్వాగతం! మీరు Law of Attraction, Money Manifestation, Life Purpose, Ho'oponopono, మరియు Subconscious Mind Pr",eta,16800,1759296606,https://chat.whatsapp.com/LS8lWWt5XveKFRnrhFluol,,,WhatsApp Group Invite
youtube,COACH NARENDRA,https://www.youtube.com/watch?v=YdfBmDmR_-Q,COACH NARENDRA,Ted X- ఆకర్షణ నియమం ద్వారా నా జీవితంలోని అసాధ్యమైన కలను నేను ఎలా వ్యక్తపరిచాను #hooponopono #tedx,,eta,16800,1759294155,,,,COACH NARENDRA
youtube,TEDx Talks,https://www.youtube.com/watch?v=V8dPKyvPyTQ,TEDx Talks,"Upgrade Your Mindset, Double Your Business  | Rajesh Kumar Kare | TEDxMRU","In this powerful Hindi TED Talk, business coach Rajesh Kumar reveals how entrepreneurs can transform their companies by upgrading both mindset and strategy. Drawing from his own journey—from employee to founder of IPS Business Coaching—Rajesh shares five essential pillars for growth: embracing techn",mindset,43700000,1758560105,,,,TEDx Talks
youtube,TEDx Talks,https://www.youtube.com/watch?v=gfNEIarbXb8,TEDx Talks,From Ashes to Alchemy: The Power of Self-Leadership | Priyanka Dutta | TEDxYouth@DPSFaridabad,"What if every setback could become the spark for transformation? In this inspiring talk, Priyanka Dutta shares her journey from self-doubt and failure to discovering the power of self-leadership.  Through her story of rising from rejection, identity shifts, and hidden insecurities, she introduces th",leadership,43700000,1757952040,,,,TEDx Talks
youtube,Refocused Network,https://www.youtube.com/watch?v=JABRS7_dAFE,Refocused Network,"Dr. Christiane Schroeter – TEDx Speaker, Business & Wellness Coach, and Bestselling Author","Dr. Christiane Schroeter is a TEDx speaker, Business & Wellness Coach, Professor, and bestselling author who helps entrepreneurs achieve big results through small, strategic actions. As the host of the globally ranked Happy Healthy Hustle Podcast, she shares high-performance strategies that integrat",mindset,25100,1757725956,,,,Refocused Network
youtube,Tara LaFon Gooch,https://www.youtube.com/watch?v=CUUKGpW32eg,Tara LaFon Gooch,TEDx Coaching Testimonial 🎤,,leadership,12600,1757682879,,,,Tara LaFon Gooch
youtube,"Beau Eckstein, Business Ownership Coach",https://www.youtube.com/watch?v=6dqE1iZ1gpg,"Beau Eckstein, Business Ownership Coach",The Hidden Challenges of Buying a Business,"The Hidden Challenges of Buying a Business  Buying an existing business isn’t a guaranteed win—cash flow can dip, problems surface, and markets shift fast. Here’s why you need to look beyond the seller’s story and prepare for the real challenges ahead.  Book a call - http://bookwithbeau.com/ or text",mindset,15500,1759777208,http://bookwithbeau.com/,,,"Beau Eckstein | Business Advisor specializing in SBA Financing, Franchise Discovery, & Expense Reduction Strategies"
youtube,"Beau Eckstein, Business Ownership Coach",https://www.youtube.com/watch?v=gAhsyU_Egn8,"Beau Eckstein, Business Ownership Coach",How Long Does SBA Loan Pre-Qualification Take,How Long Does SBA Loan Pre-Qualification Take  Getting pre-qualified for a franchise or startup loan is all about preparation and projections. Here’s why SBA pre-qualification matters more when you’re launching a franchise than when buying an existing business.  Book a call - http://bookwithbeau.com,mindset,15500,1758895285,http://bookwithbeau.com,,,"Beau Eckstein | Business Advisor specializing in SBA Financing, Franchise Discovery, & Expense Reduction Strategies"
youtube,"Beau Eckstein, Business Ownership Coach",https://www.youtube.com/watch?v=so9JhLdPlvg,"Beau Eckstein, Business Ownership Coach",Speed Up Your Business Purchase,"Speed Up Your Business Purchase  Buying a business isn’t just about the purchase price — it’s about having enough capital, reserves, and credit strength to actually succeed long-term. In this video, Beau Eckstein breaks down how smart structuring and financial planning help buyers avoid being overle",mindset,15500,1758567652,,,,"Beau Eckstein, Business Ownership Coach"
youtube,firmsconsulting,https://www.youtube.com/watch?v=W_zUCuC3qDg,firmsconsulting,Lessons from a Painful Business Acquisition Experience (with Marcy Syms),"Marcy Syms is the former CEO of Syms Corporation and president of the Sy Syms Foundation.  📚 Get Marcy’s book, Leading with Respect here: https://shorturl.at/V0zJ3",strategy,53700,1758470460,,,,firmsconsulting
youtube,WRONG TO STRONG,https://www.youtube.com/watch?v=C0thj-LHqjU,WRONG TO STRONG,"Build a System: Discipline, Habits & Overcoming Pain #shorts","Discipline and pain are powerful, but a system is crucial for survival. A schedule, environment, and the people around someone are vital. The system in prison was easy, it was survival out. #discipline #habits #system #survival",habits,85200,1760098968,,,,WRONG TO STRONG
youtube,Jim Rohn Everyday,https://www.youtube.com/watch?v=Q1yCpbZg6PA,Jim Rohn Everyday,How to Build Systems to Actually Achieve Your Goals - Jim Rohn Motivation,"How to Build Systems to Actually Achieve Your Goals | Jim Rohn Motivation  Goals give you direction—but systems create results. 🚀 In this powerful Jim Rohn motivational video, you’ll discover how to design daily systems that make achieving your biggest dreams inevitable.  Jim Rohn explains that succ",mindset,62600,1759925431,,,,Jim Rohn Everyday
youtube,art of anna,https://www.youtube.com/watch?v=hOSBLmdHmO0,art of anna,"These are the subconscious habits quietly wrecking your gut and nervous system!! I know, because","These are the subconscious habits quietly wrecking your gut and nervous system!!  I know, because I’ve had them too lol And they kept me dysregulated, anxious, and stuck in survival mode for years.  1️⃣ Constantly rushing. That “go go go” energy? It keeps your body in fight-or-flight. You’re not sav",mindset,100000,1759867238,,,,art of anna
youtube,I Design My Life,https://www.youtube.com/watch?v=rA_lkrfR15s,I Design My Life,3 Step Sales Training Process - Transform Your Sales Team,"Building a top-performing sales team doesn’t happen by chance—it requires the right sales training system. In this video, Sumit Agarwal from I Design My Life shares 3 powerful steps every MSME business owner must implement to create consistent, high-performing sales teams. Learn how to design positi",strategy,170000,1757777500,,,,I Design My Life
youtube,Casac Benjali,https://www.youtube.com/watch?v=m1AHLgnzrd0,Casac Benjali,| Casac Benjali The Business Coach |,Subscribe to our english channel :  https://bit.ly/2JwXyQ1 Attend live workshop : +91 8714061222  പുതിയ വീഡിയോകൾ ലഭിക്കാൻ താഴെ ലിങ്കിൽ ക്ലിക്ക് ചെയ്ത Casac Benjali  ചാനൽ SUBSCRIBE ചെയ്യുക https://bit.ly/2K8KWzk  Follow us on Social Media    Facebook  -  http://www.fb.com/casacbenjali   Instagram -  ,leadership,499000,1759984385,https://bit.ly/2JwXyQ1,,,Casac Benjali - The Business Coach - YouTube
youtube,Bishal Sarkar Best Public Speaking Coach India,https://www.youtube.com/watch?v=IcIxOkPvX_8,Bishal Sarkar Best Public Speaking Coach India,You Lose Respect When You Talk Too Much 🗣️❌,"Speak, lead, and influence like a CEO—join the Masterclass today: https://link.thekingofconfidence.com/?utm_source=organic  🎤 *Stop wasting time in your life and join our NEXT World-Class Speaking Public Speaking Program* for Leaders (limited group size), get in touch with our team at +91-88803-6152",leadership,22200,1759849227,https://link.thekingofconfidence.com/?utm_source=organic,,,Bishal Sarkar -lp
youtube,Ankush Pare - Stammering & Speaking Coach,https://www.youtube.com/watch?v=RBmsbF3sFM0,Ankush Pare - Stammering & Speaking Coach,Master Public Speaking & Overcome Stage Fear in 109 minutes - Full Course,Apply Here For FREE CONSULTATION: Watch 90 Min Free Masterclass & Get Complete Stammering Solution Strategy With Steps & 95% Fluency In 21 Days Only.  CLICK TO WATCH - https://ankushpare.com/freetraining/ 🔗  🆓 Get FREE Access Now  🎥 Full Masterclass + Fluency Training → https://youtu.be/9Inj5cRyR-k?,mindset,58100,1759761031,https://ankushpare.com/freetraining/,https://ankushpare.com/freetraining/speaking,support@ankushpare.com,Free Stammering Masterclass - Ankush Pare
youtube,Bishal Sarkar Best Public Speaking Coach India,https://www.youtube.com/watch?v=LkaAAGzlB40,Bishal Sarkar Best Public Speaking Coach India,3 Hacks to Unlock Unshakable Confidence 🔓😲,"Speak, lead, and influence like a CEO—join the Masterclass today: https://link.thekingofconfidence.com/?utm_source=organic  🎤 *Stop wasting time in your life and join our NEXT World-Class Speaking Public Speaking Program* for Leaders (limited group size), get in touch with our team at +91-88803-6152",leadership,22200,1759590040,https://link.thekingofconfidence.com/?utm_source=organic,,,Bishal Sarkar -lp
youtube,Writer Hit ?,https://www.youtube.com/watch?v=D6Z1YFMBzac,Writer Hit ?,Only Few People Understand This Food Habits |Challenge Urself|#success #health #mindset #life,,mindset,14200,1760153780,,,,Writer Hit ?
youtube,Moonbug Kids - Sing Along With Me!,https://www.youtube.com/watch?v=r2-__VdvOeI,Moonbug Kids - Sing Along With Me!,The ultimate sports CHALLENGE! 🏏 CoComelon Sports & Healthy Habits #shorts #sports,"Join JJ 👶 and his friends 👧🧒 in this fun Cocomelon game 🎉! They take mystery objects 🎾🏐🥎 out of a box 🎁 and try to guess which sport it belongs to 🤔✨. Sing, laugh 😂, and learn about different sports 🌈💖 in this cheerful, colorful short!  With bright animations 🌟, playful music 🎵, and adorable charact",habits,16900000,1760029281,,,,Moonbug Kids - Sing Along With Me!
youtube,Poonam voice ,https://www.youtube.com/watch?v=LZ3MAbUoP84,Poonam voice ,"Making money is easy, but changing your habits is the real challenge. 💡💪 #shorts #motivation","Making money can come and go, but true success comes from changing your habits and mindset. It’s easy to earn, but transforming the daily routines, discipline, and thought patterns that shape your life is the real challenge. Focus on building positive habits, staying consistent, and growing yourself",mindset,16900,1760016661,,,,Poonam voice 
youtube,Matthew Ryder,https://www.youtube.com/watch?v=jnb1jT-WFaY,Matthew Ryder,"Watch This Before You Buy ""Sales Training"" In 2025",Join my sales membership: Check out the membership here https://www.youtube.com/channel/UCIoIgKSN9Y20tAN2fY3-JUA/join  Join my discord community https://discord.gg/Jyf8E72S  Get more of me here  https://www.instagram.com/realmattryder/  Get higher pick up rates here https://www.dialer.io  0:00 – Why,sales coaching,18200,1758648017,https://www.youtube.com/channel/UCIoIgKSN9Y20tAN2fY3-JUA/join,,support@dialer.io,Matthew Ryder - YouTube
youtube,Wholesome Financials,https://www.youtube.com/watch?v=FKjjV7b-MtY,Wholesome Financials,Buy the Coaching,"💡 We paid $7,000 for business coaching — and it helped us get started faster and move quicker toward our end goal: making money 💵.   🙌 I encourage you to do the same. Inside our program, we walk alongside business owners and show them exactly how to secure $100,000+ in funding 🚀.   ✅ We’ve already h",business coaching,12700,1758297851,,,,Wholesome Financials
youtube,Finance With Sharan,https://www.youtube.com/watch?v=n6xMWsyQ6tE,Finance With Sharan,🤣 Job interviews or bootcamp? Army Sharan doesn’t play around.,From crying in the washroom to “my mom says I’m special”… candidates were dropping faster than stocks in 2008. 📉  But then came the twist → the HR hero who schooled Sharan with just two words: Odoo Recruitment.  One dashboard. Auto scheduling. Smooth pipeline. No drama. ✅ Sharan’s face? Priceless. 😂,pipeline,3570000,1759667464,,,,Finance With Sharan
youtube,Insider Opinion,https://www.youtube.com/watch?v=ox4Q2j20fEI,Insider Opinion,Public Speaking as a Side-Skill | Learn to become an efficient Public Speaker #podcast #skills #tips,"#PublicSpeaking #SideHustle #PublicSpeakingTips #CareerGrowth #CommunicationSkills #Storytelling  What if your voice Could make you money?   With the right training & approach you can use your voice and style to become an effective public speaker to earn money, travel & live a life that you want.  I",mindset,10100,1760002839,,,,Insider Opinion
